635,THE AMERICAN SWAN LIFESTYLE COMPANY PRIV,Singapore,AMERICAN SWAN ASIA PACIFIC PTE. LTD.,NEW DELHI,"Wholesale of textiles, fabrics, yarn, household linen, articles of clothing, floor coverings and tapestry,",73.24,1.17,
636,SEMBCORP UTILITIES INDIA PVTLTD.,Singapore,Cheng Guan Tan,NEW DELHI,Other business support service activities n.e.c.,0.00,0.00,
637,SKYMET WEATHER SERVICES PRIVATE LIMITED,Singapore,DMG Information ASIA pACIFIC pTE. lTD.,NEW DELHI,Weather forecasting activities,148.73,2.38,
638,WACOM INDIA PVT LTD,Singapore,WACOM SINGAPORE PTE LTD,NEW DELHI,Wholesale of computers and computer peripheral equipment,0.12,0.00,
639,THE AMERICAN SWAN LIFESTYLE COMPANY PRIV,Singapore,AMERICAN SWAN ASIA PACIFIC PTE. LTD.,NEW DELHI,"Wholesale of textiles, fabrics, yarn, household linen, articles of clothing, floor coverings and tapestry,",34.46,0.55,
640,BRIGHTLITE TECHNOSYSTEMS PRIVATE LIMITED,Singapore,FOOK ON KOH,NEW DELHI,Manufacture of electric lighting equipment,0.05,0.00,
641,PEOPLE PRIME WORLDWIDE PRIVATE LIMITED,Singapore,NAVTEJ SINGH DEOL AND HERMANJIT DEOL,NEW DELHI,Management consultancy activities,5.68,0.09,
642,INASRA TECHNOLOGIES PRIVATE LTD,Singapore,Jayesh Arvind Parekh,CHENNAI,Travel agency activities,0.25,0.00,
643,BRIGHTLITE TECHNOSYSTEMS PRIVATE LIMITED,Singapore,LAM CHIANG LIM,NEW DELHI,Manufacture of electric lighting equipment,0.05,0.00,
644,MAX BUPA HEALTH INSURANCE CO LTD,Singapore,BUPA SINGAPORE HOLDING PTE LTD,NEW DELHI,Non-life insurance,96.20,1.54,
645,BT GLOBAL BUSINESS SERVICES PRIVATE LIMI,Singapore,BT SINGAPORE PTE LTD,NEW DELHI,Data processing activities including report writing,100.00,1.60,
646,RELIGARE ENTERPRISES LTD,Singapore,Kayumers Mehta,NEW DELHI,OTHER FINANCIAL SERVICES N.E.C,0.09,0.00,
647,QUREEUS EDUVENTURES PRIVATE LIMITED,Singapore,MORPHEUS ANATA PTE LTD,NEW DELHI,Educational support services,0.50,0.01,
648,INDIAN HEALTH ORGANISATION PVT LTD,Singapore,AETNA GLOBAL BENEFITS (SINGAPORE) PTE LT,NEW DELHI,Other human health activities n.e.c. (including independent ambulance activities),36.73,0.59,
649,FITNESS FIRST INDIA PVT,Singapore,FITNESS FIRST SINGAPORE PTE LTD,NEW DELHI,Other sports activities,60.00,0.96,
Sl. No,Name of Indian Company,Country,Name of Foreign Collaborator,RBI Regional Office,Item of Manufacture,Amount of FDI Inflows,,
,,,,,,(In Rs million),(In US$ million),
,LTD,,,,,,,
650,TRUCKSFIRST SERVICES PRIVATE LIMITED,Singapore,SINGAPORE POST LTD,NEW DELHI,Motorised road freight transport,63.35,1.01,
651,YALAMANCHILI MANUFACTURING PVT LTD,Singapore,SOCIOPRENEUR PTE. LTD.,MUMBAI,"MANUFACTURE OF COMPUTER TERMINALS, LIKE AUTOMATIC TELLER MACHINES (ATMS),POINT-OF-SALE (POS) TERMINALS",0.94,0.02,
652,APAR TECHNOLOGIES PVT LTD,Singapore,Apar Technologies Pte. Ltd,MUMBAI,Other information technology and computer service activities n.e.c,2.35,0.04,
653,KVR INDUSTRIAL PARK ( KVR METALS & ALLOY,Singapore,ILP II VENTURES I PTE LTD,MUMBAI,"Storage and warehousing n.e.c.[Includes general merchandise warehouses and warehousing of furniture,",49.99,0.80,
654,AIREFF DETOX (INCINERATION) LTD,Singapore,ASIA ENVIRO HOLDINGS PTE LTD,MUMBAI,"Treatment of waste water or sewer by means of physical, chemical or biological processes",300.00,4.80,
655,BHARAT MUMBAI CONTAINER TERMINALS PVT LT,Singapore,PSA BHARAT INVESTMENTS PTE. LTD.,MUMBAI,Cargo handling incidental to water transport,506.40,8.11,
656,TOTO INDIA INDUSTRIES PVT LTD,Singapore,"toto asia oceania pte ltd., singapore",MUMBAI,"Manufacture of metal sanitaryware such as baths, sinks, washbasins and similar articles",350.00,5.60,
657,VNS SWITCHGEAR INDIA PVT LTD,Singapore,S-Team Switchgear Pvt Ltd,MUMBAI,Manufacture of electricity distribution and control apparatus (electrical apparatus for switching or,1.50,0.02,
658,VNS SWITCHGEAR INDIA PVT LTD,Singapore,Mr Ang Choon Cheng & Ms Yap Geok Khim,MUMBAI,Manufacture of electricity distribution and control apparatus (electrical apparatus for switching or,0.26,0.00,
659,VNS SWITCHGEAR INDIA PVT LTD,Singapore,S-Team Switchgear Pvt. Ltd.,MUMBAI,Manufacture of electricity distribution and control apparatus (electrical apparatus for switching or,2.68,0.04,
660,VNS SWITCHGEAR INDIA PVT LTD,Singapore,S-Team Switchgear Pvt. Ltd.,MUMBAI,Manufacture of electricity distribution and control apparatus (electrical apparatus for switching or,2.17,0.03,
661,VNS SWITCHGEAR INDIA PVT LTD,Singapore,S-Team Switchgear Pvt. ltd.,MUMBAI,Manufacture of electricity distribution and control apparatus (electrical apparatus for switching or,1.57,0.03,
662,VIKING LIFE SAVING EQUIPMENT MUMBAI PVT,Singapore,Viking Life Saving Equipment Pvt Ltd,MUMBAI,"Repair of transport equipment, except motor vehicles",3.05,0.05,
663,AQUABRANE WATER TECHNOLOGIES PVT LTD,Singapore,AQUABRANE HOLDINGS PTE LTD,MUMBAI,Manufacture of filtering and purifying machinery or apparatus for liquids and gases,5.40,0.09,
664,PACORINI METALS PVT LTD,Singapore,PRCORINI METALS(ASIA) PTE LTD,MUMBAI,"Storage and warehousing n.e.c.[Includes general merchandise warehouses and warehousing of furniture,",0.00,0.00,
665,PACORINI METALS PVT LTD,Singapore,PMA HOLDINGS PTE LTD,MUMBAI,"Storage and warehousing n.e.c.[Includes general merchandise warehouses and warehousing of furniture,",0.10,0.00,
666,CLEARWATER CAPITAL PARTNERS INDIA PVT.LT,Singapore,iINDIA CREDIT PVT LTD,MUMBAI,Other credit granting,"4,233.84",67.80,
667,AMANSA INVESTMENT ADVISORS PVT LTD,Singapore,AAP Advisors Pte Ltd,MUMBAI,Activities auxiliary to financial service activities n.e.c.,32.50,0.52,
668,GLOBAL SOURCES EXHIBITIONS AND EVENTS IN,Singapore,fertile valley pte ltd,MUMBAI,Organization of conventions and trade shows,1.79,0.03,
669,GLOBAL SOURCES EXHIBITIONS AND EVENTS IN,Singapore,FERTILE VALLEY PTE LTD,MUMBAI,Organization of conventions and trade shows,1.69,0.03,
670,VOLTAS WATER SOLUTIONS PVT LTD,Singapore,DOW CHEMICAL PACIFIC SINGAPORE PVT LTD,MUMBAI,"Water collection, treatment and supply",3.61,0.06,
671,RML Information Services Private Limited,Singapore,THOMSON REUTERS CORPORATION PTE LTD,MUMBAI,Other information service activities n.e.c.,16.70,0.27,
672,MONTAPLAST INDIA PVT LTD,Singapore,Aldebaran Investment Asia Pacific PTE Lt,MUMBAI,"Manufacture of parts and accessories of bodies for motor vehicles such as safety belts, airbags, doors,",23.94,0.38,
673,BC EXPO INDIA PVT LTD,Singapore,MMI ASIA PTE LTD,MUMBAI,Organization of conventions and trade shows,16.25,0.26,
674,SIMITRI INDIA PVT LTD,Singapore,Simitri Group International PTE Ltd.,MUMBAI,Management consultancy activities,1.09,0.02,
675,I CARE LEARNING PL,Singapore,I Care Life PTE Ltd,MUMBAI,Technical and vocational education below the level of higher education except for handicapped,4.40,0.07,
Sl. No,Name of Indian Company,Country,Name of Foreign Collaborator,RBI Regional Office,Item of Manufacture,Amount of FDI Inflows,,
,,,,,,(In Rs million),(In US$ million),
676,IPG ADVERTISING AND BUSINESS SERVICES PV,Singapore,ipg sINGAPORE hOLDING pte lTD,MUMBAI,Advertising,47.90,0.77,
677,GLOBAL GASES INDIA PVT LTD,Singapore,DEEPAK MEHTA,MUMBAI,"Manufacture of liquefied or compressed inorganic industrial or medical gases (elemental gases, liquid",20.24,0.32,
678,PALO ALTO NETWORKS INDIA PVT LTD,Singapore,Palo Alto Networks (Singapore) Holding C,MUMBAI,Advertising,0.10,0.00,
679,PROFEX ENERGY PRIVATE LIMITED,Singapore,Sinvest Holdings Pte Ltd,HYDERABAD,Services incidental to off shore oil extraction,1.34,0.02,
680,SIMITRI INDIA PVT LTD,Singapore,SIMITRI HONGKONG LTD,MUMBAI,Management consultancy activities,0.01,0.00,
681,SEMBCORP GAYATRI O & M COMPANY PRIVATE L,Singapore,"Sembcorp Utilities  PTE, Singapore",HYDERABAD,Electric power generation by coal based thermal power plants,0.70,0.01,
682,AF FERRARI SECURE LOGITECH PRIVATE LIMI,Singapore,MC RUSH PTE LTD,NEW DELHI,Motorised road freight transport,2.00,0.03,
683,NV VOGTSOLAR ENERGY INDIA PVT. LTD,Singapore,NV VOGT SINGAPORE PTE LTD,NEW DELHI,Electric power generation using solar energy,1.84,0.03,
684,ELEMENTIA WELLNESS PRIVATE LIMITED,Singapore,SINGAPORE ANGEL NETWORK PTE LTD,NEW DELHI,Other human health activities n.e.c. (including independent ambulance activities),1.08,0.02,
685,SIMEC INDUS RESOURCES PVT LTD,Singapore,PIMS Investment PTE. Ltd.,NEW DELHI,WHOLESALE TRADE IN WASTES AND MENTAL SCRAPS,305.29,4.89,
686,AGODA INTERNATIONAL INDIA PVT LTD,Singapore,AGODA INTERNATIONAL PTE LTD,NEW DELHI,Other business support service activities n.e.c.,0.05,0.00,
687,CJHG RESTAURANT (G.D) INDIA PRIVATE LIMI,Singapore,CJHG Holdings(s) PTE LTD,NEW DELHI,Bars and Restaurants with bars,5.00,0.08,
688,TALENT UNLIMITED ONLINE SERVICES PRIVATE,Singapore,SHUBHAM GUPTA,NEW DELHI,Providing software support and maintenance to the clients,0.41,0.01,
689,AECOM INDIA PVT LTD,Singapore,AECOM SINGAPORE PTE LTD,NEW DELHI,Architectural and engineering activities and related technical consultancy,62.88,1.01,
690,REAL TIME MANAGEMENT CONSULTANCY SERVICE,Singapore,ANKUR GUPTA,NEW DELHI,"Accounting, bookkeeping and auditing activities",3.06,0.05,
691,BRITVIC INDIA MANUFACTURING PVT LTD,Singapore,BRITVIC SOFT DRINKS PTE. LTD.,MUMBAI,Manufacture of soft drinks,85.00,1.36,
692,NETIZEN PROPERTIES PVT LTD,Singapore,BIKRAMJIT SINGH THAKRAL,MUMBAI,Real estate activities with own or leased property,23.61,0.38,
693,JIGRAHAK MOBILITY SOLUTIONS (P) LTD.,Singapore,NEXT GENERATION PAYMENTS PRIVATE LIMITED,BANGALORE,Other information service activities n.e.c.,339.90,5.44,
694,CATHOLIC SYRIAN BANK LTD,Singapore,SAT PAL KHATTAR,KOCHI,"Other financial service activities, except insurance and pension funding activities, n.e.c.",63.98,1.02,
695,ECONOMY HOTELS INDIA SERVICES PVT LTD,Singapore,AAPC SINGAPORE PTE. LTD.,NEW DELHI,"Provision of short stay accommodation n.e.c. (e.g. holiday homes, private guest houses etc.)",79.40,1.27,
696,INASRA TECHNOLOGIES PRIVATE LTD,Singapore,Sadeesh Raghavan,CHENNAI,Travel agency activities,0.25,0.00,
697,HITACHI AUTOMOTIVE SYSTEMS PVT LTD,Singapore,HITACHI ASIA LTD,NEW DELHI,"Manufacture of motor vehicle electrical equipment, such as generators, alternators, spark plugs, ignition",500.00,8.01,
698,INBISCO INDIA PRIVATE LIMITED,Singapore,Equidad International Pte Limited,HYDERABAD,"Manufacture of biscuits, cakes, pastries, rusks etc.",149.90,2.40,
699,INBISCO INDIA PRIVATE LIMITED,Singapore,Equidad International Pte Limited,HYDERABAD,"Manufacture of biscuits, cakes, pastries, rusks etc.",216.40,3.47,
700,PROCESS NINE TECHNOLOGIES PRIVATE LIMITE,Singapore,GLOBAL SPORTS BROADCAST SERVICES PTE LTD,NEW DELHI,"Writing , modifying, testing of computer program to meet the needs of a particular client excluding web-page",0.47,0.01,
701,UNITECH REALTY PROJECTS LIMITED,Singapore,BSREP INDIA OFFICE HOLDINGS II PTE LTD,NEW DELHI,Construction of buildings carried out on own-account basis or on a fee or contract basis,431.33,6.91,
702,SIMITRI INDIA PVT LTD,Singapore,Simitri Group International Pte.,MUMBAI,Management consultancy activities,1.49,0.02,
703,XJ ELEVATOR INDIA PRIVATE LIMITED (EAR:,Singapore,VARUN GULABRAI ASHWANI,NEW DELHI,"Installation of elevators, escalators",3.58,0.06,
704,CONSILIUM SOFTWARE PRIVATE LIMITED,Singapore,Consilium Software INC(PTE) LTD,NEW DELHI,Providing software support and maintenance to the clients,17.86,0.29,
705,NEXIF (INFRACO) INDIA PRIVATE LIMITED,Singapore,NEXIF (INFRANCO) MANAGEMENT PTE LTD,NEW DELHI,Management consultancy activities,5.00,0.08,
706,SIGMA SUSTAINABILITY INSTITUTE (INDIA) P,Singapore,SIGMA SUSTAINABILITY INSTITUTE PTE LTD,BANGALORE,Management consultancy activities,0.10,0.00,
707,CARAWAY DEVELOPMENT,Singapore,CARAWAY PTE LTD,BANGALORE,Mining of mica,0.50,0.01,
Sl. No,Name of Indian Company,Country,Name of Foreign Collaborator,RBI Regional Office,Item of Manufacture,Amount of FDI Inflows,,
,,,,,,(In Rs million),(In US$ million),
,CENTRE (INDIA) PRIVA,,,,,,,
708,HYPERLOCAL TECHNOLOGY PRIVATE LIMITED,Singapore,HYPERLOCAL TECHNOLOGY PTE LTD,BANGALORE,Wholesale of computers and computer peripheral equipment,15.37,0.25,
709,NAVSEMI TECHNOLOGIES PVT LTD,Singapore,NAVSEMI ENERGY PTE LTD,NEW DELHI,Research and experimental development on natural sciences and engineering,9.40,0.15,
710,TEN LIFESTYLE MANAGEMENT INDIA PVT LTD,Singapore,Andrew Long,MUMBAI,Other reservation service and related activities,0.00,0.00,
711,NIDEC INDIA PVT LTD,Singapore,NIDEC SINGAPORE PTE LTD,NEW DELHI,Manufacture of electric motors (except internal combustion engine starting motors),243.70,3.90,
712,FINDIRECT SERVICES PVT LTD,Singapore,NWS DIGITAL ASIA PTE,MUMBAI,Other information service activities n.e.c.,31.10,0.50,
713,SEMBCORP UTILITIES INDIA PVTLTD.,Singapore,Sembcorp Utilities PTE Ltd.,NEW DELHI,Other business support service activities n.e.c.,0.50,0.01,
714,SN POWER MARKETS PRIVATE LIMITED,Singapore,SN POWER HOLDING SINGAPORE PTE LTD,NEW DELHI,"Collection and distribution of electric energy to households, industrial, commercial and other users",14.98,0.24,
715,BT GLOBAL BUSINESS SERVICES PRIVATE LIMI,Singapore,BT SINGAPORE PTE LTD,NEW DELHI,Data processing activities including report writing,50.00,0.80,
716,KREDENCE MULTI TRADING LIMITED,Singapore,AAR TEE GROUP PTE LTD,NEW DELHI,"Activities of commission agents dealing in wholesale trade inwood, paper, skin, leather and fur, fuel,",185.79,2.98,
717,FM GLOBAL LOGISTICS INDIA PVT LTD,Singapore,1GLOBAL ENTERPRISES PTE LTD,CHENNAI,Activities of shipping cargo agents,2.23,0.04,
718,YOUREKA OUTBOUND SERVICES PRIVATE LIMITE,Singapore,XSEED EDUCATION PTE LTD,CHENNAI,"Camping grounds, recreational vehicle parks and trailer parks",1.51,0.02,
719,MW HIGH TECH PROJECTS INDIA PVT LTD,Singapore,MW Singapore Pte Ltd,HYDERABAD,Architectural and engineering activities and related technical consultancy,385.68,6.18,
720,KYCR COIL INDUSTRIES INDIA PVT.LTD,Singapore,Delwara Corporation SG Pvt. Ltd.,GUWAHATI,"Manufacture of steel in ingots or other primary forms, and other semifinished products of steel",1.53,0.02,
721,KKR INDIA ASSET FINANCE PRIVATE LIMITED,Singapore,KKR India Asset Investments Pte Ltd,CHENNAI,Other credit granting,"2,695.47",43.16,
722,ARROWW AGRI PRIVATE LIMITED,Singapore,Kunasunderi Muthukkumar,CHENNAI,Manufacture of prepared meals and dishes,0.26,0.00,
723,BIOMETRONIC TECHNOLOGY PRIVATE LIMITED,Singapore,SRIDHARAN PRABHU,NEW DELHI,Manufacture of computers and peripheral equipment n.e.c.,4.25,0.07,
724,FASHION 365 DISTRIBUTION PVT LTD,Singapore,AADIL HOLDINGS PTE LTD,BANGALORE,"Wholesale of textiles, fabrics, yarn, household linen, articles of clothing, floor coverings and tapestry,",2.39,0.04,
725,JENOPTIK PRIVATE LIMITED,Singapore,JENOPTIK ASIA PACIFIC PTE LTD,BANGALORE,"Wholesale of other machinery, equipment and supplies n.e.c. including computer-controlled machine tools",50.00,0.80,
726,SKYMET WEATHER SERVICES PRIVATE LIMITED,Singapore,DMG Information Asia Pacific Pte. Ltd.,NEW DELHI,Weather forecasting activities,1.26,0.02,
727,ONE 97 COMMUNICATIONS LIMITED,Singapore,ALIPAY SINGAPORE E-COMMERCE PTE LIMITED,NEW DELHI,Other information service activities n.e.c.,"4,007.25",64.17,
728,EVERSENDAI CONSTRUCTION PVT LTD,Singapore,Eversendai Construction (S) Pte Limited,CHENNAI,"Manufacture of metal frameworks or skeletons for construction and parts thereof ((towers, masts, trusses,",602.17,9.64,
729,INASRA TECHNOLOGIES PRIVATE LTD,Singapore,Sadeesh Raghavan,CHENNAI,Travel agency activities,0.38,0.01,
730,INASRA TECHNOLOGIES PRIVATE LTD,Singapore,Jayesh Arvind Parekh,CHENNAI,Travel agency activities,0.38,0.01,
731,MOONLANDER E- COMMERCE PRIVATE LIMITED,Singapore,QUALCOMM ASIA PACIFIC PTE. LTD,BANGALORE,Wholesale of fruits & vegetables,3.00,0.05,
732,HARNESS ENERGY PRIVATE LTD,Singapore,HARNESS ENERGY PTE LTD,CHENNAI,Electric power generation using other non conventional sources,2.59,0.04,
733,XSEED EDUCATION PRIVATE LIMITED,Singapore,XSEED Education Pte. Ltd.,CHENNAI,Higher education in other professional/ vocational courses leading to a degree or equivalent,0.10,0.00,
734,PAYFRONT TECHNOLOGIES INDIA PRIVATE LIMI,Singapore,PAYFRONT TECHNOLOGIES PTE LTD,BANGALORE,Human resources provision and management of human resources functions,0.10,0.00,
735,PRACTO TECHNOLOGIES PRIVATE LIMITED,Singapore,PRACTO PTE LTD,BANGALORE,Other information technology and computer service activities n.e.c,16.59,0.27,
736,ORION ENGINEERING,Scotland,ORION ENGINEERING SERVICES LIMITED,MUMBAI,Services incidental to off shore oil,2.05,0.03,
Sl. No,Name of Indian Company,Country,Name of Foreign Collaborator,RBI Regional Office,Item of Manufacture,Amount of FDI Inflows,,
,,,,,,(In Rs million),(In US$ million),
,SERVICES PVT LTD,,,,extraction,,,
737,M.B.A. CONSULTING INDIA PRIVATE LIMITED,Slovakia,MARIAN MOKOS,NEW DELHI,Other information service activities n.e.c.,0.50,0.01,
738,M.B.A. CONSULTING INDIA PRIVATE LIMITED,Slovakia,MARIAN MOKOS,NEW DELHI,Management consultancy activities,2.40,0.04,
739,M.B.A. CONSULTING INDIA PRIVATE LIMITED,Slovakia,MARIAN MOKOS,NEW DELHI,Management consultancy activities,0.35,0.01,
740,SANCHEZAGULLO LEATHERS (INDIA) PRIVATE L,Spain,Francisco Sanchez Mora,CHENNAI,"Manufacture of leather footwear such as shoes, sandals, chappals, leathercum rubber/plastic cloth sandles",0.59,0.01,
741,COLOROBBIA CHEMICALS INDIA PRIVATE LIMIT,Spain,COLOROBBIA ESPANA SA,AHMEDABAD,"Manufacture of prepared pigments, prepared opacifiers and prepared colours, vitrifiable enamels and glazes",49.50,0.79,
742,GREENEEM AGRI PVT LTD,Spain,espa fibrac sl,CHENNAI,"Manufacture of carpets, and other floor coverings made of jute, mesta and coir",11.11,0.18,
743,AMPO VALVES INDIA PRIVATE LIMITED,Spain,AMPO S COOP,CHENNAI,"Manufacture of other pumps, compressors, taps and valves etc.",186.14,2.98,
744,MIBOR INDIA PRIVATE LIMITED,Spain,"MB Mibor Internacional SLU,",NEW DELHI,Wholesale of plastic materials in primary forms,0.10,0.00,
745,MIBOR INDIA PRIVATE LIMITED,Spain,Activos Immobiliarios Mibor SLU,NEW DELHI,Wholesale of plastic materials in primary forms,0.00,0.00,
746,OHL CONSTRUCTION INDIA PVT LTD,Spain,"OBRASCON HUARTE LAIN,CONSTRUCCION INTERN",NEW DELHI,"Construction and maintenance of motorways, streets, roads, other vehicular and pedestrian ways, highways,",24.75,0.40,
747,RELIGARE ENTERPRISES LTD,Spain,Upendra Hiralal Vithalani,NEW DELHI,OTHER FINANCIAL SERVICES N.E.C,0.04,0.00,
748,ARIHANT TECHNOCAST INDIA PRIVATE LTD,Spain,International Casting Investment S.L,CHENNAI,Manufacture of other iron and steel casting and products thereof,4.25,0.07,
749,GRUPO COSMOS INDIA PRIVATE LIMITED,Spain,GRUPO COSMOS XXI S.L,CHENNAI,"Forging, pressing, stamping and roll-forming of metal; powder metallurgy",3.97,0.06,
750,ORDAIN HEALTH CARE GLOBAL PVT LTD,Spain,CHEMO ESPANA S.L,CHENNAI,"Manufacture of medicinal substances used in the manufacture of pharmaceuticals: antibiotics, endocrine",106.97,1.71,
751,GRUPO COSMOS INDIA PRIVATE LIMITED,Spain,GRUPO COSMOS XXI S.L,CHENNAI,"Forging, pressing, stamping and roll-forming of metal; powder metallurgy",40.77,0.65,
752,CERTARA SOFTWARE INDIA PRIVATE LIMITED,Spain,CERTARA SPAIN SL (FORMERLY TRIPOS INTERN,BANGALORE,Providing software support and maintenance to the clients,0.10,0.00,
753,CL SYNERGY INDIA PRIVATE LIMITED,Sri Lanka,CL Synergy Pvt Ltd,CHENNAI,Freight rail transport,2.04,0.03,
754,CL SYNERGY INDIA PRIVATE LIMITED,Sri Lanka,CL Synergy Pvt Ltd,CHENNAI,Freight air transport services,1.01,0.02,
755,CL SYNERGY INDIA PRIVATE LIMITED,Sri Lanka,Kariyapperumma Mudiyanselange Janaka Cha,CHENNAI,Freight rail transport,0.00,0.00,
756,FASHION 365 DISTRIBUTION PVT LTD,Sri Lanka,TIMEX GARMENTS (PRIVATE) LIMITED,BANGALORE,"Wholesale of textiles, fabrics, yarn, household linen, articles of clothing, floor coverings and tapestry,",3.98,0.06,
757,OSTBERG INDIA PRIVATE LIMITED,Sweden,OSTBERG GROUP AB,NEW DELHI,Manufacture of electric fans (except exhaust fans),19.41,0.31,
758,AVT GAVIA FOODS PVT LTD,Sweden,Gavia India AB,CHENNAI,Manufacture of other bakery products n.e.c.,2.42,0.04,
759,SCA HYGIENE PRODUCTS INDIA PVT. LTD.,Sweden,SCA HYGIENE HOLDING AB,MUMBAI,"Manufacture of preparations for oral or dental hygiene (includes manufacture of toothpastes, toothpowder,",90.00,1.44,
760,EG POWER ELECTRONICS INDIA PRIVATE LTD,Sweden,Elektronik Gruppen BK AB,CHENNAI,Wholesale of other electronic equipments and parts thereof,4.78,0.08,
761,AVT GAVIA FOODS PVT LTD,Sweden,GAVIA INDIA AB,CHENNAI,"Other semi-processed, processed or instant foods n.e.c. except farinaceous products and malted foods",7.50,0.12,
762,JACOBI CARBONS INDIA PRIVATE LIMITED,Sweden,Jacobi Carbons AB,CHENNAI,Manufacture of organic and inorganic chemical compounds n.e.c.,0.38,0.01,
763,JACOBI CARBONS INDIA PRIVATE LIMITED,Sweden,Jacobi Carbons AB,CHENNAI,"Manufacture of organic and
inorganic chemical compounds n.e.c.",99.90,1.60,
Sl. No,Name of Indian Company,Country,Name of Foreign Collaborator,RBI Regional Office,Item of Manufacture,Amount of FDI Inflows,,
,,,,,,(In Rs million),(In US$ million),
764,AQ MECHANICAL &ELECTRICAL MFG INDIA LTD,Sweden,AQ GROUP AB,MUMBAI,Manufacture of electricity distribution and control apparatus (electrical apparatus for switching or,31.52,0.50,
765,RISHIKESH HOLISTIC HOSPITALITY PVT.LTD.,Sweden,Sophia Katharina Sundquist Backstigen An,KANPUR,"Hotels and Motels, inns, resorts providing short term lodging facilities includes accommodation in house",1.23,0.02,
766,SCHOOL OF APPLIED LEARNING IN TESTING PV,Switzerland,THOMAS MULLER,JAIPUR,Other information technology and computer service activities n.e.c,1.19,0.02,
767,SCHOOL OF APPLIED LEARNING IN TESTING PV,Switzerland,THOMAS MULLER,JAIPUR,Other information technology and computer service activities n.e.c,3.12,0.05,
768,SCHOOL OF APPLIED LEARNING IN TESTING PV,Switzerland,THOMAS MULLER,JAIPUR,Other information technology and computer service activities n.e.c,1.89,0.03,
769,NEOPERL INDIA PVT LTD,Switzerland,NEOPERL HOLDING AG,NEW DELHI,"Manufacture of non-refractory ceramic sanitary wares: sinks, baths, watercloset pans, flushing cistern",37.75,0.60,
770,EXPERT BIO-PRODUCTS PVT LTD,Switzerland,Greenvalue S.A.,CHANDIGARH`,Manufacture of other animal feeds n.e.c.,2.25,0.04,
771,KINGDOM RETREATS AND SPAS INDIA PRIVATE,Switzerland,Simon Caprez,CHENNAI,"Provision of short stay
accommodation n.e.c. (e.g. holiday homes, private guest houses etc.)",7.65,0.12,
772,KINGDOM RETREATS AND SPAS INDIA PRIVATE,Switzerland,Simon Caprez,CHENNAI,"Provision of short stay accommodation n.e.c. (e.g. holiday homes, private guest houses etc.)",41.85,0.67,
773,KINGDOM RETREATS AND SPAS INDIA PRIVATE,Switzerland,Simon Caprez,CHENNAI,"Provision of short stay accommodation n.e.c. (e.g. holiday homes, private guest houses etc.)",0.19,0.00,
774,KINGDOM RETREATS AND SPAS INDIA PRIVATE,Switzerland,Simon Caprez,CHENNAI,"Provision of short stay accommodation n.e.c. (e.g. holiday homes, private guest houses etc.)",0.37,0.01,
775,YPSOMED INDIA PVT LTD,Switzerland,YPSOMED AG,NEW DELHI,Manufacture of other medical and dental instruments n.e.c.,4.00,0.06,
776,HUBER + SUHNER ELECTRONICS PVT. LTD.,Switzerland,HUBER SUHNER FINANCE AG,NEW DELHI,Manufacture of fibre optic cables for data transmission or live transmission of images,70.00,1.12,
777,YPSOMED INDIA PVT LTD,Switzerland,YPSOMED AG,NEW DELHI,Manufacture of other medical and dental instruments n.e.c.,5.21,0.08,
778,YPSOMED INDIA PVT LTD,Switzerland,YPSOMED HOLDING AG,NEW DELHI,Manufacture of other medical and dental instruments n.e.c.,0.00,0.00,
779,YPSOMED INDIA PVT LTD,Switzerland,YPSOMED AG,NEW DELHI,Manufacture of other medical and dental instruments n.e.c.,0.10,0.00,
780,YPSOMED INDIA PVT LTD,Switzerland,YPSOMED HOLDING AG,NEW DELHI,Manufacture of other medical and dental instruments n.e.c.,0.00,0.00,
781,YPSOMED INDIA PVT LTD,Switzerland,YPSOMED AG,NEW DELHI,Manufacture of other medical and dental instruments n.e.c.,2.35,0.04,
782,YPSOMED INDIA PVT LTD,Switzerland,YPSOMED HOLDING AG,NEW DELHI,Manufacture of other medical and dental instruments n.e.c.,0.00,0.00,
783,YPSOMED INDIA PVT LTD,Switzerland,YPSOMED AG,NEW DELHI,Manufacture of other medical and dental instruments n.e.c.,2.00,0.03,
784,YPSOMED INDIA PVT LTD,Switzerland,YPSOMED AG,NEW DELHI,Manufacture of other medical and dental instruments n.e.c.,2.00,0.03,
785,YPSOMED INDIA PVT LTD,Switzerland,YPSOMED AG,NEW DELHI,Manufacture of other medical and dental instruments n.e.c.,5.00,0.08,
786,YPSOMED INDIA PVT LTD,Switzerland,YPSOMED AG,NEW DELHI,Manufacture of other medical and dental instruments n.e.c.,2.50,0.04,
787,YPSOMED INDIA PVT LTD,Switzerland,YPSOMED AG,NEW DELHI,Manufacture of other medical and dental instruments n.e.c.,5.00,0.08,
788,YPSOMED INDIA PVT LTD,Switzerland,YPSOMED AG,NEW DELHI,Manufacture of other medical and dental instruments n.e.c.,5.50,0.09,
789,YPSOMED INDIA PVT LTD,Switzerland,YPSOMED AG,NEW DELHI,Manufacture of other medical and dental instruments n.e.c.,6.00,0.10,
790,HCL TECHNOLOGIES LTD.,Switzerland,Amar Kamath K & other non-resident emplo,NEW DELHI,Providing software support and maintenance to the clients,11.76,0.19,
791,GLOBAL FRANCHISE ARCHITECTS INDIA PRIVAT,Switzerland,GFA GLOBAL CORP,BANGALORE,Restaurants without bars,27.34,0.44,
792,ECO TROPICA TOURS PRIVATE LIMITED,Switzerland,Simone Caprez,CHENNAI,"Hotels and Motels, inns, resorts providing short term lodging facilities includes accommodation in house",2.07,0.03,
793,SONGWON SPECIALTY CHEMICALS - INDIA PRIV,Switzerland,SONGWON HOLDINGS AG,AHMEDABAD,Manufacture of organic and inorganic chemical compounds n.e.c.,0.00,0.00,
Sl. No,Name of Indian Company,Country,Name of Foreign Collaborator,RBI Regional Office,Item of Manufacture,Amount of FDI Inflows,,
,,,,,,(In Rs million),(In US$ million),
794,HASELMEIER INDIA PVT LTD,Switzerland,MEDICO INVEST AG,BANGALORE,Research and experimental development on natural sciences and engineering,8.89,0.14,
