795,HASELMEIER INDIA PVT LTD,Switzerland,MEDICO INVEST AG,BANGALORE,Research and experimental development on natural sciences and engineering,4.43,0.07,
796,QEJ ELECTRONICS INTERNATIONAL PVT LTD,Taiwan,Ching HSueh Chou,NEW DELHI,"Activities of commission agents dealing in wholesale trade in machinery & equipment, other than transport",1.34,0.02,
797,HONG ZHENG INDIA PRIVATE LIMITED,Taiwan,HONG ZHENG TECHNOLOGY CORPORATION,NEW DELHI,"Manufacture of bearings, gears, gearing and driving elements",80.00,1.28,
798,HONG ZHENG INDIA PRIVATE LIMITED,Taiwan,Hong Zheng Technology Corp,NEW DELHI,"Manufacture of bearings, gears, gearing and driving elements",10.00,0.16,
799,HONG ZHENG INDIA PRIVATE LIMITED,Taiwan,Hong Zheng Technology Corporation,NEW DELHI,"Manufacture of bearings, gears, gearing and driving elements",49.91,0.80,
800,CSGT TRADING INDIA PVT LTD,Taiwan,"China Steel Global Trading Corp,",MUMBAI,Wholesale of metals and metal ores,0.48,0.01,
801,AHS HOSPITALITY INDIA PVT. LTD.,Thailand,Absolute Hotel Services Hongkong Ltd,MUMBAI,"Hotels and Motels, inns, resorts providing short term lodging facilities includes accommodation in
house",3.36,0.05,
802,AHS HOSPITALITY INDIA PVT. LTD.,Thailand,Absolute Hotel Services Hongkong Ltd,MUMBAI,"Hotels and Motels, inns, resorts providing short term lodging facilities includes accommodation in house",1.32,0.02,
803,AHS HOSPITALITY INDIA PVT. LTD.,Thailand,Absolute Hotel Services Hongkong Ltd,MUMBAI,"Hotels and Motels, inns, resorts providing short term lodging facilities includes accommodation in house",1.92,0.03,
804,AHS HOSPITALITY INDIA PVT. LTD.,Thailand,Absolute Hotel Services Hongkong Ltd,MUMBAI,"Hotels and Motels, inns, resorts providing short term lodging facilities includes accommodation in
house",1.63,0.03,
805,AHS HOSPITALITY INDIA PVT. LTD.,Thailand,Absolute Hotel Services Hongkong Ltd,MUMBAI,"Hotels and Motels, inns, resorts providing short term lodging facilities includes accommodation in house",2.37,0.04,
806,BROMS COSMETICS AND ACCESSORIES PRIVATE,Thailand,BROMCHIT KHANIYOMDEE,NEW DELHI,Other retail sale in non-specialized stores,0.74,0.01,
807,CHEMICO HEALTH AND BEAUTY INDIA PVT LTD,Thailand,Oon Chusattayanond,MUMBAI,"Manufacture of cosmetics and toileteries (includes manufacture of preshave, shaving or after shave preparations;",0.02,0.00,
808,CHEMICO HEALTH AND BEAUTY INDIA PVT LTD,Thailand,krishnapon Reddy Jonnala,MUMBAI,"Manufacture of cosmetics and toileteries (includes manufacture of preshave, shaving or after shave preparations;",0.04,0.00,
809,CHEMICO HEALTH AND BEAUTY INDIA PVT LTD,Thailand,Chemico Group Co Limited,MUMBAI,"Manufacture of cosmetics and toileteries (includes manufacture of preshave, shaving or after shave preparations;",0.34,0.01,
810,ALTIGREEN PROPULSION LABS PRIVATE LIMITE,Thailand,NATCHA KITSUMMANANGKOON,BANGALORE,Technical testing and analysis,2.51,0.04,
811,TOYOTA BOSHOKU RELAN INDIA PRIVATE LIMIT,Thailand,TOYOTA BOSHOKU ASIA CO. LTD.,NEW DELHI,"Manufacture of parts and accessories of bodies for motor vehicles such as safety belts, airbags, doors,",0.05,0.00,
812,SRITHAI SUPERWARE MANUFACTURING PRIVATE,Thailand,SRITHAI SUPERWARE PUBLIC CO LTD,AHMEDABAD,"Manufacture of tableware, kitchenware and other household articles and toilet articles of plastic, including",100.00,1.60,
813,ASW IMPEX PRIVATE LIMITED,Thailand,SRIAPOP HOKIERTI,BANGALORE,Sale of motor vehicle parts and accessories,1.83,0.03,
814,A S CAR AUDIO PVT. LTD.,Thailand,SIRAPOP HOKIERTI,BANGALORE,Sale of motor vehicle parts and accessories,1.83,0.03,
815,YENEPOYA ENERGY PRIVATE LIMITED,UAE,A.MUHAMMED KUNHI,BANGALORE,Electric power generation using other non conventional sources,7.50,0.12,
816,VBUZZ TELESERVICES PRIVATE LIMITED,UAE,Xtreme Commerce Limited,PATNA,WAREHOUSING OF AGRICULTURAL PRODUCTS WITHOUT REFRIGERATION,18.66,0.30,
817,ASHI CREATION PVT LTD,UAE,Ashish Mahajan,NEW DELHI,Manufacture of wearing apparel n.e.c.,10.00,0.16,
818,ASHI CREATION PVT LTD,UAE,Ashish Mahajan,NEW DELHI,Manufacture of wearing apparel n.e.c.,5.00,0.08,
Sl. No,Name of Indian Company,Country,Name of Foreign Collaborator,RBI Regional Office,Item of Manufacture,Amount of FDI Inflows,,
,,,,,,(In Rs million),(In US$ million),
819,GULF ISPAT LTD,UAE,GULF PETROCHEM FZC,NEW DELHI,Manufacture of other basic iron and steel n.e.c,61.75,0.99,
820,GULF ISPAT LTD,UAE,GULF PETROCHEM FZC,NEW DELHI,Manufacture of other basic iron and steel n.e.c,61.86,0.99,
821,OSS AIR MANAGEMENT P LTD,UAE,NAYAN ARUN JAGJIVAN,MUMBAI,Helicopter services,14.50,0.23,
822,GEOJIT BNP PARIBAS FINANCIAL SERVICES LT,UAE,"ANNAMALAI,JAGADEESH KUMAR,SAJU VARGHESE",KOCHI,Security and commodity contracts brokerage,0.29,0.00,
823,XPELAIR INDIA PRIVATE LTD.,UAE,XPELAIR MIDDLE EAST FZC,KOCHI,Manufacture of other electrical equipment,1.23,0.02,
824,THARAKAN WEB INNOVATIONS PVT. LTD.,UAE,GALAL ALI GHANEM KULAIB,KOCHI,Data processing activities including report writing,29.07,0.47,
825,XPELAIR INDIA PRIVATE LTD.,UAE,MS.LOVELY LALU SAMUEL,KOCHI,Manufacture of other electrical equipment,0.05,0.00,
826,XPELAIR INDIA PRIVATE LTD.,UAE,LALU SAMUEL,KOCHI,Manufacture of other electrical equipment,0.05,0.00,
827,GULF ISPAT LTD,UAE,GULF PETROCHEM FZC,NEW DELHI,Manufacture of other basic iron and steel n.e.c,61.36,0.98,
828,UNICORN VALVES PVT LTD,UAE,WAEL AL SHIHABI,CHENNAI,"Manufacture of other pumps, compressors, taps and valves etc.",5.98,0.10,
829,NATLASS ASIA CONSTRUCTION PVT LTD,UAE,NATLASS FZE,BHOPAL,Other construction projects n.e.c.,7.01,0.11,
830,ROBINHOOD INSURANCE BROKER PVT LTD,UAE,SHRI. ASHISH NANDA,MUMBAI,Activities of insurance agents and brokers,1.72,0.03,
831,OSS AIR MANAGEMENT P LTD,UAE,NAKUL ARUN JAGJIVAN,MUMBAI,Helicopter services,5.85,0.09,
832,OSS AIR MANAGEMENT P LTD,UAE,NAYAN ARUN JAGJIVAN,MUMBAI,Helicopter services,1.00,0.02,
833,APC DRILLING & CONSTRUCTION PVT LTD,UAE,SHAMARADI INDUSTRIAL FZC,CHENNAI,Support activities for other mining and quarrying,33.68,0.54,
834,GLOBAL COAL VENTURES PRIVATE LIMITED,UAE,Global commodity ventures FZC,CHENNAI,"Wholesale of solid, liquid and gaseous fuels and related products",6.06,0.10,
835,UNICORN VALVES PVT LTD,UAE,Ian Macdonald Marshall,CHENNAI,"Manufacture of other pumps, compressors, taps and valves etc.",6.05,0.10,
836,ACE GLOBAL DEPOSITORY INDIA PVT LTD,UAE,Ace Global Depository Limited,MUMBAI,"Storage and warehousing n.e.c.[Includes general merchandise warehouses and warehousing of furniture,",0.85,0.01,
837,REDA CHEMICALS INDIA P L,UAE,REDA INDUSTRIAL MATERIALS FZE,MUMBAI,"Activities of commission agents dealing in wholesale trade inwood, paper, skin, leather and fur, fuel,",17.42,0.28,
838,AL GHURAIR CONSTRUCTION FOUNDATION IPL,UAE,Al Ghurair Construction Foundations LLC,MUMBAI,Other site preparation activities n.e.c.,9.35,0.15,
839,BOTREE SOFTWARE INTERNATIONAL PVT LTD,UAE,NAKUL ARUN JAGJIVAN,CHENNAI,Software installation,3.00,0.05,
840,DATAM EDU PRIVATE LIMITED,UAE,Drishti Ltd,HYDERABAD,Academic tutoring services,1.20,0.02,
841,SQUAREONE TECHNOLOGIES PRIVATE LIMITED,UAE,SQUAREONE TECHNOLOGIES LLC,MUMBAI,Wholesale of computers and computer peripheral equipment,3.06,0.05,
842,KOTAK MAHINDRA  BANK LTD,UAE,VIJAY NAMBIAR,MUMBAI,"Monetary intermediation of commercial banks, saving banks. postal savings bank and discount houses",0.02,0.00,
843,REDA CHEMICALS INDIA P L,UAE,REDA INDUSTRIAL MATERIALS FZE,MUMBAI,"Activities of commission agents dealing in wholesale trade inwood, paper, skin, leather and fur, fuel,",25.08,0.40,
844,ACE GLOBAL DEPOSITORY INDIA PVT LTD,UAE,Ace Global  Depository Limited,MUMBAI,"Storage and warehousing n.e.c.[Includes general merchandise warehouses and warehousing of furniture,",1.63,0.03,
845,ACE GLOBAL DEPOSITORY INDIA PVT LTD,UAE,Ace Global Depository DMCC,MUMBAI,"Storage and warehousing n.e.c.[Includes general merchandise warehouses and warehousing of furniture,",1.34,0.02,
846,ACE GLOBAL DEPOSITORY INDIA PVT LTD,UAE,Ace Global Depository DMCC,MUMBAI,"Storage and warehousing n.e.c.[Includes general merchandise warehouses and warehousing of furniture,",1.21,0.02,
847,ACE GLOBAL DEPOSITORY INDIA PVT LTD,UAE,Ace Global Depository Limited,MUMBAI,"Storage and warehousing
n.e.c.[Includes general merchandise warehouses and",3.07,0.05,
,,,,,,,,
Sl. No,Name of Indian Company,Country,Name of Foreign Collaborator,RBI Regional Office,Item of Manufacture,Amount of FDI Inflows,,
,,,,,,(In Rs million),(In US$ million),
,,,,,"warehousing of furniture,",,,
848,ACE GLOBAL DEPOSITORY INDIA PVT LTD,UAE,Ace Global Depository Limited,MUMBAI,"Storage and warehousing n.e.c.[Includes general
merchandise warehouses and warehousing of furniture,",0.93,0.01,
849,CATHOLIC SYRIAN BANK LTD,UAE,YUSUFF ALI M.A,KOCHI,"Other financial service activities,
except insurance and pension funding activities, n.e.c.",30.96,0.50,
850,ACE GLOBAL DEPOSITORY INDIA PVT LTD,UAE,Ace Global Depository DMCC,MUMBAI,"Storage and warehousing n.e.c.[Includes general merchandise warehouses and warehousing of furniture,",3.00,0.05,
851,ALSA EDUCATIONAL AND TRAINING COMPANY PR,UAE,LEILA SIDANI,NEW DELHI,Other educational services n.e.c.,0.00,0.00,
852,CATVISION LIMITED,UAE,GLOBAL IMPEX LTD,NEW DELHI,"Installation of telecommunications wiring, computer network and cable television wiring, including fibre",9.80,0.16,
853,INTERGEN ENERGY LIMITED,UAE,EMERGING INVESTMENT LTD,NEW DELHI,Electric power generation by hydroelectric power plants,82.05,1.31,
854,ALSA EDUCATIONAL AND TRAINING COMPANY PR,UAE,ABDUL JABBAR ABDUL MOHSEN AHMED AL SAYEG,NEW DELHI,Other educational services n.e.c.,0.10,0.00,
855,ALSA EDUCATIONAL AND TRAINING COMPANY PR,UAE,FIROZE NARIMAN KAPADIA,NEW DELHI,Other educational services n.e.c.,0.00,0.00,
856,RELIGARE ENTERPRISES LTD,UAE,Shah Pratik Surendra,NEW DELHI,OTHER FINANCIAL SERVICES N.E.C,0.36,0.01,
857,GULF ISPAT LTD,UAE,GULF PETROCHEM FZC,NEW DELHI,Manufacture of other basic iron and steel n.e.c,31.07,0.50,
858,INTERGEN ENERGY LIMITED,UAE,PACIFIC COAST IMPORT EXPORT FZE,NEW DELHI,Electric power generation by hydroelectric power plants,12.43,0.20,
859,USHDEV STEEL PVT LTD,UAE,Prateek Gupta,MUMBAI,Manufacture of inorganic acids except nitric acid,34.98,0.56,
860,JAIS JEWELLERY PVT LTD,UAE,Rajendra Kumar Bengani,KOLKATA,"Manufacture of jewellery of gold, silver and other precious or base metal metal clad with precious metals",4.99,0.08,
861,RANIAS GARDEN & HOTELS PVT LTD,UAE,KINGSBURY LIMITED,CHENNAI,"Hotels and Motels, inns, resorts providing short term lodging facilities includes accommodation in house",13.90,0.22,
862,INTERNATIONAL CONTAINER TERMINAL SERVICE,UAE,Manuel Armando Fernandez,CHENNAI,Cargo handling incidental to water transport,0.00,0.00,
863,GULF ASPHALT PRIVATE LIMITED (EAR:ASPAM,UAE,GULF PETROCHEM FZC,NEW DELHI,"Manufacture of other petroleum
n.e.c. (includes manufacture of petroleum jelly, micro-crystalline
petroleum",61.40,0.98,
864,PRACHIN COMMODITIES PVT LTD,UAE,Amin Mashayekh,MUMBAI,"Activities of commission agents, brokers dealing in wholesale trade of agricultural raw material, live",0.20,0.00,
865,SAFEGUARD WORLD PAYROLL SERVICES PRIVATE,United Kingdom,SAFEGUARD WORLD INTERNATIONAL LTD,NEW DELHI,Human resources provision and management of human resources functions,9.98,0.16,
866,LONDON OFFSHORE CONSULTANTS INDIA PVT LT,United Kingdom,LONDON OFFSHORE CONSULTANTS ( HOLDINGS),MUMBAI,Architectural and engineering activities and related technical consultancy,3.91,0.06,
867,KAVERI RENEWABLE ENERGY PRIVATE LIMITED,United Kingdom,Trishe Energy UK Limited,CHENNAI,Construction and maintenance of power plants,7.15,0.11,
868,KOVAI HILLS EDINFRA PVT LTD,United Kingdom,SEMMAMPALAYAM PALANISAMY KURINJINATHAN,CHENNAI,Construction of buildings carried out on own-account basis or on a fee or contract basis,0.95,0.02,
869,CULINARY CONCEPTS AND HOSPITALITY PVT LT,United Kingdom,Mark David farrer Brown,MUMBAI,Restaurants without bars,1.00,0.02,
870,JAGUAR LAND ROVER INDIA PVT LTD,United Kingdom,JAGUAR LAND ROVER LTD,MUMBAI,WHOLESALE AND RETAIL SALE OF USED MOTOR VEHICLES,200.00,3.20,
871,JAGUAR LAND ROVER INDIA PVT LTD,United Kingdom,JAGUAR LAND ROVER LTD,MUMBAI,WHOLESALE AND RETAIL SALE OF USED MOTOR VEHICLES,"2,100.00",33.63,
872,PT SOFT SOLUTIONS INDIA PVT LTD,United Kingdom,PT GLOBAL SOLUTIONS LIMITED,MUMBAI,Providing software support and maintenance to the clients,0.10,0.00,
873,GRAVITY CONSULTING ENGINEERS (INDIA) PRI,United Kingdom,"Gravity Consulting Engineers Ltd, UK",HYDERABAD,Architectural and engineering activities and related technical consultancy,0.49,0.01,
874,NATEMS POWER LTD,United Kingdom,Armstrong Energy Global Limited,HYDERABAD,Electric power generation using solar energy,588.24,9.42,
Sl. No,Name of Indian Company,Country,Name of Foreign Collaborator,RBI Regional Office,Item of Manufacture,Amount of FDI Inflows,,
,,,,,,(In Rs million),(In US$ million),
875,AVIAGEN INDIA POULTRY BREEDING CO PVT LT,United Kingdom,AVIAGEN INTERNATIONAL HOLDINGS LIMITED,CHENNAI,"Raising and breeding of chickens and capons, ducks, geese, turkeys and guinea fowls chickens and capons,",86.83,1.39,
876,AVIAGEN INDIA POULTRY BREEDING CO PVT LT,United Kingdom,Aviagen International Holdings limited,CHENNAI,"Raising and breeding of chickens and capons, ducks, geese, turkeys and guinea fowls chickens and capons,",78.81,1.26,
877,GOLDSTAR POWDERS PRIVATE LIMITED,United Kingdom,GOODWIN PLC,CHENNAI,Manufacture of other refractory articles n.e.c.,51.20,0.82,
878,HCL TECHNOLOGIES LTD.,United Kingdom,sudip ghose and other 24 no resident emp,NEW DELHI,Providing software support and maintenance to the clients,7.01,0.11,
879,PI DATA CENTERS PVT LTD,United Kingdom,RAJAKUMAR MUSUNURU,HYDERABAD,"Other data processing, hosting and related activities n.e.c.",0.50,0.01,
880,SAHAY ADDITIVES PRIVATE LIMITED,United Kingdom,Gray Baxter Limited,HYDERABAD,"Production of liquid and gaseous fuels, illuminating oils, lubricating oils or greases or other products",2.95,0.05,
881,STREET CONNECTIONS HOSPITALITY PRIVATE L,United Kingdom,Ms/ Volunteer Delhi Ltd.,NEW DELHI,Tour operator activities,5.82,0.09,
882,MSD WELLCOME TRUST HILLEMAN LABORATORIES,United Kingdom,THE WELLCOME TST,NEW DELHI,"Research and experimental
development on social sciences and humanities",42.00,0.67,
883,ODGERS BERNDTSON INDIA PVT. LTD.,United Kingdom,INTERNATIONAL RESOURCES GROUP LTD,NEW DELHI,Management consultancy activities,3.75,0.06,
884,ODGERS BERNDTSON INDIA PVT. LTD.,United Kingdom,ODGERS (GROUP) LTD,NEW DELHI,Management consultancy activities,0.00,0.00,
885,TINTOMETER INDIA PVT LTD,United Kingdom,TINTOMETER LTD,NEW DELHI,Manufacture of laboratory analytical instruments and miscellaneous laboratory apparatus for measuring,14.43,0.23,
886,MSD WELLCOME TRUST HILLEMAN LABORATORIES,United Kingdom,THE WELLCOME TRUST,NEW DELHI,Research and experimental development on social sciences and humanities,36.00,0.58,
887,BITE DIGITAL COMMUNICATIONS PRIVATE LIMI,United Kingdom,Bite Communications Group Ltd.,NEW DELHI,"Other data processing, hosting and related activities n.e.c.",6.38,0.10,
888,AHIPL MANAGEMENT CONSULTING PVT LTD,United Kingdom,SUZANNE JANE SPINK,NEW DELHI,Management consultancy activities,0.90,0.01,
889,AHIPL MANAGEMENT CONSULTING PVT LTD,United Kingdom,KARIN BAYE,NEW DELHI,Management consultancy activities,0.15,0.00,
890,STREET CONNECTIONS HOSPITALITY PRIVATE L,United Kingdom,VOLUNTEER DELHI LTD,NEW DELHI,Bars and Restaurants with bars,0.99,0.02,
891,GAJAM INDIA PVT LTD,United Kingdom,GAJAM GROUP LTD,NEW DELHI,"Activities of commission agents, brokers dealing in wholesale trade of agricultural raw material, live",12.30,0.20,
892,WEBHELP INDIA PRIVATE LIMITED,United Kingdom,WEBHELP UK TRADING LTD,NEW DELHI,Other information technology and computer service activities n.e.c,30.00,0.48,
893,WEBHELP INDIA PRIVATE LIMITED,United Kingdom,WEBHELP UK HOLDING LTD,NEW DELHI,Other information technology and computer service activities n.e.c,0.00,0.00,
894,TEN LIFESTYLE MANAGEMENT INDIA PVT LTD,United Kingdom,Ten Lifestyle Management  Limited,MUMBAI,Other reservation service and related activities,0.10,0.00,
895,S CAPITAL SOLUTIONS PRIVATE LIMITED,United Kingdom,Erik Linus Lindgren,HYDERABAD,Computer consultancy and computer facilities management activities,2.44,0.04,
896,OMEGA DX ASIA PVT LTD,United Kingdom,"OMEGA DIAGNOSTICS GROUP PLC, UK",MUMBAI,"Wholesale of scientific, medical and surgical machinery and equipment",20.00,0.32,
897,APT DRIVES SOLUTIONS PVT LTD,United Kingdom,DAVID DOUGLAS WALLACE,CHENNAI,"Manufacture of diverse parts and accessories for motor vehecles sucs as brakes, gearboxes, axles, road",0.61,0.01,
898,XMOS SEMICONDUCTOR INDIA PVT LTD,United Kingdom,XMOS LIMITED,CHENNAI,Software installation,0.10,0.00,
899,API HEAT TRANSFEER INDIA PVT LTD,United Kingdom,Kayvan Namazi,MUMBAI,Manufacture of other fabricated metal products n.e.c.,0.00,0.00,
900,RIO TINTO EXPLORATION INDIA  PRIVATE LTD,United Kingdom,Rio Tinto Minerals Development Ltd.,MUMBAI,"Mining of gemstones (agate, diamond, emerald, garnet (gem), jasper, rubby/ saphire etc.",300.00,4.80,
901,RICARDO INDIA PVT LTD,United Kingdom,ricardo Group PLC,NEW DELHI,MARKET RESEARCH SERVICES,3.60,0.06,
902,CLYDE BERGEMANN INDIA PVT LTD,United Kingdom,CLYDE BERGEMANN INVESTMENTS LTD,NEW DELHI,Manufacture of other special- purpose machinery n.e.c.,60.00,0.96,
903,GAJAM INDIA PVT LTD,United Kingdom,GAJAM GROUP LTD,NEW DELHI,"Activities of commission agents, brokers dealing in wholesale trade",3.01,0.05,
Sl. No,Name of Indian Company,Country,Name of Foreign Collaborator,RBI Regional Office,Item of Manufacture,Amount of FDI Inflows,,
,,,,,,(In Rs million),(In US$ million),
,,,,,"of agricultural raw material, live",,,
904,GAJAM INDIA PVT LTD,United Kingdom,GAJAM GROUP LTD,NEW DELHI,"Activities of commission agents,
brokers dealing in wholesale trade of agricultural raw material, live",6.07,0.10,
905,FLOW EDUCATION AND CULTURE CONSULTANT PV,United Kingdom,MR M R STEVENSON,NEW DELHI,Other educational services n.e.c.,0.03,0.00,
906,FLOW EDUCATION AND CULTURE CONSULTANT PV,United Kingdom,MRS BRIDGET MCKENZIE,NEW DELHI,Other educational services n.e.c.,0.03,0.00,
907,HHV PUMPS PVT LTD,United Kingdom,F.D.ROSENKRANZ,BANGALORE,"Manufacture of other pumps, compressors, taps and valves etc.",25.00,0.40,
908,HHV PUMPS PVT LTD,United Kingdom,K.RAJGOPAL,BANGALORE,"Manufacture of other pumps, compressors, taps and valves etc.",18.01,0.29,
909,SUBEX LIMITED,United Kingdom,ELARA CAPITAL PLC,BANGALORE,Publishing of operating systems and system software,56.05,0.90,
910,HHV PUMPS PVT LTD,United Kingdom,K.RAJGOPAL,BANGALORE,"Manufacture of other pumps, compressors, taps and valves etc.",18.01,0.29,
911,CUMMINS CO-GENERATION INDIA PVT LTD,United Kingdom,cummins cogeneration  limited,CHENNAI,Electric power generation using other non conventional sources,8.58,0.14,
912,HCL TECHNOLOGIES LTD.,United Kingdom,CHRIS CALVER,NEW DELHI,Providing software support and maintenance to the clients,0.02,0.00,
913,HCL TECHNOLOGIES LTD.,United Kingdom,STEPHEN CARDELL,NEW DELHI,Providing software support and maintenance to the clients,0.15,0.00,
914,HCL TECHNOLOGIES LTD.,United Kingdom,STEVE HIBBERD,NEW DELHI,Providing software support and maintenance to the clients,0.02,0.00,
915,PARTH LAMICOAT PRIVATE LIMITED,United Kingdom,JOHN PANTELIAS,AHMEDABAD,Manufacture of other articles n.e.c.,1.59,0.03,
916,HHV PUMPS PVT LTD,United Kingdom,STEPHEN E ORMROD,BANGALORE,"Manufacture of other pumps, compressors, taps and valves etc.",15.00,0.24,
917,CATHOLIC SYRIAN BANK LTD,United Kingdom,ALOK OBEROI,KOCHI,"Other financial service activities, except insurance and pension funding activities, n.e.c.",49.14,0.79,
918,PRICE AND BUCKLAND (INDIA) PRIVATE LIMIT,United Kingdom,NICHOLAS JOHN BUCKLAND,NEW DELHI,Manufacture of all types of textile garments and clothing accessories,2.02,0.03,
919,PRICE AND BUCKLAND (INDIA) PRIVATE LIMIT,United Kingdom,ANTHONY JAMES BUCKLAND,NEW DELHI,Manufacture of all types of textile garments and clothing accessories,2.02,0.03,
920,PRICE AND BUCKLAND (INDIA) PRIVATE LIMIT,United Kingdom,PRICE AND BUCKLAND LIMITED,NEW DELHI,Manufacture of all types of textile garments and clothing accessories,0.92,0.01,
921,HCL TECHNOLOGIES LTD.,United Kingdom,VALLINATH ANUMULA,NEW DELHI,Providing software support and maintenance to the clients,0.00,0.00,
922,M.B.A. CONSULTING INDIA PRIVATE LIMITED,United Kingdom,MBA EMPIRE LTD,NEW DELHI,Management consultancy activities,3.03,0.05,
923,M.B.A. CONSULTING INDIA PRIVATE LIMITED,United Kingdom,MBA EMPIRE LTD,NEW DELHI,Management consultancy activities,3.06,0.05,
924,M.B.A. CONSULTING INDIA PRIVATE LIMITED,United Kingdom,MBA EMPIRE LTD,NEW DELHI,Management consultancy activities,2.34,0.04,
925,M.B.A. CONSULTING INDIA PRIVATE LIMITED,United Kingdom,MBA EMPIRE LTD,NEW DELHI,Management consultancy activities,2.00,0.03,
926,EMFICIENT TECHNOLOGIES PRIVATE LIMITED,United Kingdom,YADAVENDRA YADAV,NEW DELHI,Other information technology and computer service activities n.e.c,0.05,0.00,
927,HCL TECHNOLOGIES LTD.,United Kingdom,MARK HIRST,NEW DELHI,Providing software support and maintenance to the clients,0.01,0.00,
928,CAPITAL BROADCASTING CO PVT LTD,United Kingdom,Balram Dayaram Datwani,NEW DELHI,CONSTRUCTION OF NON- RESIDENTIAL BUILDINGS INCLUDING ADDITIONS AND  ALTERATIONS IN THE EXISTING ONES,4.67,0.07,
929,CAPITAL BROADCASTING CO PVT LTD,United Kingdom,Premela Chandru Vaswani,NEW DELHI,CONSTRUCTION OF NON- RESIDENTIAL BUILDINGS INCLUDING ADDITIONS AND  ALTERATIONS IN THE EXISTING ONES,3.11,0.05,
930,CAPITAL BROADCASTING CO PVT LTD,United Kingdom,Kiran Haneet Vaswani,NEW DELHI,"CONSTRUCTION OF NON- RESIDENTIAL BUILDINGS INCLUDING ADDITIONS AND  ALTERATIONS IN THE
EXISTING ONES",1.37,0.02,
931,TAPFLO FLUID HANDLING INDIA PRIVATE LIMI,United Kingdom,TAPFLO INTERNATIONAL LIMITED,NEW DELHI,"Manufacture of other pumps, compressors, taps and valves etc.",0.50,0.01,
932,M.B.A. CONSULTING INDIA PRIVATE LIMITED,United Kingdom,M.B.A EMPIRE LTD,NEW DELHI,Other information service activities n.e.c.,4.07,0.07,
933,AP CLUTCHES INDIA PRIVATE LIMITED,United Kingdom,RAICAM CLUTCH LTD,AHMEDABAD,"Manufacture of motorcycles, scooters, mopeds etc. and their",10.00,0.16,
Sl. No,Name of Indian Company,Country,Name of Foreign Collaborator,RBI Regional Office,Item of Manufacture,Amount of FDI Inflows,,
,,,,,,(In Rs million),(In US$ million),
,,,,,engine,,,
934,HEXAWARE TECHNOLOGIES LTD.,United Kingdom,K U AUGUSTINE,MUMBAI,Providing software support and maintenance to the clients,0.09,0.00,
935,HEXAGON GLOBAL IT SERVICES PRIVATE LIMIT,United Kingdom,PARESH SHAH,BANGALORE,Providing software support and maintenance to the clients,3.72,0.06,
936,CERTARA SOFTWARE INDIA PRIVATE LIMITED,United Kingdom,PHARSIGHT INTERNATIONAL UK LTD,BANGALORE,Providing software support and maintenance to the clients,0.00,0.00,
937,FRONTIERS GROUP (INDIA) PRIVATE LIMITED,United Kingdom,PACIFIC INVESTMENTS MANAGEMENT LIMITED,BANGALORE,Advertising,28.21,0.45,
938,SPRING HEALTH WATER (INDIA) PVT LTD,U.S.A,MICHAEL D HANNIGAN,BANGALORE,Other inland water transport n.e.c.,1.50,0.02,
939,TIME ANALYTIC AND SHARED SERVICES PRIVAT,U.S.A,TI ASIA HOLDINGS INC,BANGALORE,"Other data processing, hosting and related activities n.e.c.",0.02,0.00,
940,TIME ANALYTIC AND SHARED SERVICES PRIVAT,U.S.A,TI INTERNATIONAL HOLDINGS INC,BANGALORE,"Other data processing, hosting and related activities n.e.c.",1.96,0.03,
941,MICRO ENERGY CREDITS CORPORATION PRIVATE,U.S.A,MICRO ENERGY CREDITS CORP,BANGALORE,Management consultancy activities,10.00,0.16,
942,ZOOMCAR INDIA PVT LTD.,U.S.A,ZOOM CAR INC,BANGALORE,Other non urban passenger land transport n.e.c.,219.87,3.52,
943,ZEROCHAOS WORKFORCE SOLUTIONS PRIVATE LT,U.S.A,APC WORKFORCE SOLUTIONS LLC USA,BANGALORE,Human resources provision and management of human resources functions,119.99,1.92,
944,ZOOMCAR INDIA PVT LTD.,U.S.A,ZOOM CAR INC,BANGALORE,Other non urban passenger land transport n.e.c.,102.42,1.64,
945,PENGALA LEARNING PRIVATE LIMITED,U.S.A,PRADEEP SINGH AND SAJNIK SINGH,BANGALORE,Other information technology and computer service activities n.e.c,9.28,0.15,
946,PENGALA LEARNING PRIVATE LIMITED,U.S.A,POOLINGER FAMILY LP,BANGALORE,Other information technology and computer service activities n.e.c,4.59,0.07,
947,PRAXAIR INDIA PRIVATE LTD,U.S.A,PRAXAIR INC USA,BANGALORE,Manufacture of gas,1.01,0.02,
948,TIME ANALYTIC AND SHARED SERVICES PRIVAT,U.S.A,TI ASIA HOLDINGS INC,BANGALORE,"Other data processing, hosting and related activities n.e.c.",0.20,0.00,
949,TIME ANALYTIC AND SHARED SERVICES PRIVAT,U.S.A,TI ASIA HOLDINGS INC,BANGALORE,"Other data processing, hosting and related activities n.e.c.",0.14,0.00,
950,SS WHITE TECHNOLOGIES PVT LTD,U.S.A,S S WHITE TECHNOLOGIES INC,NEW DELHI,"Manufacture of other transport equipments n.e.c. such as pushcarts, handcarts etc",0.26,0.00,
951,SS WHITE TECHNOLOGIES PVT LTD,U.S.A,S S WHITE TECHNOLOGIES INC,NEW DELHI,"Manufacture of other transport equipments n.e.c. such as pushcarts, handcarts etc",30.11,0.48,
952,SS WHITE TECHNOLOGIES PVT LTD,U.S.A,S S WHITE TECHNOLOGIES INC,NEW DELHI,"Manufacture of other transport equipments n.e.c. such as pushcarts, handcarts etc",15.12,0.24,
953,POWERONEDATA SOFTWARE RESEARCH PRIVATE L,U.S.A,POWERONEDATA INTERNATIONAL INC,BANGALORE,Other information technology and computer service activities n.e.c,22.13,0.35,
954,TIME ANALYTIC AND SHARED SERVICES PRIVAT,U.S.A,TI INTERNATIONAL HOLDINGS INC,BANGALORE,"Other data processing, hosting and related activities n.e.c.",0.10,0.00,
955,I2I TELESOLUTIONS AND TELEMEDICINE PRIVA,U.S.A,KAVAL GULHATI,BANGALORE,Providing software support and maintenance to the clients,6.00,0.10,
956,GADFLYZONE INDIA PRIVATE LIMITED,U.S.A,GADFLYZONE INC,BANGALORE,Providing software support and maintenance to the clients,0.10,0.00,
