1567,MOSER BAER INDIA LIMITED,Oman,NEVIN KISHORE,NEW DELHI,Manufacture of magnetic and optical media,4.03,0.06,
1568,AATCO FOODS (B I) INDIA PL,Oman,Ali & Abdul Karim Group LLC,MUMBAI,Preservation of fruit and vegetables n.e.c.,27.50,0.42,
1569,KIRI DYES AND CHEMICALS LTD.,Oman,K K BALAKRISHNAN,AHMEDABAD,Manufacture of dyes and pigments from any source in basic form or as concentrate,0.01,0.00,
1570,PRESIDENCY INFRA HEIGHTS PRIVATE LIMITED,Oman,OWAIS USMANI,NEW DELHI,Construction of buildings carried out on own-account basis or on a fee or contract basis,"1,351.10",20.40,
1571,NEW WORLD TRADING INDIA PVT LTD,Oman,MOHAMMED AHMED ABDULLAH AL BARWANI,NEW DELHI,"Other supporting activities including agricultural gardening (excluding parks and gardening
activiti",1.56,0.02,
1572,HAMLAI INDUSTRIES PRIVATE LIMITED,Oman,SUJAY AJITKUMAR HAMLAI,AHMEDABAD,Manufacture of other articles n.e.c.,0.50,0.01,
1573,WELSPUN ENTERPRISES LIMITED,Oman,LIST AS PER ANNEXURE TO FC-GPR APPLICATI,AHMEDABAD,"Construction and maintenance of motorways, streets, roads, other vehicular and pedestrian ways, highways,",608.65,9.19,
1574,JENS TRAVELS PVT LTD,Panama,LAVINA S.A.,PANAJI,Activities of travel agents and tour operators,10.40,0.16,
1575,JENS TRAVELS PVT LTD,Panama,LAVINA S.A.,PANAJI,Activities of travel agents and tour operators,1.98,0.03,
1576,JENS TRAVELS PVT LTD,Panama,LAVINA S.A.,PANAJI,Activities of travel agents and,3.38,0.05,
Sl. No,Name of Indian Company,Country,Name of Foreign Collaborator,RBI Regional Office,Item of Manufacture,Amount of FDI Inflows,,
,,,,,,(In Rs million),(In US$ million),
,,,,,tour operators,,,
1577,JENS TRAVELS PVT LTD,Panama,LAVINA S.A.,PANAJI,Activities of travel agents and,1.50,0.02,
,,,,,tour operators,,,
1578,JENS TRAVELS PVT LTD,Panama,LAVINA S.A.,PANAJI,Activities of travel agents and,1.96,0.03,
,,,,,tour operators,,,
1579,JENS TRAVELS PVT LTD,Panama,LAVINA S.A.,PANAJI,Activities of travel agents and,1.50,0.02,
,,,,,tour operators,,,
1580,SOFTLINE SERVICES INDIA PVT LTD,Panama,Softline Overseas Corp.,MUMBAI,Computer consultancy and computer facilities management activities,12.70,0.20,
1581,"TEADIT PACKING AND GASKET PVT
LTD-Regd.",Panama,FREEL COMPANY INC,MUMBAI,"Manufacture of other general purpose machinery n.e.c. ( fans intended for industrial applications, exhaust",8.31,0.13,
1582,LIWAYWAY FOODS INDIA  PVT LTD,Philippines,SUNARIN LAROSHE INT'L CO LIMITED,BANGALORE,Manufacture of other bakery products n.e.c.,14.88,0.23,
1583,EFACEC INDIA PVT LTD,Portugal,EFACES POWER SOLUTIONS SGPS S.A,NEW DELHI,Manufacture of electric motors (except internal combustion engine starting motors),138.19,2.17,
1584,WESTMINSTER HEALTHCARE PRIVATE LTD,Portugal,Lycamobile Italy DA,CHENNAI,Activities of independent diagnostic/pathological laboratories,49.94,0.77,
1585,PHARMOTIPS HEALTHCARE PVT LTD,Qatar,Saleemakhtar Qamruzzaman Ansari,MUMBAI,Wholesale of pharmaceutical and medical goods,2.00,0.03,
1586,SRL GREEN AND CLEAN POWER PVT LTD,Qatar,Abdul Kadir Tajudeen,CHENNAI,Electric power generation using other non conventional sources,5.00,0.08,
1587,URB INDIA BEARING FACTORY AND TRADE PVT,Romania,SC RULMENTI SA,NEW DELHI,"Manufacture of bearings, gears, gearing and driving elements",9.99,0.15,
1588,URB INDIA BEARING FACTORY AND TRADE PVT,Romania,SC RULMENTI SA,NEW DELHI,"Manufacture of bearings, gears, gearing and driving elements",8.20,0.13,
1589,URB INDIA BEARING FACTORY AND TRADE PVT,Romania,SC RULMENTI SA,NEW DELHI,"Manufacture of bearings, gears, gearing and driving elements",10.92,0.17,
1590,INDRA VISA FIDUCIARY SERVICES PRIVATE LI,Russia,LEX SYSTEMS LLC,NEW DELHI,Other business support service activities n.e.c.,1.75,0.03,
1591,LOTUS PHARM MANUFACTURING PRIVATE LIMITE,Russia,VIJAY KUMAR SINGH,NEW DELHI,"Manufacture of medicinal substances used in the manufacture of pharmaceuticals: antibiotics, endocrine",0.48,0.01,
1592,GCE CONSULTANTS INDIA PVT LTD,Russia,OOO GCE-ENERGO,NEW DELHI,Architectural and engineering activities and related technical consultancy,1.50,0.02,
1593,LIGHTING TECHNOLOGIES INDIA PVT,Russia,"LLC, LIGHTING TECHNOLOGIES IGC",BANGALORE,Manufacture of electric lighting,71.56,1.12,
,LTD (LT,,,,equipment,,,
1594,TECHNONICOL INDIA PVT LTD,Russia,miara llc,MUMBAI,Wholesale of other construction,0.44,0.01,
,,,,,equipment n.e.c.,,,
1595,TECHNONICOL INDIA PVT LTD,Russia,tn invest llc,MUMBAI,Wholesale of other construction equipment n.e.c.,0.00,0.00,
1596,VULCAN VALVES TECHNOLOGIES PVT LTD,Russia,JSC ARMALIT-I,HYDERABAD,"Manufacture of other pumps, compressors, taps and valves etc.",6.17,0.09,
1597,LIGHTING TECHNOLOGIES INDIA PVT LTD (LT,Russia,"LLC, LIGHTING TECHNOLOGIES IGC",BANGALORE,Manufacture of electric lighting equipment,27.96,0.42,
1598,LOTUS PHARM MANUFACTURING PRIVATE LIMITE,Russia,VIJAY KUMAR SINGH,NEW DELHI,"Manufacture of medicinal substances used in the manufacture of pharmaceuticals: antibiotics, endocrine",0.50,0.01,
1599,MANPASAND BEVERAGES LTD.,Saudi Arabia,NRIs,AHMEDABAD,"Manufacture of fruit or vegetable juices and their concentrates, squashes and powder",8.31,0.13,
1600,NAMDHARI FOOD INTERNATIONAL PVT LTD,Saudi Arabia,Al Nafia Trading Est.,NEW DELHI,Rice milling,4.84,0.07,
1601,NAMDHARI FOOD INTERNATIONAL PVT LTD,Saudi Arabia,Alnafia trading holding co.,NEW DELHI,Rice milling,2.01,0.03,
1602,NAMDHARI FOOD INTERNATIONAL PVT LTD,Saudi Arabia,Alnafia Trading Holding Co.,NEW DELHI,Rice milling,7.91,0.12,
1603,CHEMILITE COATINGS PVT.LTD.,Saudi Arabia,MAROOF AHMAD MOHAMMED BA DHEEB,KOCHI,"Manufacture of paints and varnishes, enamels or lacquers",5.03,0.08,
1604,CHEMILITE COATINGS PVT.LTD.,Saudi Arabia,MAROOF AHAMED MOHAMMED BA DHEEB,KOCHI,"Manufacture of paints and varnishes, enamels or lacquers",2.53,0.04,
1605,CHEMILITE COATINGS PVT.LTD.,Saudi Arabia,MAROOF AHMED MOHAMMED BA DHEEB,KOCHI,"Manufacture of paints and varnishes, enamels or lacquers",1.61,0.03,
1606,CHEMILITE COATINGS PVT.LTD.,Saudi Arabia,MAROOF AHMAD MOHAMMED BA,KOCHI,Manufacture of paints and,2.39,0.04,
Sl. No,Name of Indian Company,Country,Name of Foreign Collaborator,RBI Regional Office,Item of Manufacture,Amount of FDI Inflows,,
,,,,,,(In Rs million),(In US$ million),
,,,DHEEB,,"varnishes, enamels or lacquers",,,
1607,CHEMILITE COATINGS PVT.LTD.,Saudi Arabia,MARROF AHAMED MOHAMMED BA DHEEB,KOCHI,"Manufacture of paints and varnishes, enamels or lacquers",1.64,0.03,
1608,R.S.INFRATECH LIMITED,Saudi Arabia,Jawdat Contracting CO.,NEW DELHI,"Activities relating to alteration, addition, repair, maintenance carried out on own-account basis or",4.71,0.07,
1609,GEOJIT BNP PARIBAS FINANCIAL SERVICES LT,Saudi Arabia,ZACHARIA K.G,KOCHI,Security and commodity contracts brokerage,0.12,0.00,
1610,KIRI DYES AND CHEMICALS LTD.,Saudi Arabia,SYED ABDUL KALEEM,AHMEDABAD,Manufacture of dyes and pigments from any source in basic form or as,0.01,0.00,
1611,KIRI DYES AND CHEMICALS LTD.,Saudi Arabia,MUTHU KRISHNAN MUTHIAH THEVAR,AHMEDABAD,Manufacture of dyes and pigments from any source in basic form or as concentrate concentrate,0.01,0.00,
1612,GEOJIT BNP PARIBAS FINANCIAL SERVICES LT,Saudi Arabia,ABHILASH KUMAR S,KOCHI,Security and commodity contracts brokerage,0.07,0.00,
1613,GEOJIT BNP PARIBAS FINANCIAL SERVICES LT,Saudi Arabia,PRATHAPAN T.S,KOCHI,Security and commodity contracts brokerage,0.05,0.00,
1614,GEOJIT BNP PARIBAS FINANCIAL SERVICES LT,Saudi Arabia,ZACHARIA K.G,KOCHI,Security and commodity contracts brokerage,0.07,0.00,
1615,GEOJIT BNP PARIBAS FINANCIAL SERVICES LT,Saudi Arabia,ABHILASH KUMAR.S,KOCHI,Security and commodity contracts brokerage,0.07,0.00,
1616,GEOJIT BNP PARIBAS FINANCIAL SERVICES LT,Saudi Arabia,PRATHAPAN T.S,KOCHI,Security and commodity contracts brokerage,0.04,0.00,
1617,7NODES TECHNOLOGY SOLUTIONS PVT. LTD.,Saudi Arabia,TANWEER INVESTMENT COMPANY,KOCHI,"Writing , modifying, testing of computer program to meet the needs of a particular client excluding web-page",4.33,0.07,
1618,RAFFLESIA TRADING PVT LTD,Singapore,RAFFLES INDUSTRIAL & SHIPPING SERVICES P,KOLKATA,"Wholesale of construction materials (sand, gravel etc.)",1.83,0.03,
1619,M.D. INDUCTO CAST LIMITED,Singapore,ABHINAV SUBODH KUMAR,AHMEDABAD,Manufacture of hot-rolled and cold-rolled products of steel,26.46,0.41,
1620,PRECIOUS PET SERVICES PRIVATE LIMITED,Singapore,RASHI SANON NARANG,NEW DELHI,Other non-specialised wholesale trade n.e.c.,0.05,0.00,
1621,PRECIOUS PET SERVICES PRIVATE LIMITED,Singapore,SAMARTH NARANG,NEW DELHI,Other non-specialised wholesale trade n.e.c.,0.05,0.00,
1622,RENEW SOLAR ENERGY (KARNATAKA) PRIVATE L,Singapore,HAREON SOLAR SINGAPORE PRIVATE LIMITED,NEW DELHI,Electric power generation using solar energy,178.70,2.75,
1623,RENEW SOLAR ENERGY (KARNATAKA) PRIVATE L,Singapore,HAREON SOLAR SINGAPORE PRIVATE LIMITED,NEW DELHI,Electric power generation using solar energy,409.29,6.29,
1624,DR FRESH SEZ PHASE-1 PVT LTD,Singapore,ASCENDAS INDIA DEVELOPMENT II PTE LIMITE,NEW DELHI,Construction of buildings carried out on own-account basis or on a fee or contract basis,2.04,0.03,
1625,KNOWLARITY COMMUNICATION INDIA PVT LTD,Singapore,KNOWLARITY COMMUNICATIONS HOLDINGS PTE L,NEW DELHI,Other business support service activities n.e.c.,23.06,0.35,
1626,ORANGE POWERGEN PVT LTD( EAR GREEN HORSE,Singapore,Orange Power holdings pte. ltd,NEW DELHI,Electric power generation using solar energy,0.00,0.00,
1627,ORANGE POWERGEN PVT LTD( EAR GREEN HORSE,Singapore,Orange Power Holdings Pte. Ltd.,NEW DELHI,Electric power generation using solar energy,26.54,0.41,
1628,JUBILANT ENPRO SERVICES PRIVATE LIMITED,Singapore,SHYAM SUNDER BHARTIA,NEW DELHI,Other business support service activities n.e.c.,0.50,0.01,
1629,BLING EVENTS PRIVATE LIMITED,Singapore,SQUARE YARDS ADVISORY SINGAPORE PRIVATE,NEW DELHI,Organization of conventions and trade shows,12.32,0.19,
1630,STATKRAFT MARKETS PRIVATE LTD (EAR:SN PO,Singapore,SN POWER SINGAPORE PTE LTD.,NEW DELHI,"Collection and distribution of electric energy to households, industrial, commercial and other users",0.00,0.00,
1631,STATKRAFT INDIA PRIVATE LIMITED (EAR: SN,Singapore,STATKRAFT HOLDING SINGAPORE PTE LIMITED,NEW DELHI,Architectural and engineering activities and related technical consultancy,34.38,0.53,
1632,STATKRAFT MARKETS PRIVATE LTD (EAR:SN PO,Singapore,SN POWER HOLDING SINGAPORE PTE LTD.,NEW DELHI,"Collection and distribution of electric energy to households, industrial, commercial and other users",500.00,7.68,
1633,STATKRAFT MARKETS PRIVATE LTD (EAR:SN PO,Singapore,SN POWER HOLDING SINGAPORE PTE. LTD.,NEW DELHI,"Collection and distribution of electric energy to households, industrial, commercial and other users",5.00,0.08,
1634,BELONG TECHNOLOGIES INDIA PRIVATE LIMTIE,Singapore,BELONG PTE LTD,BANGALORE,Data processing activities including report writing,0.10,0.00,
1635,SIMBHAOLI POWER LTD,Singapore,Syndicatum Captive Energy Singapore,KANPUR,Electric power generation using,144.00,2.21,
Sl. No,Name of Indian Company,Country,Name of Foreign Collaborator,RBI Regional Office,Item of Manufacture,Amount of FDI Inflows,,
,,,,,,(In Rs million),(In US$ million),
,,,,,other non conventional sources,,,
1636,KNOWLARITY COMMUNICATION INDIA PVT LTD,Singapore,KNOWLARITY COMMUNICATIONS HOLDINGS PTE L,NEW DELHI,Other business support service activities n.e.c.,2.08,0.03,
1637,IBIBO GROUP PRIVATE LIMITED,Singapore,MIH INDIA ECOMMERCE PTE LIMITED,NEW DELHI,Operation of web sites that use a search engine to generate and maintain extensive databases of internet,309.70,4.76,
1638,"CYKLOP PACKAGING SYSTEM (INDIA)
P. LTD",Singapore,Cyklop Asia Pte. Ltd,NEW DELHI,Packaging activities,14.11,0.22,
1639,ZAZA FOODS PRIVATE LIMITED,Singapore,NICKLAUS ERICK CUA SY,NEW DELHI,Restaurants without bars,0.69,0.01,
1640,ZAZA FOODS PRIVATE LIMITED,Singapore,OKADA RYOICHI,NEW DELHI,Restaurants without bars,0.92,0.01,
1641,ZAZA FOODS PRIVATE LIMITED,Singapore,TO ZIHAO SHAUN,NEW DELHI,Restaurants without bars,0.92,0.01,
1642,AZURE HOSPITALITY PVT LTD,Singapore,BROAD STREET INVESTMENTS (SINGAPORE) PTE,NEW DELHI,Bars and Restaurants with bars,0.00,0.00,
1643,AZURE HOSPITALITY PVT LTD,Singapore,BROAD STREET INVESTMENTS (SINGAPORE) PTE,NEW DELHI,Bars and Restaurants with bars,650.02,9.99,
1644,GRAM VANI COMMUNITY MEDIA PRIVATE LIMITE,Singapore,SADEESH RAGHVAN,NEW DELHI,Other information technology and computer service activities n.e.c,0.38,0.01,
1645,CROWN INFRA PROJECTS PRIVATE LIMITED,Singapore,TRIKAR RESIDENTIAL DEVELOPERS PVT LTD,NEW DELHI,Construction of buildings carried out on own-account basis or on a fee or contract basis,14.61,0.22,
1646,INTERNATIONAL HOSPITAL LIMITED,Singapore,fortis global healthcare infrastructure,NEW DELHI,"Other human health activities
n.e.c. (including independent ambulance activities)",330.00,4.98,
1647,ZAMIRA LIFESCIENCES INDIA PRIVATE LIMITE,Singapore,ZAMIRA LIFE SCIENCES PTE LTD,NEW DELHI,Wholesale of pharmaceutical and medical goods,7.65,0.12,
1648,MASSIVE RESTAURANTS PRIVATE LIMITED,Singapore,F & B Asia Ventures Singapore Pte Ltd,NEW DELHI,Bars and Restaurants with bars,239.99,3.62,
1649,INABATA INDIA PVT. LTD.,Singapore,inabata singapore pte ltd,NEW DELHI,Other non-specialised wholesale trade n.e.c.,44.80,0.68,
1650,AACHVIS IT SEZ INFRA PRIVATE LIMITED,Singapore,BREP ASIA SG OXYGEN HOLDING (NQ) PTE LTD,NEW DELHI,Construction of buildings carried out on own-account basis or on a fee or contract basis,128.17,1.94,
1651,CROWN INFRA PROJECTS PRIVATE LIMITED,Singapore,TRIKAR RESIDENTIAL DEVELOPERS PVT LTD,NEW DELHI,Construction of buildings carried out on own-account basis or on a fee or contract basis,14.56,0.22,
1652,METALITE ECO FUTURE LABS PRIVATE LIMITED,Singapore,TUSKAR HOLDINGS PTE LTD,NEW DELHI,"Manufacture of other non- metallic mineral products n.e.c.
(includes asbestos yarn and fabric, and articles",4.41,0.07,
1653,INTERNATIONAL HOSPITAL LIMITED,Singapore,fortis global healthcare infrastructure,NEW DELHI,"Other human health activities
n.e.c. (including independent ambulance activities)","6,508.00",98.28,
1654,INTERNATIONAL HOSPITAL LIMITED,Singapore,fortis global healthcare infrastructure,NEW DELHI,"Other human health activities
n.e.c. (including independent ambulance activities)",811.78,12.26,
1655,IBIBO GROUP PRIVATE LIMITED,Singapore,MIH INDIA ECOMMERCE PTE LTD,NEW DELHI,Operation of web sites that use a search engine to generate and maintain extensive databases of internet,332.91,5.03,
1656,STATKRAFT INDIA PRIVATE LIMITED (EAR: SN,Singapore,Statkraft Holding Singapore pte ltd,NEW DELHI,Architectural and engineering activities and related technical consultancy,37.79,0.57,
1657,HEXIN METAL PVT LTD,Singapore,Koh Mia Chye,NEW DELHI,Manufacture of direct reduction of iron (sponge iron) and other spongy ferrous products,6.13,0.09,
1658,DR FRESH HEALTHCARE PVT. LTD.,Singapore,Ascendas India Dev. II Pte. Ltd.,NEW DELHI,Construction of buildings carried out on own-account basis or on a fee or contract basis,2.04,0.03,
1659,DJB INFRASTRUCTURE & DEVELOPERS INDIA PV,Singapore,d joravar singh,NEW DELHI,"Hotels and Motels, inns, resorts providing short term lodging facilities includes accommodation in house",5.00,0.08,
1660,GLOBAL INDIAN SCHOOL EDUCATION SERVICES,Singapore,Global IndianSchools Holdings Pte Ltd,NEW DELHI,Other educational services n.e.c.,100.00,1.51,
1661,DREAMCANN FOODS PRIVATE LIMITED,Singapore,Stylemyle(Singapore)Pte. Ltd.,NEW DELHI,"Other semi-processed, processed or instant foods n.e.c. except farinaceous products and malted foods",1.90,0.03,
1662,CASTEX TECHNOLOGIES LIMITED,Singapore,MORGAN STANLEY ASIA (SINGAPORE) PTE,NEW DELHI,Casting of non-ferrous metals,50.23,0.77,
1663,CASTEX TECHNOLOGIES LIMITED,Singapore,Morgan Stanley Asia,NEW DELHI,Casting of non-ferrous metals,50.23,0.77,
Sl. No,Name of Indian Company,Country,Name of Foreign Collaborator,RBI Regional Office,Item of Manufacture,Amount of FDI Inflows,,
,,,,,,(In Rs million),(In US$ million),
1664,GREY ORANGE INDIA PRIVATE LIMITED,Singapore,Grey Orange PTE Ltd.,NEW DELHI,Manufacture of other special- purpose machinery n.e.c.,"1,022.95",15.72,
1665,SANNAM S4 CONSULTING PVT. LTD.,Singapore,Sannam S4 Investment Pte. Ltd.,NEW DELHI,Management consultancy activities,5.48,0.08,
1666,FAME DIGITAL PRIVATE LIMITED (EAR: FOUR,Singapore,FAME DIGITAL ASIA PTE LIMITED,NEW DELHI,Other information service activities n.e.c.,87.61,1.35,
1667,WITHYA HR FUND PRIVATE LIMITED,Singapore,AMEESH JITENDRA THAKKAR,NEW DELHI,Management consultancy activities,5.00,0.08,
1668,CROWN INFRA PROJECTS PRIVATE LIMITED,Singapore,TRIKAR RESIDENTIAL DEVELOPERS PRIVATE LI,NEW DELHI,Construction of buildings carried out on own-account basis or on a fee or contract basis,11.11,0.17,
1669,FIRST SOLAR POWER INDIA PRIVATE LIMITED,Singapore,First Solar FE Holdings Pte ltd,MUMBAI,Other business support service activities n.e.c.,0.10,0.00,
1670,ZAMIRA LIFESCIENCES INDIA PRIVATE LIMITE,Singapore,ZAMIRA LIFE SCIENCES PTE LIMITED,NEW DELHI,Wholesale of pharmaceutical and medical goods,1.84,0.03,
1671,STATKRAFT MARKETS PRIVATE LTD (EAR:SN PO,Singapore,SN POWER HOLDING SINGAPORE PTE LTD.,NEW DELHI,"Collection and distribution of electric energy to households, industrial, commercial and other users",15.55,0.24,
1672,FIRST SOLAR POWER INDIA PRIVATE LIMITED,Singapore,First Solar Vietnam Holdings Pte Ltd,MUMBAI,Other business support service activities n.e.c.,0.00,0.00,
1673,ASSETS CARE & RECONSTRUCTION ENTERPRISE,Singapore,SSG Capital Management (Singapore) Pte,NEW DELHI,"Other financial service activities, except insurance and pension funding activities, n.e.c.",413.30,6.35,
1674,ATEN CAPITAL PRIVATE LIMITED,Singapore,aten Holdings Pte Ltd.,NEW DELHI,"Other financial service activities, except insurance and pension funding activities, n.e.c.",31.08,0.48,
1675,ZAZA FOODS PRIVATE LIMITED,Singapore,BROADHEAD MICHAEL LESLIE,NEW DELHI,Restaurants without bars,1.84,0.03,
1676,NV VOGTSOLAR ENERGY INDIA PVT. LTD,Singapore,NV VOGT SINGAPORE PTE LIMITED,NEW DELHI,Electric power generation using solar energy,1.90,0.03,
1677,FIRST SOLAR POWER INDIA PRIVATE LIMITED,Singapore,First Solar FE Holdings Pte Ltd,MUMBAI,Other business support service activities n.e.c.,600.00,9.22,
1678,FIRST SOLAR POWER INDIA PRIVATE LIMITED,Singapore,First Solar FE Holdings Pte Ltd,MUMBAI,Other business support service activities n.e.c.,10.90,0.17,
1679,STATKRAFT MARKETS PRIVATE LTD (EAR:SN PO,Singapore,sn power holding singapore pte ltd.,NEW DELHI,"Collection and distribution of electric energy to households, industrial, commercial and other users",12.20,0.19,
1680,LANDMARK AUTOMOBILES PRIVATE LIMITED,Singapore,TPG GROWTH II SF PTE LTD,AHMEDABAD,Sale of motor vehicle parts and accessories,0.10,0.00,
1681,LANDMARK AUTOMOBILES PRIVATE LIMITED,Singapore,TPG GROWTH II SF PTE LTD,AHMEDABAD,Sale of motor vehicle parts and accessories,508.84,7.82,
1682,BLANK PAGE INNOVATIONS PVT LTD,Singapore,PIX VINE CAPITAL PTE LTD,AHMEDABAD,Providing software support and maintenance to the clients,3.52,0.05,
1683,SOUTH INDIA KRISHNA OIL AND FATS PVT LTD,Singapore,SOUTH INDIA OILS & FATS PTE. LTD.,NEW DELHI,Manufacture of hydrogenated oil and vanaspati ghee,271.97,4.18,
1684,HANKYU HANSHIN EXPRESS INDIA PVT LTD ( E,Singapore,HANKYU HANSHIN EXPRESS (SINGAPORE) PTE.,NEW DELHI,Service activities incidental to water transportation,20.00,0.31,
1685,CASTEX TECHNOLOGIES LIMITED,Singapore,MORGAN STANLEY ASIA (SINGAPORE) PTE,NEW DELHI,Casting of non-ferrous metals,44.67,0.69,
1686,CASTEX TECHNOLOGIES LIMITED,Singapore,CREDIT SUISSE SINGAPORE LIMITED,NEW DELHI,Casting of non-ferrous metals,122.85,1.89,
1687,MINDA CORPORATION LTD,Singapore,almighty international pte ltd,NEW DELHI,Manufacture of automotive emissions testing equipment,2.70,0.04,
1688,JANAADHAR (INDIA) PRIVATE LIMITED,Singapore,BADRINARAYAN PILINJA,BANGALORE,Construction of buildings carried out on own-account basis or on a fee or contract basis,20.00,0.31,
1689,BRIDGE CAPITAL ADVISORS PVT LTD,Singapore,bridge capital pte ltd,NEW DELHI,Management consultancy activities,1.89,0.03,
1690,GLOBAL INSTITUTE OF INTELLECTUAL PROPERT,Singapore,PRASHANT KEDIA,NEW DELHI,Other educational services n.e.c.,0.28,0.00,
1691,HAPPY MARKETER DIGITAL PRIVATE LIMITED,Singapore,HAPPY MARKETER PRIVATE LIMITED,BANGALORE,Other information technology and computer service activities n.e.c,0.10,0.00,
1692,EMERGE LEARNING SERVICES PRIVATE LIMITED,Singapore,Satpal Khattar,CHENNAI,Other educational services n.e.c.,14.96,0.23,
1693,EMERGE LEARNING SERVICES PRIVATE LIMITED,Singapore,Satpal Khattar,CHENNAI,Other educational services n.e.c.,14.93,0.23,
1694,QUEST GLOBAL DEFENCE ENGINEERING SERVICE,Singapore,QUEST GLOBAL SERVICES PTE. LTD,BANGALORE,Other civil engineering projects n.e.c.,1.87,0.03,
1695,NXTGEN DATACENTER AND CLOUD TECHNOLOGIES,Singapore,NXTGEN TECHNOLOGY PTE LTD,BANGALORE,"Writing , modifying, testing of computer program to meet the needs of a particular client",414.57,6.37,
,,,,,,,,
Sl. No,Name of Indian Company,Country,Name of Foreign Collaborator,RBI Regional Office,Item of Manufacture,Amount of FDI Inflows,,
,,,,,,(In Rs million),(In US$ million),
,,,,,excluding web-page,,,
1696,3F FUJI FOODS PRIVATE LIMITED,Singapore,Fuji Oil Co  Ltd,HYDERABAD,Wholesale of other basic/manufactured food stuffs n.e.c.,14.70,0.23,
1697,TAKAHATA PRECISION INDIA PVT LTD,Singapore,TAKAHATA PRECISION PTE LIMITED,NEW DELHI,"Manufacture of machine tools for turning, drilling, milling, shaping,
planning, boring, grinding etc",55.00,0.85,
1698,IBIBO GROUP PRIVATE LIMITED,Singapore,MIH INDIA ECOMMERCE PTE LIMITED,NEW DELHI,Operation of web sites that use a search engine to generate and maintain extensive databases of internet,639.58,9.83,
1699,DJB INFRASTRUCTURE & DEVELOPERS INDIA PV,Singapore,JAGDEESH KAUR,NEW DELHI,"Hotels and Motels, inns, resorts providing short term lodging facilities includes accommodation in house",0.90,0.01,
1700,CTS INDIA PVT LTD,Singapore,CTS SINGAPORE PTE LTD,NEW DELHI,"Manufacture of motor vehicle electrical equipment, such as generators, alternators, spark plugs, ignition",3.87,0.06,
1701,CTS INDIA PVT LTD,Singapore,CTS SINGAPORE PTE LIMITED,NEW DELHI,"Manufacture of motor vehicle electrical equipment, such as generators, alternators, spark plugs, ignition",12.05,0.19,
1702,CROSSCOOP INDIA PVT LTD,Singapore,Social Wire Holdings PTE LTD,NEW DELHI,Other reservation service and related activities,8.00,0.12,
1703,CASTEX TECHNOLOGIES LIMITED,Singapore,Credit suisse singapore ltd,NEW DELHI,Casting of non-ferrous metals,50.23,0.77,
1704,CASTEX TECHNOLOGIES LIMITED,Singapore,Credit suisse singapore ltd,NEW DELHI,Casting of non-ferrous metals,200.94,3.09,
1705,THE TEMPERAMENTAL CHEF PRIVATE LIMITED,Singapore,Siddharth Kumar,NEW DELHI,"Other semi-processed, processed or instant foods n.e.c. except farinaceous products and malted foods",0.85,0.01,
1706,NAVRAN ADVANCED NANO PRODUCTS DEVELOPME,Singapore,Khattar Holdings Pte. Ltd,NEW DELHI,Manufacture of printing ink,20.00,0.31,
1707,THE TEMPERAMENTAL CHEF PRIVATE LIMITED,Singapore,Siddhartha Kumar,NEW DELHI,"Other semi-processed, processed or instant foods n.e.c. except farinaceous products and malted foods",0.90,0.01,
1708,MONTAPLAST INDIA PVT LTD,Singapore,Aldebaran Investment Asia Pacific Pte. L,MUMBAI,"Manufacture of parts and accessories of bodies for motor
vehicles such as safety belts, airbags, doors,",55.50,0.85,
1709,CASTEX TECHNOLOGIES LIMITED,Singapore,Samena India Credit singapore pvt ltd,NEW DELHI,Casting of non-ferrous metals,80.38,1.24,
1710,"CYKLOP PACKAGING SYSTEM (INDIA)
P. LTD",Singapore,CYKLOP ASIA PTE.LTD,NEW DELHI,Packaging activities,2.22,0.03,
1711,INDIAN EXPRESS NEWSPAPERS MUMBAI PVT LTD,Singapore,BREP ASIA SG INDIAN HOLDING NQ CO II PTE,MUMBAI,"Construction and maintenance of
industrial facilities such as refineries chemical plants etc.",9.49,0.15,
1712,INDIAN EXPRESS NEWSPAPERS MUMBAI PVT LTD,Singapore,BREP VII SG INDIAN HOLDING (NQ) CO II PT,MUMBAI,Construction and maintenance of industrial facilities such as refineries chemical plants etc.,2.37,0.04,
1713,KLICKBRICK HOUSING CONSULTANTS (PHALCOMM,Singapore,BRICK EAGLE VENTURES PVT LTD,MUMBAI,Real estate activities on a fee or contract basis,10.00,0.15,
1714,GREAT CIRCLE LINE INDIA PVT LTD,Singapore,Great Circle Holdings Pte Ltd.,MUMBAI,Activities of shipping cargo agents,10.57,0.16,
1715,UMBERTO CERAMICS INTERNATIONAL PVT.LTD,Singapore,Star India Holding PTE. Ltd,MUMBAI,Manufacture of ceramic products n.e.c.,13.36,0.21,
1716,CRAFTSVILLA HANDICRAFTS PVT LTD,Singapore,SUPERA INVESTMENTS PTE LTD,MUMBAI,Other business support service activities n.e.c.,100.00,1.54,
1717,GROFERS INDIA PRIVATE LIMITED,Singapore,GROFERS INTERNATIONAL PTE LIMITED,NEW DELHI,Other business support service activities n.e.c.,"2,217.25",34.07,
1718,IBIBO GROUP PRIVATE LIMITED,Singapore,MIH INDIA ECOMMERCE PTE LIMITED,NEW DELHI,"Operation of web sites that use a search engine to generate and
maintain extensive databases of internet",309.54,4.76,
1719,IBIBO GROUP PRIVATE LIMITED,Singapore,MIH INTERNET SEA PTE LIMITED,NEW DELHI,Operation of web sites that use a search engine to generate and maintain extensive databases of internet,0.76,0.01,
1720,TRINSEO INDIA TRADING PVT LTD,Singapore,styron holdings asia pte ltd,MUMBAI,Wholesale of plastic materials in primary forms,118.80,1.83,
1721,TRINSEO INDIA TRADING PVT LTD,Singapore,styron singapore ltd.,MUMBAI,Wholesale of plastic materials in primary forms,1.20,0.02,
1722,DIGIVATION DIGITAL SOLUTION PRIVATE LIMI,Singapore,CROSSROADS CONSULTANTS PTE. LTD.,MUMBAI,"Writing , modifying, testing of computer program to meet the",6.10,0.09,
Sl. No,Name of Indian Company,Country,Name of Foreign Collaborator,RBI Regional Office,Item of Manufacture,Amount of FDI Inflows,,
,,,,,,(In Rs million),(In US$ million),
,,,,,needs of a particular client excluding web-page,,,
