796,DORIN INDIA PRIVATE LIMITED,Japan,Dorin kogyosho ltd liability company,NEW DELHI,"Manufacture of diverse parts and accessories for motor vehecles sucs as brakes, gearboxes, axles, road",60.00,0.91,
797,DAIICHI N HORIZON AUTOCOMP PVT LTD,Japan,Daiichi Kogyo Co. Ltd.,NEW DELHI,Manufacture of parts and accessories of three wheelers and motorcycles including side cars,96.00,1.45,
798,DAIICHI N HORIZON AUTOCOMP PVT LTD,Japan,Nissan Screw Co. Ltd.,NEW DELHI,Manufacture of parts and accessories of three wheelers and motorcycles including side cars,12.00,0.18,
799,NGK TECHNOLOGIES INDIA PRIVATE LIMITED,Japan,NGK INSULATORS LTD,NEW DELHI,Other business support service activities n.e.c.,29.99,0.45,
800,AOKI LABORATORY INDIA PVT LTD,Japan,Aoki Technical Laboratory Inc,MUMBAI,Manufacture of other special- purpose machinery n.e.c.,4.95,0.07,
801,DMW INDIA PVT LTD,Japan,DMW CORPORATION,MUMBAI,Manufacture of fluid power equipment,110.14,1.66,
802,SMAS AUTO LEASING INDIA PRIVATE LIMITED,Japan,Sumitomo Mitsui Auto Services Coy. Ltd.,NEW DELHI,Renting and leasing of motor vehicles,712.20,10.76,
803,SMAS AUTO LEASING INDIA PRIVATE LIMITED,Japan,Sumitomo Corporation,NEW DELHI,Renting and leasing of motor vehicles,474.80,7.17,
804,FINOLEX J POWER SYSTEMS LTD,Japan,J-Power Systems Corporation,MUMBAI,"Manufacture of other electronic and electric wires and cables (insulated wire and cable made
of steel,",51.00,0.77,
805,WNT TOTAL TOOLING INDIA PRIVATE LIMITED,Japan,OSG Corporation,NEW DELHI,Other non-specialised wholesale trade n.e.c.,1.80,0.03,
806,ZERO PLUS INDIA PVT LTD,Japan,APIA CO LTD,NEW DELHI,Washing and (dry-) cleaning of textile and fur products,0.51,0.01,
807,TOYO INK INDIA PVT LTD,Japan,TOYO INK SC HOLDINGS CO LTD,NEW DELHI,Manufacture of printing ink,25.00,0.38,
808,SANKEI PRAGATI INDIA PVT.LTD,Japan,SG Finance Co. Ltd.,NEW DELHI,Manufacture of other fabricated metal products n.e.c.,84.00,1.27,
809,GANGA DESIGN STUDIO PVT LTD,Japan,Maki Textiles Studio Co. Ltd.,KANPUR,Finishing of man-made and blended man-made textiles.,14.19,0.21,
810,DECAL INDIA SCREEN PRINTING PRIVATE LIMI,Japan,DECAL JAPAN CO. LTD.,KOLKATA,Other printing activities like screen printing other than textile n.e.c.,5.93,0.09,
811,DECAL INDIA SCREEN PRINTING PRIVATE LIMI,Japan,DECAL JAPAN CO. LTD.,KOLKATA,Other printing activities like screen printing other than textile n.e.c.,9.77,0.15,
812,KANAZAWA MACHINE AND TOOLS INDIA PRIVATE,Japan,Kunimitsu Kanazawa,NEW DELHI,"Wholesale of other machinery, equipment and supplies n.e.c. including computer-controlled machine tools",2.50,0.04,
813,KANAZAWA MACHINE AND TOOLS INDIA PRIVATE,Japan,"Kanazawa Machine & Tool Co., Ltd.",NEW DELHI,"Wholesale of other machinery, equipment and supplies n.e.c. including computer-controlled machine tools",7.50,0.11,
814,CHUKAN BUTSU EXIM (INDIA) PRIVATE LIMITE,Japan,CHUKAN BUTSU LTD,AHMEDABAD,Other non-specialised wholesale trade n.e.c.,4.85,0.07,
815,MIRAKIN ENTERPRISES PRIVATE LIMITED,Japan,SKYLIGHT CONSULTING INC,NEW DELHI,"Manufacture of jewellery of gold, silver and other precious or base metal metal clad with precious
metals",2.20,0.03,
816,YOKOHAMA INDIA PVT LTD,Japan,THE YOKOHAMA RUBBER COMPANY LIMITED,NEW DELHI,"Manufacture of rubber tyres and tubes for motor vehicles, motorcycles, scooters, three- wheelers, tractors",600.00,9.06,
817,ANUPAM-MHI INDUSTRIES LTD,Japan,MITSUBISHI HEAVY INDUSTRIES,AHMEDABAD,Manufacture of other lifting and handling equipment and parts thereof,399.00,6.03,
818,MANPASAND BEVERAGES LTD.,Japan,FIIs,AHMEDABAD,"Manufacture of fruit or vegetable juices and their concentrates,
squashes and powder","1,260.54",19.04,
819,CHUKAN BUTSU EXIM (INDIA) PRIVATE LIMITE,Japan,HIROKI KADOTA,AHMEDABAD,Other non-specialised wholesale trade n.e.c.,0.05,0.00,
Sl. No,Name of Indian Company,Country,Name of Foreign Collaborator,RBI Regional Office,Item of Manufacture,Amount of FDI Inflows,,
,,,,,,(In Rs million),(In US$ million),
820,PPE SAFETY PRIVATE LIMITED,Japan,EST INC,AHMEDABAD,Manufacture of all types of textile garments and clothing accessories,2.11,0.03,
821,I.I. INSPECTION & EXPORT PVT LTD,Japan,HIGASHIDA CO. LTD.,NEW DELHI,Manufacture of all types of textile garments and clothing accessories,1.00,0.02,
822,I.I. INSPECTION & EXPORT PVT LTD,Japan,MIYAMA HOTTA,NEW DELHI,Manufacture of all types of textile garments and clothing accessories,1.00,0.02,
823,NHK SPRING INDIA LTD(FORM.JAMNA NHK ALLE,Japan,NHK SPRING CO LTD,NEW DELHI,Manufacture of other articles n.e.c.,250.00,3.78,
824,FRASCO ADVANCED TECHNOLOGY PVT. LTD.,Japan,TOHRU YASUDA,KOCHI,Computer consultancy and computer facilities management activities,0.01,0.00,
825,DECAL INDIA SCREEN PRINTING PRIVATE LIMI,Japan,DECAL JAPAN CO. LTD.,KOLKATA,Other printing activities like screen printing other than textile n.e.c.,8.48,0.13,
826,DECAL INDIA SCREEN PRINTING PRIVATE LIMI,Japan,KENJI MATSUMOTO,KOLKATA,Other printing activities like screen printing other than textile n.e.c.,0.01,0.00,
827,DECAL INDIA SCREEN PRINTING PRIVATE LIMI,Japan,GO OJIMA,KOLKATA,Other printing activities like screen printing other than textile n.e.c.,0.10,0.00,
828,KOBELCO MACHINERY INDIA PVT LTD,Japan,Kobe Steel Ltd,KOLKATA,Other business support service activities n.e.c.,3.60,0.05,
829,KOBELCO MACHINERY INDIA PVT LTD,Japan,Shinsho Corporation Japan,KOLKATA,Other business support service activities n.e.c.,0.40,0.01,
830,DECAL INDIA SCREEN PRINTING PRIVATE LIMI,Japan,DECAL JAPAN CO.LTD.,KOLKATA,Other printing activities like screen printing other than textile n.e.c.,5.70,0.09,
831,DECAL INDIA SCREEN PRINTING PRIVATE LIMI,Japan,DECAL JAPAN CO.LTD.,KOLKATA,Other printing activities like screen printing other than textile n.e.c.,5.71,0.09,
832,I.I. INSPECTION & EXPORT PVT LTD,Japan,MIYAMA HOTTA,NEW DELHI,Manufacture of all types of textile garments and clothing accessories,0.00,0.00,
833,SINTO BHARAT MANUFACTURING PVT LTD,Japan,SINTOKOGIO LTD,CHENNAI,"Manufacture of other made-up textile articles, except apparel
n.e.c.",59.20,0.89,
834,FRASCO ADVANCED TECHNOLOGY PVT. LTD.,Japan,KOICHI FUJIWARA,KOCHI,Computer consultancy and computer facilities management activities,1.69,0.03,
835,GRP RESTAURANT AND TRADING PRIVATE LIMIT,Japan,JAPAN INC,CHENNAI,Restaurants without bars,3.38,0.05,
836,GRP RESTAURANT AND TRADING PRIVATE LIMIT,Japan,KAZUAKI TSUJI,CHENNAI,Restaurants without bars,1.13,0.02,
837,ALPHA SECURITY INSTRUMENTS INDIA P LTD,Japan,ALPHA CORPORATION,CHENNAI,"Manufacture of padlocks, locks, keys, hinges and the like, hardware for buildings, furniture, vehicles",120.00,1.81,
838,SECURO INDIA PVT LTD,Korea(North),SECURO CO. LTD.,NEW DELHI,Computer consultancy and computer facilities management activities,2.20,0.03,
839,LUCKY IMPORT & EXPORT PVT LTD,Lebanon,SALEH NASSIB ABDEL BAKI,PANAJI,Other non-specialised wholesale trade n.e.c.,0.09,0.00,
840,ACC INDIA PVT LTD,Lebanon,Arabian Construction Group Sal (Holdings,NEW DELHI,Other construction projects n.e.c.,5.36,0.08,
841,FIBERFOX INDIA PRIVATE LIMITED,South Korea,FIBERFOX INC,NEW DELHI,Manufacture of optical instruments and equipment,1.84,0.03,
842,FIBERFOX INDIA PRIVATE LIMITED,South Korea,FIBERFOX INC,NEW DELHI,Manufacture of optical instruments and equipment,0.10,0.00,
843,SIGTECH WIRELESS TECHNOLOGIES PVT. LTD.,South Korea,HYUNGKI MIN,KOCHI,"Activities of Internet access by
the operator of the wireless infrastructure",1.24,0.02,
844,HYOSUNG T & D INDIA PRIVATE LIMITED,South Korea,Hyosung Corporation,NEW DELHI,"Manufacture of electric power distribution transformers, arc- welding transformers, fluorescent ballasts,",670.00,10.30,
845,CORDI EYE INDIA PVT LTD,South Korea,Cordi Eye CO. Ltd,NEW DELHI,"Manufacture of cosmetics and toileteries (includes manufacture of preshave, shaving or after shave preparations;",0.41,0.01,
846,CORDI EYE INDIA PVT LTD,South Korea,Cordi Eye CO. Ltd,NEW DELHI,"Manufacture of cosmetics and toileteries (includes manufacture of preshave, shaving or after shave preparations;",0.33,0.00,
Sl. No,Name of Indian Company,Country,Name of Foreign Collaborator,RBI Regional Office,Item of Manufacture,Amount of FDI Inflows,,
847,,,,,,(In Rs million),(In US$ million),
,DOOSAN POWER SYSTEMS INDIA PRIVATE LIMIT,South Korea,Doosan Heavy Industries & Construction C,NEW DELHI,Other construction projects n.e.c.,8.83,0.13,
848,SD BIOSENSOR HEALTHCARE PRIVATE LIMITED,South Korea,SD BIOSENSOR INC,NEW DELHI,"Wholesale of scientific, medical and surgical machinery and equipment",84.05,1.27,
849,SD BIOSENSOR HEALTHCARE PRIVATE LIMITED,South Korea,BIONOTE,NEW DELHI,"Wholesale of scientific, medical
and surgical machinery and equipment",8.12,0.12,
850,SD BIOSENSOR HEALTHCARE PRIVATE LIMITED,South Korea,49 INDIVIDUALS,NEW DELHI,"Wholesale of scientific, medical and surgical machinery and equipment",226.16,3.42,
851,DOOSAN POWER SYSTEMS INDIA PRIVATE LIMIT,South Korea,Doosan Heavy Industries & Construction C,NEW DELHI,Other construction projects n.e.c.,143.70,2.17,
852,KOWEPO INDIA PVT LTD,South Korea,Seung Tai Lim (Nominee of Korea Western,HYDERABAD,Electric power generation by hydroelectric power plants,0.00,0.00,
853,CSE INDIA PRIVATE LIMITED,South Korea,CSE CO LTD,NEW DELHI,Manufacture of electric motors (except internal combustion engine starting motors),0.81,0.01,
854,SKE&C INDIA PRIVATE LIMITED,South Korea,SK Engineering & Construction Co. Pvt. L,NEW DELHI,Architectural and engineering activities and related technical consultancy,39.46,0.61,
855,SKE&C INDIA PRIVATE LIMITED,South Korea,SK Engineering & Construction Co. Ltd.,NEW DELHI,Architectural and engineering activities and related technical consultancy,61.47,0.94,
856,HEEHOON DESIGN GLOBAL PRIVATE LIMITED,South Korea,JONG DAE KIM,NEW DELHI,"Wholesale of other machinery, equipment and supplies n.e.c. including computer-controlled machine tools",0.10,0.00,
857,RENEW AKSHAY URJA PRIVATE LIMITED,South Korea,HANWHA Q CELLS CORPORATION,NEW DELHI,Electric power generation using solar energy,591.21,9.09,
858,GS ENGINEERING & CONSTRUCTION DELHI  PVT,South Korea,GS Engineering And Construction Corp.,NEW DELHI,Architectural and engineering activities and related technical consultancy,324.26,4.98,
859,DNI TECH COMPANY PVT. LTD.,South Korea,DR TECH CO LTD,KANPUR,"Manufacture of pagers, cellular phones and other mobile communication equipment",62.72,0.96,
860,ECOMAISTER BEADS INDIA PVT LTD,South Korea,Ecomaister Co. Limited,BHOPAL,Materials recovery,12.30,0.19,
861,KOWEPO INDIA PVT LTD,South Korea,Korea Western Power Co Ltd,HYDERABAD,Electric power generation by hydroelectric power plants,100.00,1.54,
862,DAC AUTOMOTIVE PRIVATE LIMITED,South Korea,ATS CORPORATION,CHENNAI,Manufacture of other plastics products n.e.c.,11.52,0.18,
863,ERAE ENGINEERING PVT LTD,South Korea,UNITED PACIFIC PLG,MUMBAI,"Manufacture of other general purpose machinery n.e.c. ( fans intended for industrial applications, exhaust",2.24,0.04,
864,BTN INSULO INDIA PRIVATE LIMITED,South Korea,KOREA INSULO IND. CO. LTD.,NEW DELHI,Human resources provision and management of human resources functions,4.03,0.06,
865,DAC AUTOMOTIVE PRIVATE LIMITED,South Korea,MR LEE JAE JIN,CHENNAI,Manufacture of other plastics products n.e.c.,0.06,0.00,
866,DAC AUTOMOTIVE PRIVATE LIMITED,South Korea,GEN JAE CHUN,CHENNAI,Manufacture of other plastics products n.e.c.,0.06,0.00,
867,DONGAH GEOLOGICAL ENGINEERING INDIA PRIV,South Korea,Donga Geological Engineering Co. Lltd.,NEW DELHI,"Construction and maintenance of motorways, streets, roads, other vehicular and pedestrian ways, highways,",0.85,0.01,
868,DONGAH GEOLOGICAL ENGINEERING INDIA PRIV,South Korea,Donga Geological Eng. Co. Ltd.,NEW DELHI,"Construction and maintenance of motorways, streets, roads, other vehicular and pedestrian ways, highways,",7.10,0.11,
869,GOOD MORNING CORPORATE SERVICES PVT. LTD,South Korea,Seok minseong,CHENNAI,Renting and leasing of motor vehicles,0.05,0.00,
870,GOOD MORNING CORPORATE SERVICES PVT. LTD,South Korea,Kwak Eun Seok,CHENNAI,Renting and leasing of motor vehicles,0.05,0.00,
871,K TECH PRIVATE LIMITED,South Korea,Kunhwa Eng. Co. Ltd.,CHENNAI,"Manufacture of rubber plates, sheets, strips, rods, tubes, pipes, hoses and profile -shapes etc.",63.43,1.00,
872,CSE INDIA PRIVATE LIMITED,South Korea,CSE CO LTD,NEW DELHI,Manufacture of electric motors (except internal combustion engine starting motors),3.59,0.06,
873,HUROM INDIA PRIVATE LIMITED,South Korea,Hurom CO. Ltd.,NEW DELHI,"Wholesale of other households goods, n.e.c. [Includes wholesale
of household equipment and appliances,",3.00,0.05,
Sl. No,Name of Indian Company,Country,Name of Foreign Collaborator,RBI Regional Office,Item of Manufacture,Amount of FDI Inflows,,
874,,,,,,(In Rs million),(In US$ million),
,DONGBANG PLANTECH INDIA PVT LTD,South Korea,KIL LEE,MUMBAI,Manufacture of other special- purpose machinery n.e.c.,0.05,0.00,
875,DNI TECH COMPANY PVT. LTD.,South Korea,"DR TECH CO.LTD. 476 WONCHEON- DONG,YEON",KANPUR,"Manufacture of pagers, cellular phones and other mobile communication equipment",62.72,0.96,
876,"DOOWON AUTOMOTIVE SYSTEMS INDIA PVT., LT",South Korea,Doown Electronics Co Ltd,CHENNAI,"Manufacture of motor vehicle electrical equipment, such as generators, alternators, spark plugs, ignition",30.52,0.46,
877,"DOOWON AUTOMOTIVE SYSTEMS INDIA PVT., LT",South Korea,Doown Heavy Industrial Co Ltd,CHENNAI,"Manufacture of motor vehicle electrical equipment, such as generators, alternators, spark plugs, ignition",18.68,0.28,
878,"DOOWON AUTOMOTIVE SYSTEMS INDIA PVT., LT",South Korea,Kim Jong Eum,CHENNAI,"Manufacture of motor vehicle electrical equipment, such as generators, alternators, spark plugs, ignition",28.65,0.43,
879,"DOOWON AUTOMOTIVE SYSTEMS INDIA PVT., LT",South Korea,Kim Jon Wan,CHENNAI,"Manufacture of motor vehicle electrical equipment, such as generators, alternators, spark plugs, ignition",28.57,0.43,
880,"DOOWON AUTOMOTIVE SYSTEMS INDIA PVT., LT",South Korea,Kim Nah young,CHENNAI,"Manufacture of motor vehicle electrical equipment, such as generators, alternators, spark plugs, ignition",28.57,0.43,
881,SUNGWOO STAMPING PRIVATE LIMITED,South Korea,SUNGWOO HITECH COMPANY LIMITED,CHENNAI,"Forging, pressing, stamping and roll-forming of metal; powder metallurgy",639.69,9.66,
882,MDS PACIFIC INDIA PRIVATE LIMITED,South Korea,MDS TECHNOLOGY CO LTD,BANGALORE,Wholesale of computers and computer peripheral equipment,17.50,0.26,
883,"TAEYANG METAL INDIA PVT., LTD.,",South Korea,TAEYANG METAL INDUSTRIAL CO LTD,CHENNAI,Manufacture of metal-forming machinery and machine tools n.e.c,153.90,2.32,
884,JBW AVIATION PVT LTD,South Korea,jounghee Lim,NEW DELHI,Cargo handling incidental to land transport,0.05,0.00,
885,JBW AVIATION PVT LTD,South Korea,Younhbae Lee,NEW DELHI,Cargo handling incidental to land transport,0.05,0.00,
886,ETOOS EDUCATION PVT.LTD.,South Korea,ETOOS CO LTD,NEW DELHI,Other educational services n.e.c.,18.01,0.27,
887,"TAEYANG METAL INDIA PVT., LTD.,",South Korea,TAEYANG METAL INDUSTRIAL CO LTD,CHENNAI,Manufacture of metal-forming machinery and machine tools n.e.c,58.58,0.88,
888,"TAEYANG METAL INDIA PVT., LTD.,",South Korea,TAEYANG METAL INDUSTRIAL CO LTD,CHENNAI,Manufacture of metal-forming machinery and machine tools n.e.c,461.10,6.96,
889,SKI AUTOMOTIVES (INDIA) PRIVATE LIMITED,South Korea,Sung Kang Son,NEW DELHI,"Manufacture of motor vehicle electrical equipment, such as generators, alternators, spark plugs, ignition",0.89,0.01,
890,CSE INDIA PRIVATE LIMITED,South Korea,CSE CO LTD,NEW DELHI,Manufacture of electric motors (except internal combustion engine starting motors),4.24,0.06,
891,LIFTEC E & C INDIA PVT LTD,South Korea,LIFTEC CO. LTD.,MUMBAI,Other specialized construction activities,7.10,0.11,
892,LIFTEC E & C INDIA PVT LTD,South Korea,LIFTEC CO LTD,MUMBAI,Other specialized construction activities,3.11,0.05,
893,SANDHAR HAN SUNG TECHNOLOGIES PRIVATE LI,South Korea,Hansung Imp Co Ltd,NEW DELHI,Manufacture of other plastics products n.e.c.,2.99,0.05,
894,EGCHEM COMPONENT INDIA PRIVATE LIMITED,South Korea,EGCHEM CO LTD,NEW DELHI,Manufacture of other communication equipments n.e.c.,9.93,0.15,
895,EGCHEM COMPONENT INDIA PRIVATE LIMITED,South Korea,EGCHEM CO LTD,NEW DELHI,"Manufacture of other communication equipments
n.e.c.",12.50,0.19,
896,HM DIGITAL INDIA PRIVATE LIMITED,South Korea,HM DIGITAL CO LTD,NEW DELHI,"Wholesale of electrical machinery, equipment and supplies, n.e.c.",0.02,0.00,
897,SKI AUTOMOTIVES (INDIA) PRIVATE LIMITED,South Korea,Sung Kang Son,NEW DELHI,"Manufacture of motor vehicle electrical equipment, such as generators, alternators, spark plugs, ignition",0.09,0.00,
898,TNST COMPONENT INDIA PVT LTD,South Korea,TNST CO LTD,NEW DELHI,"Manufacture of pagers, cellular
phones and other mobile communication equipment",25.00,0.38,
899,CORDI EYE INDIA PVT LTD,South Korea,Cordi Eye CO. LTD,NEW DELHI,Manufacture of cosmetics and toileteries (includes manufacture,1.21,0.02,
Sl. No,Name of Indian Company,Country,Name of Foreign Collaborator,RBI Regional Office,Item of Manufacture,Amount of FDI Inflows,,
,,,,,,(In Rs million),(In US$ million),
,,,,,"of preshave, shaving or after shave preparations;",,,
900,CORDI EYE INDIA PVT LTD,South Korea,Cordi Eye CO Ltd,NEW DELHI,"Manufacture of cosmetics and toileteries (includes manufacture of preshave, shaving or after shave preparations;",4.29,0.06,
901,CORDI EYE INDIA PVT LTD,South Korea,Myung IN Park,NEW DELHI,"Manufacture of cosmetics and toileteries (includes manufacture of preshave, shaving or after shave preparations;",0.10,0.00,
902,CORDI EYE INDIA PVT LTD,South Korea,Young Joon CHOI,NEW DELHI,"Manufacture of cosmetics and toileteries (includes manufacture of preshave, shaving or after shave preparations;",0.10,0.00,
903,SINWOO PACK INDIA PVT LTD,South Korea,geun jik lee (nominee of sinwoo co. ltd.,NEW DELHI,Manufacture of sacks and bags of paper,0.00,0.00,
904,SINWOO PACK INDIA PVT LTD,South Korea,SINWOO CO. LTD.,NEW DELHI,Manufacture of sacks and bags of paper,10.52,0.16,
905,HNV CASTING PRIVATE LIMITED (EAR: GRIMA,South Korea,NAM YANG METALS CO LTD,NEW DELHI,Casting of non-ferrous metals,57.80,0.87,
906,HM DIGITAL INDIA PRIVATE LIMITED,South Korea,HM Digital Co Ltd,NEW DELHI,"Wholesale of electrical machinery, equipment and supplies, n.e.c.",0.85,0.01,
907,KIRI DYES AND CHEMICALS LTD.,Kuwait,ANITA FURTADO,AHMEDABAD,Manufacture of dyes and pigments from any source in basic form or as concentrate,0.01,0.00,
908,DMI FINANCE PVT LTD,Kuwait,Rezayat Trading Co. Ltd.,NEW DELHI,"Other financial service activities, except insurance and pension funding activities, n.e.c.",22.34,0.35,
909,RUMANI TECHNOLOGIES PVT LTD,Kuwait,IMRAN RUMANI,MUMBAI,Other information service activities n.e.c.,0.05,0.00,
910,RUMANI TECHNOLOGIES PVT LTD,Kuwait,ASIF RUMANI,MUMBAI,Other information service activities n.e.c.,0.05,0.00,
911,RUMANI TECHNOLOGIES PVT LTD,Kuwait,NADEEM PARKAR,MUMBAI,Other information service activities n.e.c.,0.01,0.00,
912,DMI FINANCE PVT LTD,Kuwait,REZAYAT TRADING CO LTD,NEW DELHI,"Other financial service activities, except insurance and pension funding activities, n.e.c.",20.24,0.32,
913,AUTOLINE INDUSTRIAL PARKS LTD,Kuwait,Abdulaziz Nasir Ibrahim Al Saqabi,MUMBAI,Construction of buildings carried out on own-account basis or on a fee or contract basis,7.31,0.11,
914,VAS DATA SERVICES (P) LTD,Luxembourg,CAPRICORN S.A. SICAV-SIF,NEW DELHI,Manufacture of all types of textile garments and clothing accessories,2.20,0.03,
915,SINGPAI INDIA PRIVATE  LIMITED,Luxembourg,LUXPAI HOLDO S.A.R.L.,NEW DELHI,Management consultancy activities,0.00,0.00,
916,VOLKSWAGEN IT SERVICES INDIA PVT LTD,Luxembourg,Volkswagen Finance Luxemburg S.A,MUMBAI,Providing software support and maintenance to the clients,99.90,1.54,
917,COSMA INTERNATIONAL INDIA PVT LTD,Luxembourg,Magna Financing Luxemburg SARL,MUMBAI,"Manufacture of parts and accessories of bodies for motor vehicles such as safety belts, airbags, doors,",127.84,1.96,
918,RIVER BUSINESS SOLUTIONS PRIVATE LIMITED,Luxembourg,ALTISOURCE CONSULTING S.A.R.L,BANGALORE,"Accounting, bookkeeping and auditing activities",1.03,0.02,
919,WUDSTAY TRAVELS PVT LTD,Luxembourg,Simile Venture Partners SPF SA,NEW DELHI,Other reservation service and related activities,6.26,0.09,
920,DMI FINANCE PVT LTD,Luxembourg,NIS GANESHA S.A,NEW DELHI,"Other financial service activities, except insurance and pension funding activities, n.e.c.",105.43,1.66,
921,FLAKTWOODS ACS (INDIA) PRIVATE LIMITED,Luxembourg,FLAKT WOODS ACS SARL,NEW DELHI,"Manufacture of air-conditioning machines, including motor vehicles airconditioners",51.00,0.80,
922,FLAKTWOODS ACS (INDIA) PRIVATE LIMITED,Luxembourg,FLAKT WOODS ACS SARL,NEW DELHI,"Manufacture of air-conditioning machines, including motor
vehicles airconditioners",23.00,0.36,
923,AMAZON SELLER SERVICES PVT. LTD.,Luxembourg,AMAZON EURASIA HOLDINGS S.A.R.L,BANGALORE,Wholesale of other electronic equipments and parts thereof,0.20,0.00,
924,TM AUTOMOTIVE SEATING SYSTEMS PVT LTD,Luxembourg,magna financing luxembourg sarl,MUMBAI,Manufacture of car seats,0.25,0.00,
925,DMI FINANCE PVT LTD,Luxembourg,NIS Ganesha S.A.,NEW DELHI,"Other financial service activities, except insurance and pension
funding activities, n.e.c.",41.56,0.65,
926,AMAZON INTERNET SERVICES PVT LTD,Luxembourg,AMAZON EURASIA HOLDINGS S.A.R.L.,NEW DELHI,Other information technology and computer service activities,0.00,0.00,
Sl. No,Name of Indian Company,Country,Name of Foreign Collaborator,RBI Regional Office,Item of Manufacture,Amount of FDI Inflows,,
,,,,,,(In Rs million),(In US$ million),
,,,,,n.e.c,,,
927,XYLEM WATER SOLUTIONS INDIA PVT LTD,Luxembourg,XYLEM HOLDINGS SARL,AHMEDABAD,"Manufacture of other pumps, compressors, taps and valves etc.",129.74,2.04,
928,XYLEM WATER SOLUTIONS INDIA PVT LTD,Luxembourg,XYLEM LUXEMBOURG SARL,AHMEDABAD,"Manufacture of other pumps, compressors, taps and valves
etc.",369.26,5.80,
929,FAIRDEAL MULTIMEDIA PVT LTD,Luxembourg,Global Eagle Entertainment,MUMBAI,Motion picture distribution,"2,419.35",37.18,
930,GI HUMAN RESOURCES AND SERVICES PVT LTD,Luxembourg,GI International S.A.,NEW DELHI,Human resources provision and management of human resources functions,20.74,0.33,
931,WNT TOTAL TOOLING INDIA PRIVATE LIMITED,Luxembourg,Ceratizit S.A,NEW DELHI,Other non-specialised wholesale trade n.e.c.,8.20,0.12,
932,ARTSANA INDIA PVT LTD,Luxembourg,International Artsana SA,NEW DELHI,Wholesale of footwear,35.00,0.53,
933,COSMA INTERNATIONAL INDIA PVT LTD,Luxembourg,Magna Financing Luxemburg S a r L,MUMBAI,"Manufacture of bodies, including cabs for motor vehicles",900.30,13.60,
934,AMAZON ONLINE DISTRIBUTION SERVICES PRIV,Luxembourg,AMAZON EURASIA HOLDINGS S.A.R.L,BANGALORE,Other information technology and computer service activities n.e.c,0.00,0.00,
935,MALLINCKRODTPHARMACEUTICALS INDIA PVTLTD,Luxembourg,MALLINCKRODT GROUP S.A.R.L.,NEW DELHI,Management consultancy activities,0.00,0.00,
936,VAS DATA SERVICES (P) LTD,Luxembourg,CAPRICORN S.A. SICAV-SIF,NEW DELHI,Manufacture of all types of textile garments and clothing accessories,2.20,0.03,
937,SINGPAI INDIA PRIVATE  LIMITED,Luxembourg,LUXPAI HOLDO S.A.R.L.,NEW DELHI,Management consultancy activities,0.01,0.00,
938,XYLEM WATER SOLUTIONS INDIA PVT LTD,Luxembourg,XYLEM HOLDINGS SARL,AHMEDABAD,"Manufacture of other pumps, compressors, taps and valves etc.",33.10,0.50,
939,XYLEM WATER SOLUTIONS INDIA PVT LTD,Luxembourg,XYLEM LUXEMBOURG SARL,AHMEDABAD,"Manufacture of other pumps, compressors, taps and valves etc.",94.20,1.42,
940,NIRO CERAMIC INDIA PVT LTD,Malaysia,NIRO CERAMIC(M) SDN BHD,MUMBAI,Manufacture of refractory ceramic products,6.40,0.10,
941,AMMAN TRY SPONGE & POWER (P) LTD,Malaysia,KHUNNAVY LIMITED,CHENNAI,Manufacture of direct reduction of iron (sponge iron) and other spongy ferrous products,25.41,0.38,
942,NIRO CERAMIC INDIA PVT LTD,Malaysia,NIRO CERAMIC ( M) SDN BHD,MUMBAI,Manufacture of refractory ceramic products,2.19,0.03,
943,KFCH RESTAURANTS PVT LTD (MUMBAI CHICKEN,Malaysia,MAURITIUS FOOD CORPORATION PVT LTD,MUMBAI,Restaurants without bars,723.12,11.36,
944,NIRO CERAMIC INDIA PVT LTD,Malaysia,NIRO CERAMIC (M) SDN BHD,MUMBAI,Manufacture of refractory ceramic products,5.70,0.09,
945,NIRO CERAMIC INDIA PVT LTD,Malaysia,NIRO CERAMIC  (M) SDN BHD,MUMBAI,Manufacture of refractory ceramic products,2.16,0.03,
946,SATHYA AUTO PRIVATE LIMITED,Malaysia,UMW M AND E SDN BHD,CHENNAI,"Manufacture of diverse parts and accessories for motor vehecles sucs as brakes, gearboxes, axles, road",15.88,0.25,
947,CASTWEL AUTOPARTS PRIVATE LIMITED,Malaysia,UMW M AND E SDN,CHENNAI,Manufacture of direct reduction of iron (sponge iron) and other spongy ferrous products,50.97,0.80,
948,SATHYA AUTO PRIVATE LIMITED,Malaysia,UMW M AND E SDN BHD,CHENNAI,"Manufacture of diverse parts and accessories for motor vehecles sucs as brakes, gearboxes, axles, road",25.60,0.40,
949,AEON CREDIT SERVICE INDIA PVT LTD,Malaysia,Aeon Credit Service (M) Berhad,MUMBAI,"Other financial service activities, except insurance and pension funding activities, n.e.c.",100.00,1.57,
950,TOTAL SPORTS AND ENTERTAINMENT INDIA PVT,Malaysia,total sports asia sdn bhd.,MUMBAI,Other sports activities,1.55,0.02,
951,AEON CREDIT SERVICE INDIA PVT LTD,Malaysia,Aeon Credit Service (M) Berhad,MUMBAI,"Other financial service activities, except insurance and pension funding activities, n.e.c.",74.50,1.17,
952,NIRO CERAMIC INDIA PVT LTD,Malaysia,NIRO CERAMIC (M) SDN BHD,MUMBAI,Manufacture of refractory ceramic products,6.67,0.10,
953,RANBAXY LABORATORIES LTD.,Malaysia,4 NRI As per list attached with FCGPR,NEW DELHI,Manufacture of allopathic pharmaceutical preparations,3.05,0.05,
954,OLIVE BEACH PROPERTIES PRIVATE LIMITED,Malaysia,Jayapalasingam A/L Kandiah,CHENNAI,"Hotels and Motels, inns, resorts providing short term lodging facilities includes
accommodation in house",0.36,0.01,
