Table No.19 (b),,,,,,,,
"STATEMENT ON REMMITTANCE-WISE DETAILS OF FDI EQUITY INFLOWS UNDER ACQUISITION OF SHARES ROUTE
RECEIVED DURING JANUARY 2019 TO MARCH 2019",,,,,,,,
Sl. No,Name of Indian Company,Country,Name of Foreign Collaborator,"RBI
Regional Office",Item of Manufacture,Amount of FDI Inflows,,
1,BYGGING INDIA LTD,Spain,GLOBAL DOMINION ACCAESS S.A.,REGION NOT INDICATED,Other specialized construction activities,25.91,0.37,
2,Triveni Aeronautics Private Limited,Canada,Magellan Aerospace Limited,REGION NOT INDICATED,"Manufacture of parts and accessories of the aircraft and spacecraft of this class (major assemblies such as fuselages, wings, doors, control surfaces, landing gear, fuel tanks, nacelles, airscrews, he",8.25,0.12,
3,Paryapt Solar Energy Private Limited,HongKong,UPC Solar Asia Pacific Limited,REGION NOT INDICATED,Electric power generation using solar energy,0.1,0,
4,Bhagwat Metallics Limited,Mauritius,Essar Ports and Shipping Limited,REGION NOT INDICATED,Wholesale of metals and metal ores,21.3,0.31,
5,Geokul India Private Limited,Malta,Geokul Limited,REGION NOT INDICATED,Providing software support and maintenance to the clients,0.05,0,
6,KAMA AYURVEDA PRIVATE LIMITED,Switzerland,PUIG INTERNATIONAL SA,REGION NOT INDICATED,"Manufacture of cosmetics and toileteries (includes manufacture of pre-shave, shaving or after shave preparations; personal deodorants and anti-respirants; perfumed bath bath
salts and other bath prepa","1,233.16",17.75,
7,DEXTRA CREATIVE SERVICES PRIVATE LIMITED,U.S.A,Dextra Arts Inc.,REGION NOT INDICATED,Other creative arts and entertainment activities,0.1,0,
8,Bhagwat Metallics Limited,Mauritius,Essar Ports and Shipping Limited,"REGION NOT
INDICATED",Wholesale of metals and metal ores,21.83,0.31,
9,THINKSYS SOFTWARE PRIVATE LIMITED,U.S.A,Thinksys INC,REGION NOT INDICATED,Providing software support and maintenance to the clients,19.57,0.28,
10,Tavisca Solutions Private Limited,U.S.A,Affinion Group Inc,"REGION
NOT INDICATED","Other data processing, hosting and related activities n.e.c.",40.59,0.58,
11,CHUANGJIA MECHANICAL AND ELECTRICAL INDI,HongKong,Bright Master Industrial Limited,REGION NOT INDICATED,"Manufacture of other general purpose machinery n.e.c. (fans intended for industrial applications,exhaust hoods for commercial, laboratory or industrial use; calendering or other rolling machines othe",0,0,
12,Defrag Software Labs Private Limited,U.S.A,Ravi Rangasami,"REGION
NOT INDICATED",Providing software support and maintenance to the clients,0.21,0,
13,Triveni Aeronautics Private Limited,Canada,Magellan Aerospace Limited,REGION NOT INDICATED,"Manufacture of parts and accessories of the aircraft and spacecraft of this class (major assemblies such as fuselages, wings, doors, control
surfaces, landing gear, fuel tanks,",69.06,0.99,
Sl. No,Name of Indian Company,Country,Name of Foreign Collaborator,"RBI
Regional Office",Item of Manufacture,Amount of FDI Inflows,,
,,,,,,(In Rs million),(In US$ million),
,,,,,"nacelles, airscrews, he",,,
14,SIRCA PAINTS INDIA LIMITED,Italy,GURJIT SINGH BAINS,REGION NOT INDICATED,"Wholesale of paints, varnishes, and lacquers",0.5,0.01,
15,"RACANAA INNOVATIVE SOLUTIONS ENERGY
PRIV",United Kingdom,Racanna Holdings Ltd,"REGION NOT
INDICATED",Electric power generation using solar energy,0.05,0,
16,NUMPY TECHNOLOGIES PRIVATE LIMITED,Canada,CLIK TECHNOLOGIES INC.,REGION NOT INDICATED,"Writing, modifying, testing of computer program to meet the needs of a particular client excluding web-page designing",0.06,0,
17,Smart Chip Private Limited,Germany,Idemia Germany GmbH,"REGION NOT
INDICATED",Manufacture of other electronic components n.e.c,142.22,2.05,
18,RDA LABS INDIA PRIVATE LIMITED,U.S.A,RDA labs LLC,REGION NOT INDICATED,Computer consultancy and computer facilities management activities,0.1,0,
19,Triveni Aeronautics Private Limited,Canada,Magellan Aerospace Limited,REGION NOT INDICATED,"Manufacture of parts and accessories of the aircraft and spacecraft of this class (major assemblies such as fuselages, wings, doors, control surfaces, landing gear, fuel tanks,
nacelles, airscrews, he",4.13,0.06,
20,Triveni Aeronautics Private Limited,Canada,Magellan Aerospace Limited,REGION NOT INDICATED,"Manufacture of parts and accessories of the aircraft and spacecraft of this class (major assemblies such as fuselages, wings, doors, control surfaces, landing gear, fuel tanks, nacelles, airscrews, he",4.13,0.06,
21,"K & L ARMS COMMUNICATION
PRIVATE LIMITED",Singapore,K&L Creative Asia Pte. Ltd,"REGION NOT
INDICATED",Advertising,4,0.06,
22,SBE RENEWABLES SIXTEEN PRIVATE LIMITED,United Kingdom,SBE Sixteen Limited,REGION NOT INDICATED,Electric power generation using solar energy,0,0,
23,BYGGING INDIA LTD,Spain,GLOBAL DOMINION ACCESS S.A.,REGION NOT INDICATED,Other specialized construction activities,0.72,0.01,
24,KAALBI TECHNOLOGIES PRIVATE LIMITED,Israel,RADWARE LTD,"REGION
NOT INDICATED",Providing software support and maintenance to the clients,149.85,2.16,
25,LYEARN SOFTWARE DEVELOPMENT INDIA PRIVAT,U.S.A,LYEARN INC,REGION NOT INDICATED,Other information technology and computer service activities n.e.c,0.2,0,
26,NOWIGENCE INDIA PRIVATE LIMITED,U.S.A,NOWIGENCE INC,"REGION
NOT INDICATED",Other information technology and computer service activities n.e.c,0.68,0.01,
27,ACCIOJOB PRIVATE LIMITED,U.S.A,Acciojob Inc.,REGION NOT INDICATED,Human resources provision and management of human resources functions,0.11,0,
28,"CAPNET TECHNOLOGIES
PRIVATE LIMITED",U.S.A,The CapitalNet Inc.,"REGION NOT
INDICATED",Providing software support and maintenance to the clients,0.04,0,
29,BYGGING INDIA LTD,Spain,GLOBAL DOMINION ACCESS S.A.,REGION NOT,Other specialized construction activities,0.72,0.01,
Sl. No,Name of Indian Company,Country,Name of Foreign Collaborator,"RBI
Regional Office",Item of Manufacture,Amount of FDI Inflows,,
,,,,,,(In Rs million),(In US$ million),
,,,,INDICATED,,,,
30,GEM ORION MACHINERY PRIVATE LIMITED,Japan,ORION MACHINERY COMPANY LIMITED,REGION NOT INDICATED,"Manufacture of refrigerating or freezing equipment for industrial use, including assemblies of major components",11.59,0.17,
31,KAALBI TECHNOLOGIES PRIVATE LIMITED,Israel,RADWARE LTD,"REGION
NOT INDICATED",Providing software support and maintenance to the clients,112.89,1.62,
32,Sorting Hat Technologies Private Limited,Mauritius,SCI Investments V,REGION NOT INDICATED,"Writing, modifying, testing of computer program to meet the needs of a particular client excluding web-page designing",1.78,0.03,
33,KAALBI TECHNOLOGIES PRIVATE LIMITED,Israel,RADWARE LTD,"REGION
NOT INDICATED",Providing software support and maintenance to the clients,47.35,0.68,
34,KAALBI TECHNOLOGIES PRIVATE LIMITED,Israel,RADWARE LTD,REGION NOT INDICATED,Providing software support and maintenance to the clients,37.45,0.54,
35,KAALBI TECHNOLOGIES PRIVATE LIMITED,Israel,RADWARE LTD,REGION NOT INDICATED,Providing software support and maintenance to the clients,27.84,0.4,
36,Tavisca Solutions Private Limited,U.S.A,Affinion Group Inc,REGION NOT INDICATED,"Other data processing, hosting and related activities n.e.c.",40.59,0.58,
37,THINKSYS SOFTWARE PRIVATE LIMITED,U.S.A,Thinksys INC,"REGION NOT
INDICATED",Providing software support and maintenance to the clients,6.58,0.09,
38,ETG AGRO PRIVATE LIMITED,Mauritius,ETG Pulses Bharat Limited,REGION NOT INDICATED,Wholesale of cereals and pulses,1.61,0.02,
39,MOTIVATING GRAPHICS INDIA PRIVATE LIMITE,U.S.A,TIMOTHY G CLARK,REGION NOT INDICATED,"Manufacture of plastic articles for the packing of goods (plastic bags, sacks, containers, boxes, cases, carboys, bottles etc.)",0,0,
40,"HAPPY MARKETER DIGITAL PRIVATE
LIMITED",Singapore,Dentsu Aegis Network Singapore Holdings,"REGION NOT
INDICATED",Other information technology and computer service activities n.e.c,0,0,
41,ETG AGRO PRIVATE LIMITED,Mauritius,ETG Pulses Bharat Limited,REGION NOT INDICATED,Wholesale of cereals and pulses,1.81,0.03,
42,ITGPRO SUPPORT SERVICES INDIA PRIVATE LI,United Kingdom,AGRIPROTEIN HOLDINGS UK LIMITED,REGION NOT INDICATED,Architectural and engineering activities and related technical consultancy,0,0,
43,ASCENT MEDITECH LIMITED,Mauritius,NAIVASHA INVESTMENT HOLDINGS LTD.,REGION NOT INDICATED,"Manufacture of medical impregnated wadding, gauze, bandages, dressings, surgical gut string etc.",932.87,13.43,
44,K & L ARMS COMMUNICATION PRIVATE LIMITED,Singapore,K&L Creative Asia Pte. Ltd.,REGION NOT INDICATED,Advertising,6,0.09,
45,Indeus Life Sciences Private Limited,Netherlands,Nordic Group BV,REGION NOT INDICATED,"Manufacture of medicinal substances used in the manufacture of pharmaceuticals: antibiotics,endocrine products, basic vitamins; opium derivatives; sulpha drugs; serums and
plasmas; salicylic acid, its",0.05,0,
Sl. No,Name of Indian Company,Country,Name of Foreign Collaborator,"RBI
Regional Office",Item of Manufacture,Amount of FDI Inflows,,
,,,,,,(In Rs million),(In US$ million),
46,Fulcrum Commercial Real Estate Services,U.S.A,FULCRUM COMMERCIAL REAL ESTATE SERVICES,"REGION NOT
INDICATED",Data processing activities including report writing,0.77,0.01,
47,NITTEI ENGINEERING PRIVATE LIMITED,Taiwan,MING HSI WU,REGION NOT INDICATED,Architectural and engineering activities and related technical consultancy,0,0,
48,Sitara Solar Energy Private Limited,HongKong,UPC SOLAR INDIA (HK) LIMITED,"REGION NOT
INDICATED",Electric power generation using solar energy,0.1,0,
49,SADHAN ENTERPRISE I PRIVATE LIMITED,Singapore,Rohaan Kapoor,REGION NOT INDICATED,Management consultancy activities,3.5,0.05,
50,Sheorey Digital Systems Private Limited,Singapore,Laminaar Aviation Infotech Pte Ltd,"REGION
NOT INDICATED",Providing software support and maintenance to the clients,200.62,2.89,
51,ASSETSOFT CONSULTING PRIVATE LIMITED,Canada,2498629 ONTARIO INC OPG AS ASSETSOFT,REGION NOT INDICATED,Computer consultancy and computer facilities management activities,0.03,0,
52,Geokul India Private Limited,Malta,Geokul Limited,REGION NOT INDICATED,Providing software support and maintenance to the clients,0.05,0,
53,BOP CONSULTANTS PRIVATE LIMITED,U.S.A,BEACON SYSTEMS GLOBAL LLC,REGION NOT INDICATED,Human resources provision and management of human resources functions,3.48,0.05,
54,"DISPATCH GLOBAL SERVICES INDIA
PRIVATE L",U.S.A,DISPATCH GLOBAL SERVICES INC,"REGION NOT
INDICATED",Other land transport services n.e.c,0.1,0,
55,ENEL VIENTO INDIA PRIVATE LIMITED,Spain,ENEL VIENTO SL,REGION NOT INDICATED,Treatment and disposal of non- hazardous waste,0.05,0,
56,YSI TECH PRIVATE LIMITED,China,SHENGLI ZHOU,REGION NOT INDICATED,"Manufacture of gelatine and its derivatives, resinoids, glues, prepared adhesives, including rubber-based glues and adhesives",0.05,0,
57,"RENTLY SOFTWARE DEVELOPMENT
PRIVATE LIMI",U.S.A,Consumer 2.0 Inc,"REGION NOT
INDICATED",Other information technology and computer service activities n.e.c,0.05,0,
58,Cybersol Technologies Private Limited,Singapore,Knowledge Insight Services Pte. Ltd.,REGION NOT INDICATED,Providing software support and maintenance to the clients,0.58,0.01,
59,Odis Water Purification India Private Li,Israel,TSVI TSUR,REGION NOT INDICATED,Management consultancy activities,0.07,0,
60,WESTERN REFRIGERATION PRIVATE LIMITED,Japan,Hoshizaki Corporation,REGION NOT INDICATED,"Manufacture of refrigerating or freezing equipment for industrial use, including assemblies of major components",92.61,1.33,
61,"FAASOS FOOD
SERVICES PRIVATE LIMITED",Mauritius,SCI Investments VI,"REGION
NOT INDICATED","Cafeterias, fast-food restaurants and other food preparation in market stalls",13.12,0.19,
62,ABSYZ SOFTWARE CONSULTING PRIVATE LIMITE,U.S.A,Youngsoft Inc,REGION NOT INDICATED,Computer consultancy and computer facilities management activities,35.25,0.51,
63,SBE RENEWABLES SEVENTEEN PRIVATE,United Kingdom,SBE Seventeen A Limited,REGION NOT,Electric power generation using solar energy,0,0,
Sl. No,Name of Indian Company,Country,Name of Foreign Collaborator,"RBI
Regional Office",Item of Manufacture,Amount of FDI Inflows,,
,,,,,,(In Rs million),(In US$ million),
,LIMITED,,,INDICATED,,,,
64,ANI Technologies Private Limited,Singapore,Lazarus Holdings Pte Ltd,REGION NOT INDICATED,Other information technology and computer service activities n.e.c,150,2.16,
65,"E-CLOUD AEON SOFTWARE
TECHNOLOGY PRIVATE",United Kingdom,SHEETAL AMOL MALPANI,"REGION NOT
INDICATED",Providing software support and maintenance to the clients,0.05,0,
66,GEM ORION MACHINERY PRIVATE LIMITED,Japan,ORION MACHINERY COMPANY LIMITED,REGION NOT INDICATED,"Manufacture of refrigerating or freezing equipment for industrial use, including assemblies of major components",11.59,0.17,
67,"SBE RENEWABLES SIXTEEN PRIVATE
LIMITED",United Kingdom,SBE Sixteen A Limited,"REGION NOT
INDICATED",Electric power generation using solar energy,0,0,
68,NUMPY TECHNOLOGIES PRIVATE LIMITED,Canada,CLIK TECHNOLOGIES INC.,REGION NOT INDICATED,"Writing, modifying, testing of computer program to meet the needs of a particular client excluding web-page designing",0.05,0,
69,Royal Sundaram General Insurance Co. Lim,Belgium,AGEAS INSURANCE INTERNATIONAL N V,REGION NOT INDICATED,Non-life insurance,"2,585.77",37.22,
70,Triveni Aeronautics Private Limited,Canada,Magellan Aerospace Limited,REGION NOT INDICATED,"Manufacture of parts and accessories of the aircraft and spacecraft of this class (major assemblies such as fuselages, wings, doors, control surfaces, landing gear, fuel tanks, nacelles, airscrews, he",3.3,0.05,
71,HALLI LABS PRIVATE LIMITED,U.S.A,PM LABS INC,REGION NOT INDICATED,Other information technology and computer service activities n.e.c,0.01,0,
72,911 INDIA HEALTHCARE PRIVATE LIMITED,U.S.A,"ROUNDGLASS, LLC",REGION NOT INDICATED,Telephone based information services,22.46,0.32,
73,Loramendi India Private Limited,Spain,Loramendi S. Coop,REGION NOT INDICATED,"Other professional, scientific and technical activities n.e.c.",1.6,0.02,
74,"VENERA TECHNOLOGIES
PRIVATE LIMITED",U.S.A,Taazaa LLC,"REGION NOT
INDICATED",Other information technology and computer service activities n.e.c,5.65,0.08,
75,VROUWEN MACHT PRIVATE LIMITED,Netherlands,MEINDERT WITVLIET,REGION NOT INDICATED,Manufacture of other textiles/textile products n.e.c.,0.01,0,
76,"CEDAR INDIA
CONSULTING PRIVATE LIMITED",United Kingdom,VERSION 1 SOFTWARE UK LIMITED,"REGION
NOT INDICATED",Other information technology and computer service activities n.e.c,4.62,0.07,
77,CANARA STANDARD KEYS PRIVATE LIMITED,Germany,Nosta GmbH,REGION NOT INDICATED,"Manufacture of other general purpose machinery n.e.c. (fans intended for industrial applications,exhaust hoods for commercial, laboratory or industrial use; calendering or other rolling machines othe",3.4,0.05,
78,DANLAW ELECTRONICS ASSEMBLY LIMITED,U.S.A,Danlaw Inc.,REGION NOT INDICATED,"Manufacture of bare printed circuit boards, loading of components onto printed circuit boards; manufacture of
interface cards (e.g. sound, video,",55.5,0.8,
Sl. No,Name of Indian Company,Country,Name of Foreign Collaborator,"RBI
Regional Office",Item of Manufacture,Amount of FDI Inflows,,
,,,,,,(In Rs million),(In US$ million),
,,,,,"controllers, network, modems)",,,
79,AMIDC AUTOMATION TECHNOLOGIES PRIVATE LI,U.S.A,ATI MOTORS INC,REGION NOT INDICATED,"Manufacture of commercial vehicles such as vans, lorries, over-the-road tractors for semi-trailers etc.",0.01,0,
80,PHI INDIA Private Limited,U.S.A,Public Health Institute,"REGION NOT
INDICATED",Management consultancy activities,0.01,0,
81,BYGGING INDIA LTD,Spain,GLOBAL DOMINION ACCESS S.A.,REGION NOT INDICATED,Other specialized construction activities,15.21,0.22,
82,"ITGPRO SUPPORT
SERVICES INDIA PRIVATE LI",United Kingdom,AgriProtein Holdings UK Limited,"REGION
NOT INDICATED",Architectural and engineering activities and related technical consultancy,0.05,0,
83,ABSYZ SOFTWARE CONSULTING PRIVATE LIMITE,U.S.A,Youngsoft Inc,REGION NOT INDICATED,Computer consultancy and computer facilities management activities,35.25,0.51,
84,John Distilleries Private Limited,U.S.A,SAZERAC INVESTMENT HOLDINGS INC,"REGION
NOT INDICATED","Manufacture of distilled, potable,
alcoholic beverages such as whisky, brandy, gin, mixed drinks etc.",367.49,5.29,
85,KAALBI TECHNOLOGIES PRIVATE LIMITED,Israel,RADWARE LTD,REGION NOT INDICATED,Providing software support and maintenance to the clients,13.96,0.2,
86,KAALBI TECHNOLOGIES PRIVATE LIMITED,Israel,RADWARE LTD,"REGION NOT
INDICATED",Providing software support and maintenance to the clients,12.18,0.18,
87,KAALBI TECHNOLOGIES PRIVATE LIMITED,Israel,RADWARE LTD,REGION NOT INDICATED,Providing software support and maintenance to the clients,9.88,0.14,
88,KAALBI TECHNOLOGIES PRIVATE LIMITED,Israel,RADWARE LTD,REGION NOT INDICATED,Providing software support and maintenance to the clients,9.88,0.14,
89,KSH Infra Private Limited,Singapore,G9 Asia I Pte Ltd,REGION NOT INDICATED,Other civil engineering projects n.e.c.,104.59,1.51,
90,KAALBI TECHNOLOGIES PRIVATE LIMITED,Israel,RADWARE LTD,REGION NOT INDICATED,Providing software support and maintenance to the clients,9.88,0.14,
91,Birlasoft Limited,U.S.A,Abhimanyu Dalal,REGION NOT INDICATED,"Writing, modifying, testing of computer program to meet the needs of a particular client excluding web-page
designing",0.83,0.01,
92,Snitch Properties And Services Private L,Cayman Islands,BREP Asia SBS Indian L and T Holding II,REGION NOT INDICATED,Real estate activities with own or leased property,0,0,
93,Think & Learn Private Limited,Singapore,General Atlantic Singapore TL Pte. Ltd,REGION NOT INDICATED,"General school education in the second stage of the secondary level (Senior/Higher secondary) giving, in
principle, access to higher education",2.13,0.03,
94,Snitch Properties And Services Private L,Cayman Islands,BREP VIII SBS Indian L and T Holding II,REGION NOT INDICATED,Real estate activities with own or leased property,0,0,
95,HIBROW HEALTHCARE PRIVATE LIMITED,U.S.A,PATRICK BENSON,"REGION
NOT INDICATED",Manufacture of allopathic pharmaceutical preparations,0.01,0,
Sl. No,Name of Indian Company,Country,Name of Foreign Collaborator,"RBI
Regional Office",Item of Manufacture,Amount of FDI Inflows,,
,,,,,,(In Rs million),(In US$ million),
96,Tavisca Solutions Private Limited,U.S.A,Affinion Group Inc.,"REGION NOT
INDICATED","Other data processing, hosting and related activities n.e.c.",40.59,0.58,
97,URBANCLAP TECHNOLOGIES INDIA PRIVATE LIM,Mauritius,Steadview Capital Mauritius Limited,REGION NOT INDICATED,Other business support service activities n.e.c,40.03,0.58,
98,GOISU REALTY PRIVATE LIMITED,Japan,SUMITOMO REALTY AND DEVELOPMENT CO LTD,"REGION NOT
INDICATED",Real estate activities with own or leased property,0,0,
99,GEM ORION MACHINERY PRIVATE LIMITED,Japan,ORION MACHINERY COMPANY LIMITED,REGION NOT INDICATED,"Manufacture of refrigerating or freezing equipment for industrial use, including assemblies of major components",11.59,0.17,
100,Sisecam Flat Glass India Limited,Turkey,TRAKYA CAM SANAYII A.S.,REGION NOT INDICATED,"Manufacture of glass in primary or semi-manufactured forms (such as sheets and plate glass) including mirror sheets and wired, coloured, tinted,
toughened or laminated glass",24.16,0.35,
101,Letspie Entertainment Private Limited,China,Oxy Technology Limited,REGION NOT INDICATED,"Operation of other websites that act as portals to the Internet, such as media sites providing periodically updated content",0.1,0,
102,Irification Technology Private Limited,China,Beijing Irisking Co. Ltd.,"REGION NOT
INDICATED",Computer consultancy and computer facilities management activities,0.1,0,
103,BOSON MOTORS PRIVATE LIMITED,U.S.A,BOSON MOTORS INC,REGION NOT INDICATED,Manufacture of electric motors (except internal combustion engine starting motors),0.9,0.01,
104,VP Tax PRIVATE LIMITED,U.S.A,Global Upside LLC,REGION NOT INDICATED,"Accounting, bookkeeping and auditing activities",0.1,0,
105,KAMA AYURVEDA PRIVATE LIMITED,Switzerland,PUIG INTERNATIONAL SA,REGION NOT INDICATED,"Manufacture of cosmetics and toileteries (includes manufacture of pre-shave, shaving or after shave preparations; personal deodorants and anti-respirants; perfumed bath bath
salts and other bath prepa",408,5.87,
106,RUPEEK FINTECH PRIVATE LIMITED,Mauritius,SCI INVESTMENTS V,REGION NOT INDICATED,Other information technology and computer service activities n.e.c,1.3,0.02,
107,CROWDANALYTIX SOLUTIONS PRIVATE LIMITED,Japan,MACNICA INC,REGION NOT INDICATED,"Writing, modifying, testing of computer program to meet the needs of a particular client excluding web-page
designing",207.3,2.98,
108,BYGGING INDIA LTD,Spain,GLOBAL DOMINION ACCESS S.A.,REGION NOT INDICATED,Other specialized construction activities,102.13,1.47,
109,MOTIVATING GRAPHICS INDIA PRIVATE LIMITE,U.S.A,CHRISTOPHER CLARK,REGION NOT INDICATED,"Manufacture of plastic articles for the packing of goods (plastic bags, sacks, containers, boxes, cases, carboys,
bottles etc.)",0,0,
110,Essar Steel Metal Trading Limited,Mauritius,Essar Ports and Shippling Limited,REGION NOT INDICATED,Wholesale of metals and metal ores,856.78,12.33,
111,Triveni Aeronautics,Canada,Magellan Aerospace,REGION,Manufacture of parts and accessories,8.25,0.12,
Sl. No,Name of Indian Company,Country,Name of Foreign Collaborator,"RBI
Regional Office",Item of Manufacture,Amount of FDI Inflows,,
,,,,,,(In Rs million),(In US$ million),
,Private Limited,,Limited,NOT INDICATED,"of the aircraft and spacecraft of this class (major assemblies such as fuselages, wings, doors, control surfaces, landing gear, fuel tanks,
nacelles, airscrews, he",,,
112,ZEVA CAPSOL PRIVATE LIMITED,HongKong,SMART DRAGONS (ASIA PACIFIC) LIMITE,REGION NOT INDICATED,Activities auxiliary to financial service activities n.e.c.,3.83,0.06,
113,SKECHERS RETAIL INDIA PRIVATE LIMITED,U.S.A,Skechers S.a.r.l.,"REGION NOT
INDICATED",Retail sale of footwear,440.01,6.33,
114,SKECHERS SOUTH ASIA PRIVATE LIMITED,Netherlands,Skechers USA Benelux B.V.,REGION NOT INDICATED,Wholesale of footwear,"5,415.01",77.94,
115,BYGGING INDIA LTD,Spain,GLOBAL DOMINION ACCESS S.A.,"REGION
NOT INDICATED",Other specialized construction activities,27.12,0.39,
116,BURGEON SOFTWARE PRIVATE LIMITED,U.S.A,CATENA GLOBAL SOLUTIONS LLC,REGION NOT INDICATED,Web-page designing,4.36,0.06,
117,Perfios Software Solutions Private Limit,Mauritius,Bessemer India Capital Holdings II Ltd,"REGION NOT
INDICATED",Providing software support and maintenance to the clients,2.55,0.04,
118,VENERA TECHNOLOGIES PRIVATE LIMITED,U.S.A,Taazaa LLC,REGION NOT INDICATED,Other information technology and computer service activities n.e.c,0.57,0.01,
119,Bhagwat Metallics Limited,Mauritius,Essar Ports and Shipping Limited,"REGION NOT
INDICATED",Wholesale of metals and metal ores,270.18,3.89,
120,Triveni Aeronautics Private Limited,Canada,Magellan Aerospace Limited,REGION NOT INDICATED,"Manufacture of parts and accessories of the aircraft and spacecraft of this class (major assemblies such as fuselages, wings, doors, control surfaces, landing gear, fuel tanks, nacelles, airscrews, he",8.25,0.12,
121,ANI Technologies Private Limited,Singapore,Lazarus Holdings Pte Ltd,REGION NOT INDICATED,Other information technology and computer service activities n.e.c,150,2.16,
122,KAALBI TECHNOLOGIES PRIVATE LIMITED,Israel,RADWARE LTD,"REGION
NOT INDICATED",Providing software support and maintenance to the clients,1.32,0.02,
123,Triveni Aeronautics Private Limited,Canada,Magellan Aerospace Private Limited,REGION NOT INDICATED,"Manufacture of parts and accessories of the aircraft and spacecraft of this class (major assemblies such as fuselages, wings, doors, control surfaces, landing gear, fuel tanks, nacelles, airscrews, he",8.25,0.12,
124,Triveni Aeronautics Private Limited,Canada,Magellan Aerospace Limited,REGION NOT INDICATED,"Manufacture of parts and accessories of the aircraft and spacecraft of this class (major assemblies such as fuselages, wings, doors, control surfaces, landing gear, fuel tanks,
nacelles, airscrews, he",8.25,0.12,
125,CarbonNV Infologic India Private Limited,United Kingdom,Castleton Software Solutions Limited,"REGION NOT
INDICATED",Other information technology and computer service activities n.e.c,0,0,
Sl. No,Name of Indian Company,Country,Name of Foreign Collaborator,"RBI
Regional Office",Item of Manufacture,Amount of FDI Inflows,,
,,,,,,(In Rs million),(In US$ million),
126,"ORAVAN INDUSTRIAL LOGISTICS AND
WAREHOUS",Singapore,ESR India Logistics Fund Pte Ltd,"REGION NOT
INDICATED",Construction of utility projects n.e.c.,0,0,
127,Bhagwat Metallics Limited,Mauritius,Essar Ports and Shipping Limited,REGION NOT INDICATED,Wholesale of metals and metal ores,96.17,1.38,
128,KAMA AYURVEDA PRIVATE LIMITED,Switzerland,PUIG INTERNATIONAL SA,REGION NOT INDICATED,"Manufacture of cosmetics and toileteries (includes manufacture of pre-shave, shaving or after shave preparations; personal deodorants and anti-respirants; perfumed bath bath
salts and other bath prepa",298.52,4.3,
129,BYGGING INDIA LTD,Spain,GLOBAL DOMINION ACCESS S.A.,REGION NOT INDICATED,Other specialized construction activities,37.24,0.54,
130,"Royal Sundaram General Insurance Co.
Lim",Belgium,"Ageas Insurance International N.V., Neth","REGION NOT
INDICATED",Non-life insurance,"9,841.71",141.65,
131,Evato Technology Private Limited,Mauritius,VH Capital XI,REGION NOT INDICATED,"Writing, modifying, testing of computer program to meet the needs of a particular client excluding web-page designing",1,0.01,
132,"MVALU TECHNOLOGY SERVICES PRIVATE
LIMITE",Singapore,Finexpressway Pte. Ltd.,"REGION NOT
INDICATED",Other information technology and computer service activities n.e.c,0.05,0,
133,NOWFLOATS TECHNOLOGIES PRIVATE LIMITED,Mauritius,Iron Pillar Fund I Ltd,REGION NOT INDICATED,Web-page designing,146.16,2.1,
