Table No.19 (a),,,,,,,,
"STATEMENT ON REMITTANCE-WISE DETAILS OF FDI EQUITY INFLOWS RECEIVED UNDER FIPB/SIA (OTHER THAN ACQUISITION OF EXISTING SHARES) ROUTE DURING JULY 2018 TO SEPTEMBER, 2018",,,,,,,,
Sl. No,Name of Indian Company,Country,Name of Foreign Collaborator,"RBI
Regional Office",Item of Manufacture,Amount of FDI Inflows,,
,,,,,,(In Rs million),(In US$ million),
1,LE CREUSET INDIA TRADING P LTD,France,LE CREUSET SAS,MUMBAI,"Retail sale of household utensils and cutlery, crockery, glassware, china and pottery",25.08,0.37,
2,M/S DELSEY INDIA PVT. LTD,France,DELSEY S.A,NEW DELHI,Retail sale of leather goods and travel accessories of leather and leather substitutes,34.17,0.50,
3,HUBERT BURDA MEDIA INDIA PVT LTD,Germany,BURDA GESELLASHAFT MIT BESCHRAENKTER HAU,NEW DELHI,Publishing of journals and periodicals,23.44,0.34,
4,SAET INDIA PVT LTD,Italy,SAET APA,MUMBAI,Manufacture of other electrical equipment,4.40,0.06,
5,DIESEL FASHION INDIA RELIANCE PVT. LTD.,Italy,DIESEL S.P.A,MUMBAI,"Retail sale of readymade garments, hosiery goods, other articles of clothing and clothing accessories",15.30,0.21,
6,DIESEL FASHION INDIA RELIANCE PVT. LTD.,Italy,DIESEL S.P.A,MUMBAI,"Retail sale of readymade garments, hosiery goods, other articles of clothing and clothing accessories",51.00,0.71,
7,RYOHIN-KEIKAKU RELIANCE INDIA PVT LTD,Japan,RYOHIN KEIKAKU CO LTD,MUMBAI,"Retail sale of readymade garments, hosiery goods, other articles of clothing and clothing accessories",34.68,0.50,
8,SAVINO DEL BENE FREIGHT FORWARDERS (INDI,Luxembourg,SDB FINANZIARIA S.A.,MUMBAI,Cargo handling incidental to water transport,4.65,0.07,
9,SAVINO DEL BENE FREIGHT FORWARDERS (INDI,Luxembourg,SDB FINANZIARIA S A,MUMBAI,Cargo handling incidental to water transport,13.24,0.19,
10,"AMAZON RETAIL INDIA PRIVATE
LIMITED",Mauritius,AMAZON.COM.INCS LIMITED,NEW DELHI,"Retail sale of cereals and pulses, tea, coffee, spices and
flour",10.00,0.14,
11,UNIQUEST INFRA VENTURES PVT,Mauritius,GHIR INVESTMENTS (MAURITIUS) LTD,NEW DELHI,"Construction and maintenance of motorways, streets, roads, other vehicular and pedestrian ways, highways,",21.64,0.32,
12,BENGAL PORT PRIVATE LIMITED,Mauritius,P&O PORTS ( KULPI ) PRIVATE LIMITED,KOLKATA,Service activities incidental to water transportation,30.00,0.44,
13,HINDUSTAN INFRALOG PVT LTD,Netherlands,DP WORLD GLOBAL INVESTMENT BV,MUMBAI,Activities of holding companies,"12,650.95",175.18,
14,AASHIYAAN,Netherlands,OIKOCREDIT,KOLKATA,Activities of specialized,50.01,0.69,
Sl. No,Name of Indian Company,Country,Name of Foreign Collaborator,"RBI
Regional Office",Item of Manufacture,Amount of FDI Inflows,,
,,,,,,(In Rs million),(In US$ million),
,HOUSING & DEVELOPMENT FINANCE,,ECUMENICAL DEVELOPMENT CO-OPE,,institutions granting credit for house purchases that also take deposits,,,
15,RELIANCE VISION EXPRESS PVT LTD,Netherlands,GRANDVISION INDIA B.V,MUMBAI,"Retail sale of photographic, optical and precision equipment",25.00,0.36,
16,INDUHAIBAA PRIVATE LIMITED,Saudi Arabia,IBRAHIM HAMAD SALEH ALHAMOUDI,JAIPUR,"Manufacture of metal sanitaryware such as baths,
sinks, washbasins and similar articles",3.84,0.05,
17,INDUHAIBAA PRIVATE LIMITED,Saudi Arabia,IBRAHIM HAMAD SALEH ALHAMOUDI,JAIPUR,"Manufacture of metal sanitaryware such as baths, sinks, washbasins and similar
articles",2.55,0.04,
18,AMAZON RETAIL INDIA PRIVATE LIMITED,Singapore,AMAZON CORPORATE HOLDINGS PRIVATE LIMITE,NEW DELHI,"Retail sale of cereals and pulses, tea, coffee, spices and flour",990.00,13.71,
19,AASHIYAAN HOUSING & DEVELOPMENT FINANCE,Singapore,INSITOR IMPACT SOUTH ASIA PTE LTD,KOLKATA,Activities of specialized institutions granting credit for house purchases that also take deposits,50.01,0.69,
20,STELIS BIOPHARMA PVT LTD,Singapore,GMS PHARMA (SINGAPORE) PTE LTD,BANGALORE,"Research and experimental
development on natural sciences and engineering",124.52,1.79,
21,BHARTI AIRTEL LTD,Singapore,TELENOR SOUTH ASIA INVESTMENT PTE LTD,NEW DELHI,"Activities of Internet access
by the operator of the wireless infrastructure",0.00,0.00,
22,TRIGUNA HOSPITALITY VENTURES (INDIA) PVT,Singapore,APHV INDIA INVESTCO. PVT LTD,NEW DELHI,Activities of holding companies,44.28,0.64,
23,TRIGUNA HOSPITALITY VENTURES (INDIA) PVT,Singapore,AAPC SINGAPORE PTE LTD,NEW DELHI,Activities of holding companies,39.36,0.57,
24,BEST UNITED INDIA COMFORTS PVT LTD,Singapore,BESTSELLER UNITED SINGAPORE PTE LTD,MUMBAI,"Retail sale of readymade garments, hosiery goods,
other articles of clothing and clothing accessories",541.00,7.78,
25,"SWATCH GROUP (INDIA) RETAIL
PRIVATE LIMI",Switzerland,TECHNOCORP HOLDING S.A,NEW DELHI,Retail sale of watches and clocks,30.00,0.44,
26,SWATCH GROUP (INDIA) RETAIL PRIVATE LIMI,Switzerland,TECHNOCORP HOLDING S.A,NEW DELHI,Retail sale of watches and clocks,20.00,0.29,
27,HAYMARKET MEDIA (INDIA) PVT LTD,United Kingdom,HAYMARKET WORLDWIDE LTD,MUMBAI,Publishing of journals and periodicals,5.00,0.07,
28,AIRIS PHARMA PVT LTD,U.S.A,MOHAN R PATALOLLA,HYDERABAD,Research and experimental development on natural,6.21,0.09,
Sl. No,Name of Indian Company,Country,Name of Foreign Collaborator,"RBI
Regional Office",Item of Manufacture,Amount of FDI Inflows,,
,,,,,,(In Rs million),(In US$ million),
,,,,,sciences and engineering,,,
29,AIRIS PHARMA PVT LTD,U.S.A,KISHORE KUMAR GANJI,HYDERABAD,Research and experimental development on natural sciences and engineering,6.00,0.08,
30,AIRIS PHARMA PVT LTD,U.S.A,MOHAN R PATALOLLA,HYDERABAD,Research and experimental development on natural sciences and engineering,3.33,0.05,
31,PMC YM-PHARMA PVT LTD,U.S.A,DEBTOSH CHAKRABARTI,KOLKATA,"Manufacture of medicinal substances used in the manufacture of pharmaceuticals: antibiotics, endocrine",4.90,0.07,
32,PMC YM-PHARMA PVT LTD,U.S.A,RAJ CHAKRABARTI,KOLKATA,"Manufacture of medicinal substances used in the manufacture of pharmaceuticals: antibiotics, endocrine",4.90,0.07,
33,PMC YM-PHARMA PVT LTD,U.S.A,PMC GROUP INTERNATIONAL INC.,KOLKATA,"Manufacture of medicinal substances used in the manufacture of pharmaceuticals: antibiotics,
endocrine",10.20,0.14,
34,AIRIS PHARMA PVT LTD,U.S.A,KISHORE KUMAR GANJI,HYDERABAD,"Research and experimental
development on natural sciences and engineering",11.00,0.15,
35,ELCA COSMETICS PVT LTD,U.S.A,ESTEE LAUDER INTERNATIONAL INC.,NEW DELHI,"Wholesale of toiletry, perfumery and cosmetics",172.96,2.49,
36,ELCA COSMETICS PVT LTD,U.S.A,ESTEE LAUDER  INC.,NEW DELHI,"Wholesale of toiletry, perfumery and cosmetics",1.74,0.02,
Grand Total,,,,,,"15,065.36",209.29,