1585,FASTFILMZ MEDIA INDIA PRIVATE LIMITED,Singapore,FAST FILMZ SINGAPORE PTE LTD,BANGALORE,"Other information technology and computer service activities
n.e.c",29.79,0.46,
1586,FASTFILMZ MEDIA INDIA PRIVATE LIMITED,Singapore,FAST FILMZ SINGAPORE PTE LTD,BANGALORE,Other information technology and computer service activities n.e.c,18.96,0.29,
1587,FASTFILMZ MEDIA INDIA PRIVATE LIMITED,Singapore,FAST FILMZ SINGAPORE PTE LTD,BANGALORE,"Other information technology
and computer service activities n.e.c",43.64,0.67,
1588,FASTFILMZ MEDIA INDIA PRIVATE LIMITED,Singapore,FAST FILMZ SINGAPORE PTE LTD,BANGALORE,Other information technology and computer service activities n.e.c,6.56,0.10,
1589,AEQUM INDIA PRIVATE LIMITED,Singapore,AEQUM PTE LTD,BANGALORE,Market research and public opinion polling,0.10,0.00,
1590,HEALTHVISTA INDIA PRIVATE LIMITED,Singapore,QUALCOMM ASIA PACIFIC PTE LTD,BANGALORE,Other residential care activities n.e.c.,90.92,1.40,
1591,SIRMOURI PARTNERS PVT LTD,Singapore,SIMOURI PARTNERS PTE LTD,NEW DELHI,Advertising,1.51,0.02,
1592,LAKSHYA ENERGSTORAGE SYSTEMS PVT LTD,Singapore,LIVGUARD HOLDINGS PTE LTD,NEW DELHI,"Other professional, scientific and technical activities n.e.c.",25.64,0.39,
1593,ELEANOR REALTY HOLDINGS INDIA PRIVATE LI,Singapore,TECH PARK HOLDINGS PTE LTD,NEW DELHI,Real estate activities with own or leased property,179.00,2.75,
1594,SV CREDITLINE PVT LTD,Singapore,VANS PTE LTD,NEW DELHI,Other credit granting,50.00,0.77,
1595,PARIDYAM HEALTHCARE PRIVATE LIMITED,Singapore,GAP INVESTMENTS PTE LTD,NEW DELHI,"Other human health activities
n.e.c. (including independent ambulance activities)",6.46,0.10,
1596,CREDO MINERAL INDUSTRIES LIMITED,Singapore,Chem Asia Technologies Pte ltd,AHMEDABAD,Manufacture of basic chemical elements,60.32,0.93,
1597,MOGLI LABS (INDIA) PRIVATE LIMITED,Singapore,MOGLI LABS PVT LTD,NEW DELHI,Activities of other commission agents n.e.c. (including commission agents working in emerging areas for,96.12,1.48,
1598,FARM SPRINGS SERVICES CENTER (INDIA) PRI,Singapore,"UNITED TECHNOLOGIES
INTERNATIONAL CORPOR",BANGALORE,"Other information technology
and computer service activities n.e.c",201.00,3.09,
Sl. No,Name of Indian Company,Country,Name of Foreign Collaborator,RBI Regional Office,Item of Manufacture,Amount of FDI Inflows,,
,,,,,,"(In Rs million
)",(In US$ millio n),
1599,ORB ENERGY PVT. LTD.,Singapore,ORB ENERGY PTE LIMITED,BANGALORE,Manufacture of other articles n.e.c.,3.21,0.05,
1600,CARBON MASTERS INDIA PVT LTD.,Singapore,JAYESH ARVIND PAREKH,BANGALORE,Manufacture of gas,0.46,0.01,
1601,ROID TECHNOLOGIES PRIVATE LIMITED,Singapore,MAHINDRA KUMAR CHUGANI,BANGALORE,"Other information technology
and computer service activities n.e.c",1.66,0.03,
1602,SHOOGLOO MEDIA PVT LTD,Singapore,SHOOGLOO MEDIA PTE LTD,NEW DELHI,Advertising,0.81,0.01,
1603,ENLIVE SOLUTIONS INDIA PVT LTD,Singapore,ENLIVE GLOBAL SOLUTIONS PTE LTD,NEW DELHI,Providing software support and maintenance to the clients,5.63,0.09,
1604,IBIBO GROUP PRIVATE LIMITED,Singapore,IBIBO GROUP HOLDINGS (SINGAPORE) PTE LTD,NEW DELHI,Travel agency activities,318.98,4.91,
1605,ARM DIGITAL MEDIA PRIVATE LIMITED,Singapore,BHIP SINGAPORE CONSULTING PTE. LTD,NEW DELHI,"Other information technology and computer service activities
n.e.c",33.36,0.51,
1606,DARSHITA SOUTHERN INDIA HAPPY HOMES PRIV,Singapore,APOLLO ASIA RE SINGAPORE I PTE LTD,BANGALORE,Construction of buildings carried out on own-account basis or on a fee or contract basis,20.00,0.31,
1607,DARSHITA SOUTHERN INDIA HAPPY HOMES PRIV,Singapore,APOLLO ASIA RE SINGAPORE I PTE LTD,BANGALORE,"Construction of buildings carried
out on own-account basis or on a fee or contract basis",508.00,7.81,
1608,CHAMPION INFOMETRICS PRIVATE LIMITED,Singapore,CHAMPIONS GROUP PTE LTD,BANGALORE,Other information technology and computer service activities n.e.c,39.60,0.61,
1609,CITYONTHENET MARKETPLACE SERVICES PRIVAT,Singapore,BLUECAP MOBILE PRIVATE LIMITED,BANGALORE,Operation of web sites that use a search engine to generate and maintain extensive databases of internet,5.00,0.08,
1610,PERMASTEELISA (INDIA) PRIVATE LIMITED,Singapore,PERMASTEELISA PACIFIC HOLDINGS LTD,BANGALORE,Architectural and engineering activities and related technical consultancy,809.00,12.44,
1611,FLIPKART INDIA PRIVATE LIMITED,Singapore,FLIPKART LIMITED,BANGALORE,"Wholesale of textiles, fabrics, yarn, household linen, articles of clothing, floor coverings and tapestry,","44,724.
76","687.8
5",
1612,ENLIVE SOLUTIONS INDIA PVT LTD,Singapore,ENLIVE GLOBAL SOLUTIONS PVT. LTD,NEW DELHI,Providing software support and maintenance to the clients,4.78,0.07,
1613,FASTFILMZ MEDIA INDIA PRIVATE LIMITED,Singapore,FAST FILMZ SINGAPORE PTE LTD,BANGALORE,Other information technology and computer service activities n.e.c,6.38,0.10,
1614,SB FABCARE (S.B.FABRICS) PVT. LTD,Singapore,RB Investments Pte Ltd,MUMBAI,Washing and (dry-) cleaning of textile and fur products,10.13,0.16,
1615,JUNGA FARMGENICS PVT LTD,Singapore,INFRACO ASIA HYDROPONICS FARM PTE LTD,NEW DELHI,"Growing of asparagus, cabbages, cauliflower, broccoli, lettuce, chicory, spinach and other leafy or stem",14.02,0.22,
1616,ENLIVE SOLUTIONS INDIA PVT LTD,Singapore,ENLIVE GLOBAL SOLUTIONS PTE LTD,NEW DELHI,Providing software support and maintenance to the clients,5.64,0.09,
1617,ENLIVE SOLUTIONS INDIA PVT LTD,Singapore,ENLIVE GLOBAL SOLUTIONS PTE LTD,NEW DELHI,Providing software support and maintenance to the clients,4.13,0.06,
1618,ENLIVE SOLUTIONS INDIA,Singapore,ENLIVE GLOBAL,NEW DELHI,Providing software support and,1.28,0.02,
Sl. No,Name of Indian Company,Country,Name of Foreign Collaborator,RBI Regional Office,Item of Manufacture,Amount of FDI Inflows,,
,,,,,,"(In Rs million
)",(In US$ millio n),
,PVT LTD,,SOLUTIONS PTE LTD,,maintenance to the clients,,,
1619,ENLIVE SOLUTIONS INDIA PVT LTD,Singapore,ENLIVE GLOBAL SOLUTIONS PTE LTD,NEW DELHI,Providing software support and maintenance to the clients,4.17,0.06,
1620,ENLIVE SOLUTIONS INDIA PVT LTD,Singapore,ENLIVE GLOBAL SOLUTIONS PTE LTD,NEW DELHI,Providing software support and maintenance to the clients,0.06,0.00,
1621,HERITAGE RIVER JOURNEYS PVT LTD,Singapore,ANDMAS PTE LTD,NEW DELHI,"River cruise, water taxi, boat services",9.54,0.15,
1622,BRILLIANT ETOILE PRIVATE LIMITED,Singapore,"BRIGHT SUNSHINE SINGAPORE HOLDING
PTE LT",NEW DELHI,"Construction of buildings carried out on own-account basis or on a
fee or contract basis",100.00,1.54,
1623,EXPERION CAPITAL PRIVATE LIMITED,Singapore,AT HOLDING PTE. LTD.,KOLKATA,"Other financial service activities, except insurance and pension funding activities, n.e.c.",256.20,3.98,
1624,KENSATR INDIA PVT LTD,Singapore,EVERHOME HOLDINGS PTE LTD,NEW DELHI,"Manufacture of domestic electrothermic appliances such as electric water heaters, space
heaters, irons,",0.10,0.00,
1625,HARVEST FINTECH PVT LTD,Singapore,VINEET NAGRANI,MUMBAI,Activities auxiliary to financial service activities n.e.c.,3.25,0.05,
1626,HARVEST FINTECH PVT LTD,Singapore,VINEET NAGRANI,MUMBAI,Activities auxiliary to financial service activities n.e.c.,0.00,0.00,
1627,KRUGER VENTILATION INDUSTRIES (I) PVT LT,Singapore,KRUGER ASIA HOLDING PTE LTD,MUMBAI,"Manufacture of other general purpose machinery n.e.c. ( fans intended for industrial applications, exhaust",50.00,0.78,
1628,EXPERION CAPITAL PRIVATE LIMITED,Singapore,AT HOLDINGS PTE. LTD.,KOLKATA,"Other financial service activities, except insurance and pension
funding activities, n.e.c.",129.41,2.01,
1629,HARVEST FINTECH PVT LTD,Singapore,SHITAL BHAGVANJI RAIYANI AND NILESH SURE,MUMBAI,Activities auxiliary to financial service activities n.e.c.,1.65,0.03,
1630,AAIDEA SOLUTIONS PRIVATE LIMITED,Singapore,Zhongya Pte. Ltd.,NEW DELHI,Wholesale of other basic/manufactured food stuffs n.e.c.,0.09,0.00,
1631,LIFE VANTAGE INDIA PVT LTD,Singapore,LIFEVANTAGE ASIA PTE. LTD.,NEW DELHI,"Wholesale of toiletry, perfumery and cosmetics",0.10,0.00,
1632,GOOGLE CLOUD INDIA PRIVATE LIMITED,Singapore,GOOGLE ASIA PACIFIC PTE LTD,NEW DELHI,Other information technology and computer service activities n.e.c,481.04,7.47,
1633,VATIKA SOVEREIGN PARK PRIVATE LIMITED,Singapore,RECO FRONTIER 99 PVT. LTD,NEW DELHI,"Construction of buildings carried
out on own-account basis or on a fee or contract basis",31.02,0.48,
1634,STATKRAFT MARKETS PRIVATE LTD (EAR:SN PO,Singapore,SN POWER HOLDING SINGAPORE PTE LTD,NEW DELHI,"Collection and distribution of electric energy to households, industrial, commercial and other users",45.06,0.70,
1635,DR MANUFACTURING PRIVATE LIMITED,Singapore,DAMRO HOLDINGS PTE LTD,BANGALORE,Manufacture of furniture made of wood,18.04,0.28,
1636,INFOWEAVE ANALYTICS PRIVATE LIMITED,Singapore,DATAWEAVE PRIVATE LIMITED,BANGALORE,Data processing activities including report writing,12.94,0.20,
1637,SHENG LONG BIO- TECH(INDIA) PRIVATE LIMIT,Singapore,Lanking Nemo (SG) Pte Ltd,CHENNAI,Operation of fish hatcheries (marine),269.62,4.19,
1638,SHENG LONG BIO-,Singapore,Lanking Pte Ltd,CHENNAI,Operation of fish hatcheries,0.27,0.00,
Sl. No,Name of Indian Company,Country,Name of Foreign Collaborator,RBI Regional Office,Item of Manufacture,Amount of FDI Inflows,,
,,,,,,"(In Rs million
)",(In US$ millio n),
,TECH(INDIA) PRIVATE LIMIT,,,,(marine),,,
1639,SEI ADHAVAN POWER PRIVATE LIMITED,Singapore,SunEdison Energy Holding (Singapore) Pte,CHENNAI,Electric power generation using solar energy,27.33,0.42,
1640,SEI ADHAVAN POWER PRIVATE LIMITED,Singapore,SunEdison Energy Holding (Singapore) Pte,CHENNAI,Electric power generation using solar energy,66.90,1.04,
1641,LAKSHMI VILAS BANK LTD,Singapore,Various Investors,CHENNAI,Central banking,719.23,11.17,
1642,FM GLOBAL LOGISTICS INDIA PVT LTD,Singapore,M/s 1 Global Enterprises Pte Ltd,CHENNAI,Activities of shipping cargo agents,6.17,0.10,
1643,CRAFTSMAN AUTOMATION PVT LTD,Singapore,MARINA III (SINGAPORE) PTE LIMITED,CHENNAI,"Manufacture of motor vehicle electrical equipment, such as generators, alternators, spark plugs, ignition",6.68,0.10,
1644,POSH SYNERGY MARINE PVT LTD,Singapore,PACC Offshore Services Holdings Pte Ltd,CHENNAI,Other sea and coastal water transport n.e.c.,0.05,0.00,
1645,POSH SYNERGY MARINE PVT LTD,Singapore,PACC Offshore Services Holdings Pte Ltd,CHENNAI,Other sea and coastal water transport n.e.c.,0.89,0.01,
1646,ENERLIFE(INDIA) P LTD,Singapore,ENER LIFE PTE LTD,CHENNAI,"Manufacture of biscuits, cakes, pastries, rusks etc.",5.09,0.08,
1647,Dart Global Logistics Pvt Ltd( formlyDAR,Singapore,DGL Holdings Pte Ltd,CHENNAI,Cargo handling incidental to air transport,35.97,0.56,
1648,FM GLOBAL LOGISTICS INDIA PVT LTD,Singapore,M/s 1 Global Enterprises Pte Ltd,CHENNAI,Activities of shipping cargo agents,1.20,0.02,
1649,FM GLOBAL LOGISTICS INDIA PVT LTD,Singapore,M/s 1 Global Enterprises Pte Ltd,CHENNAI,Activities of shipping cargo agents,1.44,0.02,
1650,SEI TEJAS PVT LTD,Singapore,REFLEX SOLAR (S) PTE LTD,CHENNAI,Electric power generation using solar energy,9.65,0.15,
1651,VINTAGE COFFEE PVT LTD,Singapore,CHIN CORP HOLDING PTE LTD,HYDERABAD,"Coffee curing, roasting, grinding blending etc. and manufacturing of coffee products",10.68,0.17,
1652,INNER CHEF PRIVATE LIMITED,Singapore,MISTLETOE SINGAPORE PTE. LTD.,NEW DELHI,Manufacture of prepared meals and dishes,132.00,2.05,
1653,AMPSOLAR SOLUTION PRIVATE LIMITED,Singapore,AMPSOLAR ASIA HOLDINGS PTE LTD,NEW DELHI,Electric power generation using solar energy,33.00,0.51,
1654,JWALA ENERGY RESOURCES PRIVATE LIMITED,Singapore,GAUTAM KUNZRU,NEW DELHI,"Wholesale of solid, liquid and gaseous fuels and related products",7.33,0.11,
1655,RISHI NARAIN GOLF MANAGEMENT PVT LTD,Singapore,ANUJ HARSHADBHAI ZINZUWADIA,NEW DELHI,Operation of sports faci,1.50,0.02,
1656,BUSYBEES LOGISTICS SOLUTIONS PVT LTD,Singapore,ALIBABA.COM SINGAPORE E- COMMERCE PVT LTD,MUMBAI,Courier activities,"2,246.3
9",34.90,
1657,FIRESTAR INTERNATIONAL PVT LTD,Singapore,ISLINGTON INTERNATIONAL HOLDINGS PTE LTD,MUMBAI,"Manufacture of jewellery of gold, silver and other precious or base metal metal clad with precious
metals",24.68,0.38,
1658,PIPA BELLA ACCESSORIES PRIVATE LIMITED,Singapore,PIPA BELLA PTE LTD,MUMBAI,Wholesale trade via e-commerce excluding activities of commission agents,0.57,0.01,
1659,PIPA BELLA ACCESSORIES PRIVATE LIMITED,Singapore,PIPA BELLA PTE LTD,MUMBAI,"Wholesale trade via e-commerce
excluding activities of commission agents",0.64,0.01,
1660,PIPA BELLA ACCESSORIES,Singapore,PIPA BELLA PTE LTD,MUMBAI,Wholesale trade via e-commerce,0.96,0.01,
Sl. No,Name of Indian Company,Country,Name of Foreign Collaborator,RBI Regional Office,Item of Manufacture,Amount of FDI Inflows,,
,,,,,,"(In Rs million
)",(In US$ millio n),
,PRIVATE LIMITED,,,,excluding activities of commission agents,,,
1661,PIPA BELLA ACCESSORIES PRIVATE LIMITED,Singapore,PIPA BELLA PTE LTD,MUMBAI,Wholesale trade via e-commerce excluding activities of commission agents,0.54,0.01,
1662,BAY TREE VENTURES PVT LTD,Singapore,ANURADHA BAJAJ,MUMBAI,Web hosting activities,0.05,0.00,
1663,BAY TREE VENTURES PVT LTD,Singapore,ANURADHA BAJAJ,MUMBAI,Web hosting activities,2.45,0.04,
1664,YARA  FERTILIZERS INDIA PVT LTD,Singapore,YARA ASIA PTE LTD,MUMBAI,Wholesale of fertilizers and agrochemical products,650.00,10.10,
1665,SMINQ INDIA SOLUTIONS PVT LTD,Singapore,BEENEXT2 PTE LTD,MUMBAI,Other reservation service and related activities,22.08,0.34,
1666,SMINQ INDIA SOLUTIONS PVT LTD,Singapore,BEENEXT2 PTE LTD,MUMBAI,Other reservation service and related activities,2.45,0.04,
1667,BHARAT MUMBAI CONTAINER TERMINALS PVT LT,Singapore,PSA BHARAT INVESTMENTS PTE LTD,MUMBAI,Cargo handling incidental to water transport,"2,419.4
4",37.58,
1668,"BHARAT MUMBAI CONTAINER TERMINALS PVT
LT",Singapore,PORTPLUS PTE LTD,MUMBAI,Cargo handling incidental to water transport,"1,897.6
0",29.48,
1669,BHARAT MUMBAI CONTAINER TERMINALS PVT LT,Singapore,EQUI-LEASE PTE LTD,MUMBAI,Cargo handling incidental to water transport,426.96,6.63,
1670,MERCK LIFE SCIENCES PVT LTD,Singapore,SIGMA-ALDRICH CHEMICALS PTE LTD,MUMBAI,"Wholesale of industrial chemicals,",154.21,2.40,
1671,NEXTGEN PROJECT MANAGEMENT SYSTEMS PVT L,Singapore,THE POETZSCHER-RAO FAMILY TRUST,MUMBAI,Other business support service activities n.e.c.,15.08,0.23,
1672,GOOMO HOLDINGS SERVICES INDIA PVT LTD,Singapore,Goomo Holdings Pte Ltd,MUMBAI,Travel agency activities,31.95,0.50,
1673,RFE BELGAUM SOLAR PRIVATE LIMITED,Singapore,AMPsolar Asia Holdings Pte. Ltd.,JAIPUR,Electric power generation using solar energy,281.27,4.37,
1674,AMPSOLAR INDIA PRIVATE LIMITED,Singapore,AMPSOLAR ASIA HOLDINGS PTE LTD,NEW DELHI,Electric power generation using solar energy,13.00,0.20,
1675,SOUTH INDIA KRISHNA OIL AND FATS PVT LTD,Singapore,SOUTH INDIA OILS & FATS PTE LTD,NEW DELHI,Manufacture of hydrogenated oil and vanaspati ghee,321.07,4.99,
1676,M/S SEALY INDIA TRADING PVT LTD,Singapore,SEALY INDIA (HOLDING) PVT LTD,NEW DELHI,Wholesale of furniture and fixtures,3.24,0.05,
1677,KINDORAMA HEALTHCARE PVT. LTD.,Singapore,KINDORAMA PTE LTD.,KOCHI,Hospital activities,35.55,0.55,
1678,M/S AMAZON IT SERVICES INDIA PVT LTD,Singapore,AMAZON ASIA PACIFIC HOLDINGS PRIVATE LIM,BANGALORE,Other information technology and computer service activities n.e.c,"2,619.7
4",40.29,
1679,ENERGON SOLEQ RAVI INDIA POWER RESOURCES,Singapore,ENERGON SOLAR INDIA RENEWABLES PTE LTD,BANGALORE,Electric power generation using solar energy,29.90,0.46,
1680,"PHONEPE PRIVATE LIMITED
(Earlier-FX MART",Singapore,FLIPKART PAYMENTS PVT LTD.,NEW DELHI,Activities auxiliary to financial service activities n.e.c.,"2,544.4
0",39.98,
1681,BOEING INDIA SERVICES PRIVATE LIMITED,Singapore,BOEING SINGAPORE PTE. LTD,NEW DELHI,Other business support service activities n.e.c.,"1,280.4
0",20.12,
1682,HOLIDAY TRIANGLE TRAVEL PRIVATE LIMITED,Singapore,RB INVESTMENTS PTE LTD.,NEW DELHI,"Other data processing, hosting and related activities n.e.c.",58.49,0.92,
1683,APU PACKAGING INDIA PVT LTD,Singapore,APU HOLDINGS PTE LTD,NEW DELHI,Manufacture of plastic articles for the packing of goods (plastic,0.05,0.00,
Sl. No,Name of Indian Company,Country,Name of Foreign Collaborator,RBI Regional Office,Item of Manufacture,Amount of FDI Inflows,,
,,,,,,"(In Rs million
)",(In US$ millio n),
,,,,,"bags, sacks, containers, boxes, cases,",,,
1684,MERA GAO MICRO GRID POWER PRIVATE LIMITE,Singapore,MICRO GRID POWER GLOBAL PTE LTD,NEW DELHI,Electric power generation using solar energy,9.26,0.15,
1685,RISING SUN ENERGY PRIVATE LIMITED,Singapore,CHARISMA ENERGY SERVICES LTD.,NEW DELHI,Electric power generation using solar energy,0.02,0.00,
1686,RISING SUN ENERGY PRIVATE LIMITED,Singapore,BHADLA SOLAR INVESTMENTS PTE LTD.,NEW DELHI,Electric power generation using solar energy,0.07,0.00,
1687,SEI ADITYASHAKTHI PVT LTD,Singapore,Sunedison Energy Holdings Singapore PTE,CHENNAI,Electric power generation using solar energy,144.49,2.27,
1688,AMPSOLAR INDIA PRIVATE LIMITED,Singapore,AMPSOLAR ASIA HOLDINGS PTE. LTD.,NEW DELHI,Electric power generation using solar energy,12.00,0.19,
1689,BLISS INNS PRIVATE LIMITED,Singapore,RB INVESTMENTS PTE LTD,NEW DELHI,"Hotels and Motels, inns, resorts providing short term lodging facilities includes
accommodation in house",22.50,0.35,
1690,MM INTERWORK TECHNOLOGIES PRIVATE LIMITE,Singapore,Balsa Fareast Pte ltd,CHENNAI,"Writing , modifying, testing of computer program to meet the needs of a particular client excluding web-page",0.03,0.00,
1691,KOMATSU INDIA PVT LTD,Singapore,Komatsu Asia & Pacific Pte Ltd,CHENNAI,"Manufacture of other machinery
for mining, quarrying and construction n.e.c.","1,500.0
0",23.57,
1692,ABSOLUTE BARBEQUE PRIVATE LIMITED,Singapore,General Atlantic Singapore AB Pte Ltd,CHENNAI,Bars and Restaurants with bars,700.00,11.00,
1693,NUTECH SURVEYORS & ANALYSTS PRIVATE LIMI,Singapore,leon overseas Pte Ltd,CHENNAI,Technical testing and analysis,9.60,0.15,
1694,PREMIUM MEDICAL AND HEALTHCARE PROVIDERS,Singapore,kef healthcare services pte ltd,CHENNAI,Hospital activities,25.50,0.40,
1695,BLISS INNS PRIVATE LIMITED,Singapore,RB INVESTMENTS PTE LTD.,NEW DELHI,"Hotels and Motels, inns, resorts providing short term lodging facilities includes accommodation in house",10.00,0.16,
1696,RISING SUN ENERGY PRIVATE LIMITED,Singapore,SUNSEAP INTERNATIONAL PTE LTD,NEW DELHI,Electric power generation using solar energy,0.01,0.00,
1697,FAIRASSETS TECHNOLOGIES INDIA PRIVATE LI,Singapore,M&S PARTNERS PTE LTD,NEW DELHI,Other monetary intermediation services n.e.c.,0.01,0.00,
1698,FAIRASSETS TECHNOLOGIES INDIA PRIVATE LI,Singapore,M & S PARTNERS PTE LTD,NEW DELHI,Other monetary intermediation services n.e.c.,6.49,0.10,
1699,TRACK MY BEAT HEALTHCARE ( INDIA)PVT. LT,Singapore,HARI SHANKARANARAYANA N,NEW DELHI,"Other human health activities
n.e.c. (including independent ambulance activities)",0.72,0.01,
1700,G C BEVERAGES PRIVATE LIMITED,Singapore,VISVIRES INDIAN CONSUMERS PTE LTD.,NEW DELHI,Manufacture of mineral water,57.54,0.90,
1701,IBIBO GROUP PRIVATE LIMITED,Singapore,IBIBO GROUP HOLDINGS (SINGAPORE) PTE LTD,NEW DELHI,Travel agency activities,653.50,10.27,
1702,ATI FREIGHT PVT LTD,Singapore,ATI FREIGHT PTE LTD,MUMBAI,Freight air transport services,56.05,0.88,
1703,ATI FREIGHT PVT LTD,Singapore,VAYU TRADING PTE LTD,MUMBAI,Freight air transport services,101.93,1.60,
1704,MATCHMOVE INDIA PRIVATE LIMITED,Singapore,MATCHMOVE PAY PTE LTD,MUMBAI,Other information technology and computer service activities,5.00,0.08,
Sl. No,Name of Indian Company,Country,Name of Foreign Collaborator,RBI Regional Office,Item of Manufacture,Amount of FDI Inflows,,
,,,,,,"(In Rs million
)",(In US$ millio n),
,,,,,n.e.c,,,
1705,DIPON GAS AND INFRASTRUCTURE PVT LTD,Singapore,DG INFRATECH PTE LTD,MUMBAI,Construction of buildings carried out on own-account basis or on a fee or contract basis,3.76,0.06,
1706,TG TERMINAL PVT LTD,Singapore,BLPL SINGAPORE PTE LTD,MUMBAI,Service activities incidental to water transportation,98.00,1.54,
1707,MATCHMOVE INDIA PRIVATE LIMITED,Singapore,MATCHMOVE PAY PTE LTD,MUMBAI,Other information technology and computer service activities n.e.c,5.00,0.08,
1708,CITADINES OMR APARTHOTEL PVT LTD.,Singapore,Ascott International Management Pte lTd,CHENNAI,"Hotels and Motels, inns, resorts providing short term lodging facilities includes
accommodation in house",100.00,1.57,
1709,PREMIUM MEDICAL AND HEALTHCARE PROVIDERS,Singapore,kef healthcare services pte ltd,CHENNAI,Hospital activities,142.00,2.23,
1710,ENERLIFE(INDIA) P LTD,Singapore,enerlife pte ltd,CHENNAI,"Manufacture of biscuits, cakes, pastries, rusks etc.",100.72,1.58,
1711,SEI ADITYASHAKTHI PVT LTD,Singapore,Sunedison Energy Holding (Singapore) Pte,CHENNAI,Electric power generation using solar energy,31.85,0.50,
1712,SEI ENERSTAR RENEWABLE ENERGY PRIVATE LI,Singapore,SUnedison Energy Holding Singapore Pte L,CHENNAI,Electric power generation using solar energy,0.10,0.00,
1713,SINGAPORE REALTY PVT.LTD,Singapore,lee kim tah enterprise pte ltd,CHENNAI,Construction of buildings carried out on own-account basis or on a fee or contract basis,45.92,0.72,
1714,OMNI-CREST ENGINEERING AND CONSTRUCTION,Singapore,NG Kin Nam ( Wu Jiannan),CHENNAI,Other site preparation activities n.e.c.,0.06,0.00,
1715,OMNI-CREST ENGINEERING AND CONSTRUCTION,Singapore,Murugaiyan Senthil Nathan,CHENNAI,Other site preparation activities n.e.c.,0.04,0.00,
1716,LEWEK ALTAIR SHIPPING PVT LTD,Singapore,TUNIS OIL PTE LTD,HYDERABAD,Sea and coastal freight water transport,3.84,0.06,
1717,AVA LIFESTYL PRODUCTS & SERVICES PVT LTD,Singapore,THINKUVATE RENTICKLE PTE LTD.,NEW DELHI,"Renting of tent, furniture, pottery and glass, kitchen and tableware, utensils, household electrical",10.00,0.16,
1718,M/S BAYPARK HOTEL & RESORTS PVT LTD,Singapore,Asian Developers Pte Ltd,HYDERABAD,"Hotels and Motels, inns, resorts providing short term lodging facilities includes accommodation in house",32.70,0.51,
1719,NSL MINING RESOURCES INDIA PVT. LTD.,Singapore,I -S IRON ORE PTE LTD,HYDERABAD,Mining of iron ores,20.28,0.32,
1720,NSL MINING RESOURCES INDIA PVT. LTD.,Singapore,I-S IRON ORE PTE LTD,HYDERABAD,Mining of iron ores,14.66,0.23,
1721,NSL MINING RESOURCES INDIA PVT. LTD.,Singapore,I-S IORN ORE PTE LTD,HYDERABAD,Mining of iron ores,11.66,0.18,
1722,CARGO EXCHANGE INDIA PVT LTD,Singapore,ANTHILL SCALE VENTURES PTE LTD,HYDERABAD,Cargo handling incidental to land transport,3.20,0.05,
1723,NSL MINING RESOURCES INDIA PVT. LTD.,Singapore,I-S IRON ORE PTE LTD,HYDERABAD,Mining of iron ores,13.46,0.21,
1724,KCI MEDICAL INDIA PVT LTD,Singapore,KCI MEDICAL ASIA PTE LTD.,NEW DELHI,"Wholesale of scientific, medical and surgical machinery and equipment",130.00,2.04,
1725,BLUE BOOK BANGALORE PRIVATE LIMITED,Singapore,LETS VENTURE ONLINE PTE LTD,BANGALORE,Other information service activities n.e.c.,0.06,0.00,
Sl. No,Name of Indian Company,Country,Name of Foreign Collaborator,RBI Regional Office,Item of Manufacture,Amount of FDI Inflows,,
,,,,,,"(In Rs million
)",(In US$ millio n),
1726,BLUE BOOK BANGALORE PRIVATE LIMITED,Singapore,THOLONS PTE LTD,BANGALORE,Other information service activities n.e.c.,0.22,0.00,
1727,M/S ALTRAN TECHNOLOGIES (EAR ALLIAN INDI,Singapore,ALTRAN SINGAPORE PTE LTD,BANGALORE,"Other professional, scientific and technical activities n.e.c.","2,625.0
0",41.25,
1728,AGRIGENOME LABS PVT LTD,Singapore,EMERGE VENTURES PTE LTD,HYDERABAD,"Research and experimental
development on natural sciences and engineering",18.96,0.30,
1729,FORMICA LAMINATES INDIA PVT LTD,Singapore,Formica (Singapore) Pte Ltd,AHMEDABAD,Manufacture of other paper products n.e.c.,192.48,3.02,
1730,INTERGLOBE HOTEL PVT LTD,Singapore,AAPC SINGAPORE PTE. LTD.,NEW DELHI,"Hotels and Motels, inns, resorts providing short term lodging facilities includes
accommodation in house",100.00,1.57,
1731,CREDO MINERAL INDUSTRIES LIMITED,Singapore,Chem Asia Technologies Pte Ltd,AHMEDABAD,Manufacture of basic chemical elements,61.63,0.95,
1732,RYOYO ELECTRO INDIA PRIVATE LIMITED,Singapore,RYOYO ELECTRO SINGAPORE PTE LTD,BANGALORE,Other business support service activities n.e.c.,45.00,0.71,
1733,ZENTRON LABS PRIVATE LTD.,Singapore,T AND V HOLDINGS PTE LTD,BANGALORE,Manufacture of other electronic components n.e.c,28.30,0.44,
1734,BPL MEDICAL TECHNOLOGIES PVT LTD,Singapore,MBD BRIDGE STREET 2016 INVESTMENTS (SING,BANGALORE,"Manufacture of irradiation, electromedical and electrotherapeutic equipment",10.00,0.16,
1735,MANIPAL CITY & GUILDS PVT LTD (MANIPAL C,Singapore,CITY AND GUILDS ASIA PTE LTD,BANGALORE,Other educational services n.e.c.,4.00,0.06,
1736,MANIPAL CITY & GUILDS PVT LTD (MANIPAL C,Singapore,CITY AND GUILDS ASIA PTE LTD,BANGALORE,Technical and vocational education below the level of higher education except for handicapped,3.96,0.06,
1737,MANIPAL CITY & GUILDS PVT LTD (MANIPAL C,Singapore,CITY AND GUILDS ASIA PTE LTD,BANGALORE,Technical and vocational education below the level of higher education except for handicapped,4.81,0.08,
1738,MANIPAL CITY & GUILDS PVT LTD (MANIPAL C,Singapore,CITY AND GUILDS ASIA PTE LTD,BANGALORE,Technical and vocational education below the level of higher education except for handicapped,8.16,0.13,
1739,MANIPAL CITY & GUILDS PVT LTD (MANIPAL C,Singapore,CITY AND GUILDS ASIA PTE LTD,BANGALORE,"Technical and vocational education below the level of higher education except for
handicapped",12.24,0.19,
1740,FRESHTOHOME FOODS PRIVATE LIMITED,Singapore,FRESHTOHOME PTE LTD,BANGALORE,Operation of web sites that use a search engine to generate and maintain extensive databases of internet,129.53,2.04,
1741,"ARCHETYPE ENTERTAINMENT PRIVATE
LIMITED",Singapore,ANNPRASH PTE LTD,BANGALORE,Other amusement and recreation activities n.e.c.,1.85,0.03,
1742,FULLERTON INDIA CREDIT COM. LTD.,Singapore,"Angelica Investment PTE Ltd.,",CHENNAI,Other credit granting,"1,500.0
0",23.57,
